,source_id,source_name,author,title,description,url,url_to_image,published_at,content,top_article,engagement_reaction_count,engagement_comment_count,engagement_share_count,engagement_comment_plugin_count
25,business-insider,Business Insider,Jeremy Berke,"CULTIVATED: Leafly reins in spending, 1906 pulls in an $18 million funding round, and more","Welcome to Cultivated, our weekly newsletter where we're bringing you an inside look at the deals, trends, and personalities driving the multibillion-dollar global cannabis boom. Sign up here to get it in your inbox every week. Happy Friday everyone, There wa…",https://www.businessinsider.com/cultivated-week-november-1-newsletter-2019-10,https://image.businessinsider.com/5dbc57f62f364a68c87538c3?width=1200&format=jpeg,2019-11-01T16:36:00Z,"Welcome to Cultivated, our weekly newsletter where we're bringing you an inside look at the deals, trends, and personalities driving the multibillion-dollar global cannabis boom. Sign up here to get it in your inbox every week.
Happy Friday everyone,
There … [+5372 chars]",0,0.0,0.0,1637.0,0.0
22,cnn,CNN,"Celine Ramseyer and Matias Grez, CNN",Rugby World Cup final predictions: Animal edition,"While many have England down as not-so-slight favorites for Saturday's Rugby World Cup final against South Africa, it is anything but a foregone conclusion.",https://edition.cnn.com/2019/11/01/sport/rugby-world-cup-final-england-south-africa-spt-intl/index.html,https://cdn.cnn.com/cnnnext/dam/assets/191101132305-rugby-world-cup-predictions-animals-super-tease.jpg,2019-11-01T16:07:42Z,,0,3.0,2.0,16.0,0.0
11,business-insider,Business Insider,Grace Panetta,"Biden's campaign is in crisis mode in Iowa, New Hampshire - Business Insider",Biden's polling numbers have significantly faltered in Iowa and New Hampshire and he trails his progressive rivals in support and fundraising.,http://www.businessinsider.com/bidens-campaign-crisis-mode-iowa-new-hampshire-2019-11,https://image.businessinsider.com/5dbc34bae0ee7e38306c83c9?width=1200&format=jpeg,2019-11-01T15:54:19Z,"A little over three months out from the Iowa and New Hampshire caucuses and primaries, former Vice President Joe Biden's campaign appears to be verging on the edge of crisis mode in the first two early voting states. 
Biden entered the race as the presumptiv… [+4082 chars]",1,0.0,0.0,0.0,0.0
21,cnn,CNN,"Brandon Killman, CNN","To watch the International Space Station go by, all you need is clear skies and the schedule","While the International Space Station moves quickly, it orbits the Earth 16 times a day, giving space gawkers several chances to wave hello to their neighbors traveling in the thermosphere overhead.",https://www.cnn.com/2019/11/01/seo-planning/how-to-see-international-space-station-scn/index.html,https://cdn.cnn.com/cnnnext/dam/assets/191016082439-02-international-space-station-super-tease.jpg,2019-11-01T16:14:07Z,"(CNN)The International Space Station orbits the Earth 16 times a day, giving space gawkers several chances to wave to their neighbors in the thermosphere. Because of its relatively close proximity to Earth, it can be viewed with few resources and the right ti… [+2072 chars]",0,0.0,0.0,7.0,0.0
54,abc-news,ABC News,The Associated Press,"Loughlin, Giannulli to fight new charges in admissions case","""Full House"" actress Lori Loughlin and her fashion designer husband say they're fighting the latest charges against them in the college admissions scandal",https://abcnews.go.com/Entertainment/wireStory/loughlin-giannulli-fight-charges-admissions-case-66688114,,2019-11-01T14:26:13Z,"""Full House"" actress Lori Loughlin and her fashion designer husband are contesting the latest charges against them in the college admissions scandal.
Lawyers for Loughlin and Mossimo Giannulli filed court documents Friday saying the couple plans to plead not… [+575 chars]",0,0.0,0.0,0.0,0.0
36,reuters,Reuters,Jennifer Hiller,"Exxon, Chevron earnings fall on lower oil and gas prices",Exxon Mobil Corp and Chevron Corp on Friday posted sharply lower quarterly results despite increases in oil and gas production as lower energy prices soured results for most oil majors.,https://in.reuters.com/article/uk-usa-oil-results-idINKBN1XB4MA,https://s2.reutersmedia.net/resources/r/?m=02&d=20191101&t=2&i=1447363659&w=1200&r=LYNXMPEFA036H,2019-11-01T16:08:54Z,"HOUSTON (Reuters) - Exxon Mobil Corp (XOM.N) and Chevron Corp (CVX.N) on Friday posted sharply lower quarterly results despite increases in oil and gas production as lower energy prices soured results for most oil majors. 
The two U.S. oil majors credited hi… [+2498 chars]",0,0.0,0.0,0.0,0.0
38,newsweek,Newsweek,Alexandra Hutzler,"Fox News Judge Says 'Proof' in Trump Impeachment Inquiry Is 'Undisputed,' Despite President's 'Hoax' Claims","""One can see that the reason Republicans have been attacking the process of impeachment is largely because there is no credible defense to the proof of impeachment,"" Andrew Napolitano said.",https://www.newsweek.com/fox-news-judge-proof-trump-impeachment-inquiry-undisputed-1469212,https://d.newsweek.com/en/full/1541913/andrew-napolitano-fox-news-op-ed-impeachment.jpg,2019-11-01T14:27:17Z,"Fox News' Judge Andrew Napolitano said that the proof of President Donald Trump's potentially impeachable offenses is largely undisputed and that congressional Republicans have no credible line of defense to protect him.
Napolitano reflected on the ongoing i… [+3529 chars]",0,727.0,143.0,296.0,0.0
11,the-irish-times,The Irish Times,The Irish Times,1933 Traffic Act has been overtaken,"Sir, – Frank Cullinane (Letters, October 30th) needs to keep up to date. The Road Traffic Act 1933 which he quotes was repealed in its entirety by the Road Traffic Act 1961. – Yours, etc, GERARD CLARKE, Dundrum Dublin 16",https://www.irishtimes.com/opinion/letters/1933-traffic-act-has-been-overtaken-1.4068356,https://www.irishtimes.com/polopoly_fs/1.3619339.1536160376!/image/image.jpg,2019-11-01T17:02:00Z,"Sir, Frank Cullinane (Letters, October 30th) needs to keep up to date. The Road Traffic Act 1933 which he quotes was repealed in its entirety by the Road Traffic Act 1961. Yours, etc,
GERARD CLARKE,
Dundrum Dublin 16",0,0.0,0.0,0.0,0.0
10,cbs-news,CBS News,Grace Segers,Sanders condemns private equity firm amid staff exodus at Deadspin,Sanders tweeted his support for several reporters and editors who resigned in protest of new owner G/O Media,https://www.cbsnews.com/news/after-deadspin-reporters-resign-bernie-sanders-condemns-private-equity-firm-in-tweet/,https://cbsnews3.cbsistatic.com/hub/i/r/2019/10/23/16275a12-988d-496b-845a-7ac47b2f6c4a/thumbnail/1200x630/08a8c174b7ad074a7d623866c51cc413/cbsn-fusion-will-congresswoman-rashida-tlaib-endorse-bernie-sanders-thumbnail-382979-640x360.jpg,2019-11-01T16:43:50Z,"Senator Bernie Sanders showed his allegiance to workers rights extends to journalists with a tweet expressing support for reporters and editors who resigned from the news outlet Deadspin this week. Deadspin is a property of G/O Media, which is owned by privat… [+2577 chars]",0,1.0,0.0,6.0,0.0
27,the-irish-times,The Irish Times,Dominic Coyle,Unions again reject Pfizer pension plan reform,Workers at neighbouring Cork plants divided on merit of new arrangements,https://www.irishtimes.com/business/health-pharma/unions-again-reject-pfizer-pension-plan-reform-1.4069368,https://www.irishtimes.com/image-creator/?id=1.4069366&origw=1440,2019-11-01T14:54:53Z,"A second trade union at US pharma giant Pfizers Ringaskiddy plant has voted against plans to reform the companys pension plan.
The decision throws the long-term future of the plant, which employs close to 800 people, into doubt.
Members of the Connect trade… [+868 chars]",0,0.0,0.0,0.0,0.0
81,bbc-news,BBC News,BBC News,Blade Runner's vision of tech in November 2019,"The cult classic was set in today's world, but how many futuristic predictions did it get right?",http://www.bbc.co.uk/news/technology-50247479,https://ichef.bbci.co.uk/news/1024/branded_news/BD9A/production/_109483584_fcf5a147-90e3-4462-9eb9-277ff2b241bd.jpg,2019-11-01T12:31:42Z,"Image caption
 Blade Runner was set in November 2019. Harrison Ford plays the main character Rick Deckard
It's November 2019 and Los Angeles is in a state of urban decay. The population has dwindled, and humans face a new threat from manufactured biological… [+8952 chars]",1,0.0,0.0,0.0,0.0
43,cnn,CNN,"Lisa Respers France, CNN",Mariah Carey's 'All I Want For Christmas Is You' celebrates 25 years being an earworm,Try to read this story and not hear the song in your head.,https://www.cnn.com/2019/11/01/entertainment/mariah-carey-christmas-song-trnd/index.html,https://cdn.cnn.com/cnnnext/dam/assets/171226130119-mariah-carey-all-i-want-for-christmas-super-tease.jpg,2019-11-01T14:17:11Z,,0,49.0,12.0,48.0,0.0
43,the-irish-times,The Irish Times,The Irish Times,"Man settles case over ‘fall on stairs’ after Christmas party for €550,000",Co-workers thought Edmund O’Shea (61) sleeping off effects of drink when found in hallway,https://www.irishtimes.com/							/news/crime-and-law/courts/high-court/man-settles-case-over-fall-on-stairs-after-christmas-party-for-550-000-1.4069514	,https://www.irishtimes.com/image-creator/?id=1.4069513&origw=1440,2019-11-01T16:18:16Z,"A man who ended up with a serious head injury after allegedly falling on stairs when he stayed over at a colleagues house after an office Christmas party has settled his High Court action for 550,000.
Edmund OShea, it was alleged, was intoxicated and others … [+2478 chars]",1,,,,
70,abc-news,ABC News,The Associated Press,Markets Right Now: Job gains send stocks higher,"Stocks are opening with solid gains on Wall Street following a strong jobs report for October, putting the S&P 500 on track for its fourth straight weekly gain.",https://abcnews.go.com/Business/wireStory/markets-now-job-gains-send-stocks-higher-66687433,,2019-11-01T13:45:09Z,"The latest on developments in financial markets (all times local):
9:35 a.m.
Stocks are opening with solid gains on Wall Street following a strong jobs report for October, putting the S&amp;P 500 on track for its fourth straight weekly gain.
Banks, health … [+604 chars]",0,0.0,0.0,0.0,0.0
9,the-wall-street-journal,The Wall Street Journal,,New Satellites Could End Internet Deserts,"The most reliable streaming providers have typically used cable to deliver content. But that’s all changing with the launch of new and better satellites that could one day give us 5G, low latency data. The Wall Street Journal speaks with the Chief of the Inte…",https://www.wsj.com/video/new-satellites-could-end-internet-deserts/98FF4083-CDA2-49F1-92AB-9101BC56434E.html,http://m.wsj.net/video/20191101/v9satellites/v9satellites_1280x720.jpg,2019-11-01T08:30:00Z,,0,0.0,1.0,8.0,0.0
57,abc-news,ABC News,The Associated Press,"Google buys Fitbit for $2.1B, stepping back into wearables","Get breaking national and world news, broadcast video coverage, and exclusive interviews. Find the top news online at ABC news.",https://abcnews.go.com/Health/wireStory/google-buys-fitbit-21b-stepping-back-wearables-66688068,https://s.abcnews.com/images/Business/WireAP_2fcd9825eb7149cbb7f2bae683179e93_16x9_992.jpg,2019-11-01T14:23:56Z,"Fitbit is being acquired by Google's parent company for about $2.1 billion, a deal that enables the internet company to step back into the hotly contested market for smartwatches and health and fitness trackers.
Fitbit is a pioneer in wearable technology, bu… [+2246 chars]",0,1.0,5.0,2.0,0.0
56,cbs-news,CBS News,CBS News,Immunotherapy: A new weapon against cancer,"Dr. Jon LaPook introduces us to the next frontier of cancer treatment: immunotherapy, in which the body's own immune system is genetically modified to detect and destroy cancer cells.",https://www.cbsnews.com/video/immunotherapy-a-new-weapon-against-cancer/,https://cbsnews1.cbsistatic.com/hub/i/r/2019/11/01/59eeec28-2fb7-4979-b409-4d30ef17d009/thumbnail/1200x630/68c2cb84ef07cfa72094951b41f7117e/sunmo-lapook-0312-1267986-640x360.jpg,2019-11-01T12:28:37Z,,0,0.0,0.0,2.0,0.0
67,bbc-news,BBC News,,Rugby World Cup final: Ross Kemp’s England team talk,The actor and presenter's words of encouragement before England's Rugby World Cup final against South Africa on Saturday.,https://www.bbc.co.uk/sport/av/rugby-union/50265937,https://m.files.bbci.co.uk/modules/bbc-morph-sport-page/3.3.2/images/bbc-sport-logo.png,2019-11-01T13:34:14Z,"Actor and presenter Ross Kemp has been avidly following the England teams progress during the Rugby World Cup, with some passionate tweets during matches.
So 5 Live Breakfast asked him to record a team talk ahead of Saturdays final against South Africa in To… [+124 chars]",0,234.0,78.0,36.0,0.0
16,business-insider,Business Insider,Aria Bendix,Morgan Museum and Library tour: photos of $900 million art collection - Business Insider,"The Morgan Library and Museum in New York City houses the art collection of JP Morgan, who founded the banking firm now called JPMorgan Chase & Co.",http://www.businessinsider.com/morgan-museum-and-library-tour-photos-art-collection-2019-10,https://image.businessinsider.com/5db73a0bdee01931e159af48?width=1200&format=jpeg,2019-11-01T12:20:00Z,"From the outside, the Morgan Library and Museum doesn't look like a space that would house three Gutenberg Bibles, letters from George Washington and Abraham Lincoln, and a manuscript from Mozart.
The museum complex, which spans half a city block in midtown … [+1204 chars]",1,0.0,0.0,0.0,0.0
38,the-irish-times,The Irish Times,Mary Carolan,Actions by brain-dead pregnant woman’s family against HSE to go to mediation,‘Ms P’ was kept on life support for four weeks due to concerns about Eighth Amendment,https://www.irishtimes.com/news/crime-and-law/courts/high-court/actions-by-brain-dead-pregnant-woman-s-family-against-hse-to-go-to-mediation-1.4069304,https://www.irishtimes.com/image-creator/?id=1.4069303&origw=1440,2019-11-01T13:09:48Z,"A High Court judge has directed a mediation of actions brought against the HSE by the family of a brain-dead pregnant woman kept on life support for almost four weeks due to concerns about the Eighth Amendment. 
The family of the 26-year-old woman, known as … [+3156 chars]",0,2.0,1.0,3.0,0.0
50,reuters,Reuters,Reuters Editorial,Dimitrov eases past Garin to reach Paris semi-finals,Grigor Dimitrov's solid run at the Paris Masters continued when the Bulgarian saw off Chile's Cristian Garin 6-2 7-5 to reach the semi-finals on Friday.,https://www.reuters.com/article/us-tennis-paris-idUSKBN1XB4JT,https://s4.reutersmedia.net/resources/r/?m=02&d=20191101&t=2&i=1447357417&w=1200&r=LYNXMPEFA034Z,2019-11-01T15:44:38Z,"PARIS (Reuters) - Grigor Dimitrov’s solid run at the Paris Masters continued when the Bulgarian saw off Chile’s Cristian Garin 6-2 7-5 to reach the semi-finals on Friday. 
Dimitrov, who had been struggling since being beaten in the U.S. Open semi-final in Se… [+1152 chars]",0,0.0,0.0,4.0,0.0
60,abc-news,ABC News,The Associated Press,US manufacturing contracts for third straight month,"Get breaking national and world news, broadcast video coverage, and exclusive interviews. Find the top news online at ABC news.",https://abcnews.go.com/US/wireStory/us-manufacturing-contracts-straight-month-66687886,https://s.abcnews.com/images/US/WireAP_616dfa3ba6c349168a9d951eeb12609a_16x9_992.jpg,2019-11-01T14:14:03Z,"U.S. manufacturing output dropped for the third straight month in October as trade tensions and a slowing global economy took a toll on American factories.
The Institute for Supply Management, an association of purchasing managers, said Friday that its manuf… [+552 chars]",0,0.0,0.0,1.0,0.0
20,cnn,CNN,"Bob Crowley, CNN","Saoirse Kennedy Hill, granddaughter of Robert F. Kennedy, died of accidental overdose, death certificate says","A granddaughter of Robert F. Kennedy died of an accidental overdose, according to her death certificate filed Friday in Massachusetts.",http://us.cnn.com/2019/11/01/politics/saoirse-kennedy-hill-granddaughter-robert-kennedy-death-certificate/index.html,https://cdn.cnn.com/cnnnext/dam/assets/190803112347-09-saoirse-kennedy-hill-super-tease.jpg,2019-11-01T17:28:38Z,"(CNN)A granddaughter of Robert F. Kennedy died of an accidental overdose, according to her death certificate filed Friday in Massachusetts. 
Saoirse Kennedy Hill, 22, was the daughter of Courtney Kennedy Hill, one of the 11 children of the late presidential … [+1496 chars]",1,0.0,0.0,0.0,0.0
62,bbc-news,BBC News,,T20 World Cup Qualifier: Netherlands defeat Ireland by 21 runs in Dubai,Ireland fall short of their 159-run target as the Netherlands advanced to the final of the T20 World Cup qualifying tournament in Dubai.,https://www.bbc.co.uk/sport/cricket/50259872,https://ichef.bbci.co.uk/onesport/cps/624/cpsprodpb/16DD1/production/_109494639_ireland.jpg,2019-11-01T13:52:37Z,"Kevin O'Brien's wicket ended a promising opening stand with Paul Stirling
<table><tr><td>ICC T20 World Cup Qualifier, Dubai:</td></tr><tr><td>Netherlands 158-4 (20 overs): Ten Doeschate 43*, Cooper 37; Rankin 1-17</td></tr><tr><td>Ireland 137-9 (20 overs): S… [+1346 chars]",0,0.0,0.0,3.0,0.0
54,bbc-news,BBC News,https://www.facebook.com/bbcnews,Iceland livestreams 10-year-old McDonald's cheeseburger,The meal was bought from the Nordic nation's last McDonald's in 2009 to see if it would ever decay.,https://www.bbc.co.uk/news/blogs-trending-50262547,https://ichef.bbci.co.uk/news/1024/branded_news/1797/production/_109493060_eiqckowwkaif53m-5.jpg,2019-11-01T14:25:44Z,"Image copyrightAFP / Angelika OSIEWALSKAImage caption
 Hjortur Smarason bought this McDonald's meal in 2009 to see how long it would take to decompose
When McDonald's closed all its restaurants in Iceland in 2009, one man decided to buy his last hamburger a… [+3067 chars]",0,2534.0,1076.0,1604.0,0.0
18,cbs-news,CBS News,Christopher Brito,LeBron James transforms into Edward Scissorhands for Halloween,"He called himself ""LeDward Scissorhands""",https://www.cbsnews.com/news/lebron-james-edward-scissorhands-halloween-los-angeles-lakers-stephen-curry-dwight-howard/,https://cbsnews2.cbsistatic.com/hub/i/r/2019/11/01/1ad7489c-3f2d-46b3-a60e-6fbe67eb82fa/thumbnail/1200x630/bf91b466dd74304039ce1ab52bd29810/screen-shot-2019-11-01-at-11-35-01-am.png,2019-11-01T16:04:07Z,"LeBron James has pulled off yet another epic Halloween costume — this time taking it to another level as Edward Scissorhands. The Los Angeles Lakers superstar shared photos of his convincing disguise on social media Thursday.
James, who last year dressed up … [+1721 chars]",0,543.0,128.0,72.0,0.0
40,cnn,CNN,"Angus Watson, Stephanie Halasz, Samuel Quashie-Idun and Bianca Britton, CNN",Two arrested in Vietnam in connection with Essex truck deaths,Vietnamese police have arrested two suspects in connection to the deaths of 39 people found in the back of a truck in England last month.,https://edition.cnn.com/2019/11/01/uk/essex-truck-deaths-arrests-vietnam-gbr-intl/index.html,https://cdn.cnn.com/cnnnext/dam/assets/191024103219-03-uk-truck-deaths-1023-super-tease.jpg,2019-11-01T14:29:28Z,,0,361.0,51.0,108.0,0.0
50,the-irish-times,The Irish Times,The Irish Times,Greece passes asylum law aimed at curbing migrant arrivals,"More than 35,000 are trapped on Greek islands with vast majority stuck in asylum limbo",https://www.irishtimes.com/news/world/europe/greece-passes-asylum-law-aimed-at-curbing-migrant-arrivals-1.4069221,https://www.irishtimes.com/image-creator/?id=1.4069220&origw=1440,2019-11-01T11:33:46Z,"Greece has passed a controversial asylum law aimed at curbing the rising number of migrants arriving on its shores, despite mounting criticism it will roll back fundamental human rights.
The 237-page Bill, entitled international protection and other provisio… [+5040 chars]",0,2.0,0.0,3.0,0.0
15,the-irish-times,The Irish Times,Barry Roche,Tusla worker jailed for possessing child pornography,Former social worker (35) given three-year sentence but final two years suspended,https://www.irishtimes.com/news/ireland/irish-news/tusla-worker-jailed-for-possessing-child-pornography-1.4069527,https://www.irishtimes.com/image-creator/?id=1.4069526&origw=1417,2019-11-01T16:26:32Z,"A 35-year-old man who was working with the Child and Family Agency Tusla has been jailed for a year after admitting possession of more than 2,500 child porn images at his home in Cork city two years ago.
Denis ODonovan, who was a social worker with Tusla at … [+5292 chars]",0,0.0,0.0,0.0,0.0
5,reuters,Reuters,Reuters Editorial,U.S. looking at new ISIS leader and role in organization: U.S. official,"The United States is looking into the new leader of the Islamic State to determine his role in the organization and where he came from, Nathan Sales, the U.S. counter-terrorism coordinator, said on Friday, after a U.S. raid last month that killed its former l…",https://www.reuters.com/article/us-mideast-crisis-baghdadi-usa-idUSKBN1XB4SG,https://s2.reutersmedia.net/resources/r/?m=02&d=20191101&t=2&i=1447389442&w=1200&r=LYNXMPEFA03AD,2019-11-01T17:52:40Z,"WASHINGTON (Reuters) - The United States is looking into the new leader of the Islamic State to determine his role in the organization and where he came from, Nathan Sales, the U.S. counter-terrorism coordinator, said on Friday, after a U.S. raid last month t… [+304 chars]",0,0.0,0.0,5.0,0.0
5,al-jazeera-english,Al Jazeera English,Al Jazeera,California Wildfires: Crews make progress as winds subside,"The Santa Ana winds, a seasonal weather phenomena, had complicated efforts to control fires in Southern California.",https://www.aljazeera.com/news/2019/11/california-wildfires-crews-progress-winds-subside-191101151426309.html,https://www.aljazeera.com/mritems/Images/2019/11/1/caa60076dff84aff8e90eae6df4588a8_18.jpg,2019-11-01T16:29:59Z,"Fierce winds in Southern California that have complicated efforts to fight widespread wildfires in the region eased early on Friday, helping crews make progress in corralling the blazes that have displaced thousands of residents.
Authorities said the repriev… [+3253 chars]",0,1.0,0.0,9.0,0.0
74,abc-news,ABC News,Ben Gittleson,Longtime New Yorker President Trump now says he's a Florida resident,Longtime New Yorker President Trump now says he's a Florida resident. First Lady Melania Trump also declared herself one as well.,https://abcnews.go.com/Politics/longtime-yorker-president-trump-now-florida-resident/story?id=66684657,https://s.abcnews.com/images/Politics/mar-a-lago-01-as-gty-190813_hpMain_16x9_992.jpg,2019-11-01T13:15:35Z,"President Donald Trump, a lifetime New Yorker long-linked to the Big Apple, has changed his official residence from Manhattan to Palm Beach, Florida.
Interested in Donald Trump?
Add Donald Trump as an interest to stay up to date on the latest Donald Trump n… [+3062 chars]",0,5960.0,4024.0,532.0,0.0
34,the-irish-times,The Irish Times,Declan Rooney,Van Graan has eye on Europe as Munster face Cardiff,South African coach has made wholesale changes with interpro derby also next week,https://www.irishtimes.com/sport/rugby/pro14/van-graan-has-eye-on-europe-as-munster-face-cardiff-1.4069320,https://www.irishtimes.com/image-creator/?id=1.4069342&origw=1440,2019-11-01T13:38:36Z,"Pro14: Cardiff Blues v Munster
Kick-off: 7.35pm, Saturday. Venue: Cardiff Arms Park. On TV: Live on Eir Sport, TG4.
The scheming and planning for the Heineken Cup has started as Johann van Graan makes wholesale changes for Munsters Pro14 trip to Cardiff on … [+2337 chars]",0,0.0,0.0,0.0,0.0
10,business-insider,Business Insider,Joseph Zeballos-Roig,Trump's decision to become a Florida resident could be huge tax-saver - Business Insider,"Florida has one of the friendliest tax climates for wealthy residents, as the state has no income or estate taxes.",http://www.businessinsider.com/trump-florida-residency-decision-huge-tax-saver-for-family-2019-11,https://image.businessinsider.com/5cb77a1f4a1675009a68bea8?width=1200&format=jpeg,2019-11-01T16:24:46Z,"After the New York Times reported that President Donald Trump had switched his residency from Florida to New York, he said that the Empire State's taxes factored into his decision.
""I cherish New York, and the people of New York, and always will, but unfortu… [+2927 chars]",1,0.0,0.0,0.0,0.0
71,newsweek,Newsweek,Ewan Palmer,Frozen Berries Recalled From Aldi and Raley's Over Possible Hepatitis A Contamination,Wawona Frozen Foods said a number of frozen berry products have been recalled out of abundance of caution.,https://www.newsweek.com/frozen-berries-recall-hepatitis-aldi-raleys-1469128,https://d.newsweek.com/en/full/1541856/wawona-frozen-foods.jpg,2019-11-01T09:50:52Z,"Wawona Frozen Foods has announced a voluntary recall of some of its packets of frozen raspberries and berry mixes over fears they may have been contaminated with hepatitis A.
The company said the affected products were sold at Aldi Grocery Stores and Raley's… [+2467 chars]",0,15.0,1.0,41.0,0.0
62,cnn,CNN,"Peter Valdes-Dapena, CNN Business",A safer way to fly? New technology enables a plane to land itself,"Created by Garmin, the Autoland system can take control and safely land an airplane in the event the pilot becomes incapacitated.",https://www.cnn.com/2019/11/01/success/self-landing-airplane-garmin-cirrus/index.html,https://cdn.cnn.com/cnnnext/dam/assets/191030113741-01-cirrus-aircraft-super-tease.jpg,2019-11-01T13:09:05Z,"Last summer in Australia, a man taking flying lessons for the first time was forced to land a small aircraft when his instructor passed out at the controls.Everyone was okay, but it was a harrowing incident that might have been avoided had the airplane been a… [+5913 chars]",0,9.0,0.0,34.0,0.0
