,source_id,source_name,author,title,description,url,url_to_image,published_at,content,top_article,engagement_reaction_count,engagement_comment_count,engagement_share_count,engagement_comment_plugin_count
25,business-insider,Business Insider,"Cpl. Nathan Reyes, US Marine Corps",Meet the overlooked crews who make sure fellow Marines can fight from ship to shore,"Keeping Marine Expeditionary Units supplied during their wide-ranging operations is a logistical headache. The Marines tasked with that job, Combat cargo Marines, are an overlooked but essential part of the force. Visit Business Insider's homepage for more st…",https://www.businessinsider.com/combat-cargo-marines-ensure-other-marines-fight-ship-and-shore-2019-10,https://image.businessinsider.com/5da4902fcc4a0a511c2945e3?width=1200&format=jpeg,2019-10-14T15:56:57Z,"It is a tough job and not everyone is lining up to work at their pace.
Combat cargo Marines have one of the most demanding jobs aboard the amphibious assault ship USS Bataan (LHD 5). This is especially evident during Composite Training Unit Exercise (COMPTUE… [+320 chars]",0,4.0,0.0,6.0,0.0
31,newsweek,Newsweek,Kelly Wynne,'Dancing With The Stars' Predictions: A Magic Twist Could Save A Celebrity On Disney Night,Fans will find out if Disney Night will follow its magical footsteps from last season.,https://www.newsweek.com/dancing-stars-predictions-magic-twist-could-save-celebrity-disney-night-1465039,https://d.newsweek.com/en/full/1535886/karamo-brown-dwts.jpg,2019-10-14T14:41:11Z,"Dancing With The Stars will dive deep into the world of Walt Disney on Monday night's episode. The sponsored theme will include a variety of promotions for all things Disney, from a High School Musical spinoff to the live-action Lion King, according to Gold D… [+2134 chars]",0,0.0,0.0,0.0,0.0
7,reuters,Reuters,Reuters Editorial,Finnish PM says more time needed for Brexit negotiations,Finland's Prime Minister Antti Rinne said on Monday more time was needed for the Brexit negotiations and that they could continue even after a summit of European Union leaders set for Thursday and Friday.,https://www.reuters.com/article/us-britain-eu-finland-idUSKBN1WT24P,https://s3.reutersmedia.net/resources/r/?m=02&d=20191014&t=2&i=1440786309&w=1200&r=LYNXMPEF9D1DO,2019-10-14T16:45:29Z,"HELSINKI (Reuters) - Finland’s Prime Minister Antti Rinne said on Monday more time was needed for the Brexit negotiations and that they could continue even after a summit of European Union leaders set for Thursday and Friday. 
British Prime Minister Boris Jo… [+619 chars]",0,0.0,0.0,222.0,0.0
54,newsweek,Newsweek,Tareq Haddad,"Utah Church Members Sent to Hospital With Carbon Monoxide Poisoning After Gas Leak: 'They Weren't Moving. They Were Just Flat, Prone'",Firefighters later isolated the leak—which caused dozens to be evacuated and 13 sent to hospital—as coming from a boiler.,https://www.newsweek.com/utah-churchgoers-sent-hospital-carbon-monoxide-poisoning-gas-leak-1464974,https://d.newsweek.com/en/full/1535810/boiler-stock-image.jpg,2019-10-14T11:41:58Z,"Dozens of people have been evacuated and 13 taken to hospital due to a significant buildup of carbon monoxide inside a Utah meetinghouse.
Firefighters were called to a Church of Jesus Christ of Latter-day Saints building in the city of Provo, roughly 45 mile… [+2126 chars]",0,0.0,0.0,3.0,0.0
9,business-insider,Business Insider,Taylor Nicole Rogers,Billionaire David Walentas gives $100 million to fund UVA scholarships - Business Insider,"David Walentas' gift will cover UVA's tuition for 60 first-generation students from Rochester, New York; New York City; or Virginia beginning in 2022.",http://www.businessinsider.com/david-walentas-billionaire-uva-scholarship-donation-100-million-2019-10,https://image.businessinsider.com/5da48fa34af90943a6782f12?width=1200&format=jpeg,2019-10-14T16:38:00Z,"Real-estate billionaire David Walentas was the first in his family to earn a college degree. Now, he has pledged $100 million to fund the educations of first-generation students at his alma mater, the University of Virginia, the school announced in a press re… [+2941 chars]",1,3.0,0.0,1640.0,0.0
30,cbs-news,CBS News,CBS News,"Ronan Farrow says some NBC journalists ""anguished"" by ""lies"" put out by leadership","In his explosive new book, ""Catch and Kill,"" Ronan Farrow details allegations of sexual assault in the media industry, and his former bosses’ alleged attempts to stifle his reporting. The book describes sexual assault allegations against disgraced Hollywood m…",https://www.cbsnews.com/video/ronan-farrow-says-some-nbc-journalists-anguished-by-lies-put-out-by-leadership/,https://cbsnews3.cbsistatic.com/hub/i/r/2019/10/14/afc5bad1-d4e8-4472-9dce-47d5f2f89168/thumbnail/1200x630/795734c5edeb8bcec6df305d902cc8b2/1014-ctm-catchandkillqa-mason-farrow-1951429-640x360.jpg,2019-10-14T13:12:58Z,,0,1.0,1.0,3.0,0.0
60,newsweek,Newsweek,Samuel Spencer,'The Walking Dead' Season 10 Recap: Gamma to Avenge Sister's Death as Thora Birch Joins Cast?,"""The Walking Dead"" Season 10, Episode 2 introduced another member of The Whisperers' command as Thora Birch joined the cast as Gamma.",https://www.newsweek.com/walking-dead-season-10-gamma-thora-birch-amc-1464965,https://d.newsweek.com/en/full/1535795/gamma-walking-dead.jpg,2019-10-14T10:29:00Z,"The Whisperers got another named member in The Walking Dead Season 10, Episode 2 as AMC viewers got to meet Gamma, played by Ghost World star Thora Birch. Gamma currently seems totally loyal to Alpha (played by Samantha Morton), but a recent interview with Bi… [+2389 chars]",0,0.0,0.0,1.0,0.0
42,reuters,Reuters,Stephane Mahe,"Canada's Trudeau, in tight election fight, says only he can stand up to Trump","Canadian Prime Minister Justin Trudeau, who looks set to lose his majority after an Oct. 21 election, on Monday said he needed a strong government to continue standing up to U.S. President Donald Trump.",https://ca.reuters.com/article/topNews/idCAKBN1WT1XR-OCATP,https://s3.reutersmedia.net/resources/r/?m=02&d=20191014&t=2&i=1440763590&w=1200&r=LYNXMPEF9D19U-OCATP,2019-10-14T15:18:32Z,"WINDSOR, Ontario (Reuters) - Canadian Prime Minister Justin Trudeau, who looks set to lose his majority after an Oct. 21 election, on Monday said he needed a strong government to continue standing up to U.S. President Donald Trump. 
Trudeau’s remarks were un… [+2356 chars]",0,0.0,0.0,1.0,0.0
9,bbc-news,BBC News,https://www.facebook.com/bbcnews,NHS doctor 'worried parents into using private health care',"The paediatrician who ran his own private health firm is accused of creating ""unwarranted concern"".",https://www.bbc.co.uk/news/uk-scotland-tayside-central-50043151,https://ichef.bbci.co.uk/news/1024/branded_news/EA30/production/_109225995_mpts.jpg,2019-10-14T15:59:07Z,"Image copyrightGoogleImage caption
 The hearing is taking place at the Medical Practitioners Tribunal Service in Manchester
An NHS paediatrician is facing a misconduct hearing accused of worrying parents into getting private health care for their children.… [+859 chars]",0,0.0,0.0,2.0,0.0
8,the-wall-street-journal,The Wall Street Journal,Chip Cutter,"When These Executives Want Candid Advice, They Text",More women leaders say they are creating text-based advisory groups to help them navigate business challenges and get no-fluff advice,https://www.wsj.com/articles/when-these-executives-want-candid-advice-they-text-11571045401,https://images.wsj.net/im-115808/social,2019-10-14T10:30:33Z,"After meeting someone particularly smart and insightful, technology executive Heather Fernandez sometimes asks, Can we take this relationship to text?
Often, the person on the other side of the query knows what she is looking for: a mutually beneficial ad ho… [+156 chars]",0,28.0,11.0,12.0,0.0
50,abc-news,ABC News,The Associated Press,4 Russian protesters jailed on charges of assaulting police,Russia's top state investigative agency says it has arrested four people suspected of assaulting police officers during a July opposition protest in Moscow,https://abcnews.go.com/International/wireStory/russian-protesters-jailed-charges-assaulting-police-66260853,,2019-10-14T13:34:14Z,"Russia's top state investigative agency says it has arrested four people suspected of assaulting police officers during a July opposition protest in Moscow.
The Investigative Committee said Monday the four were accused of pushing and grabbing officers at the… [+581 chars]",0,0.0,0.0,3.0,0.0
1,business-insider,Business Insider,Connie Chen,Everything you need to know about when Black Friday deals and sales start and end in 2019,"Black Friday is on November 29, 2019. Even though that's the official start day, many retailers will actually launch deals a few days earlier. Black Friday deals often run through the weekend until Cyber Monday brings a fresh wave of deals. The Insider Picks …",https://www.businessinsider.com/when-is-black-friday,https://image.businessinsider.com/5da0b3e24af90960b96a6179?width=1200&format=jpeg,2019-10-14T17:10:00Z,"Thanksgiving is coming up, and with it, Black Friday. Black Friday marks the beginning of the busiest shopping season of the year, when shoppers pursue their gift-shopping list with increased urgency. 
When is Black Friday? 
Officially, Black Friday lands o… [+1121 chars]",0,0.0,0.0,1.0,0.0
1,cnn,CNN,"Ashley Strickland, CNN",Interstellar comet fits right in with our solar system,"It's only the second observed ""interloper"" to cross into our solar system, but interstellar comet 21/Borisov looks incredibly similar to our own comets based on new observations by astronomers. They're also learning new details about the comet, like the fact …",https://www.cnn.com/2019/10/14/world/insterstellar-comet-borisov-scn/index.html,https://cdn.cnn.com/cnnnext/dam/assets/191014120528-wonders-of-the-universe-borisov-comet-super-tease.jpg,2019-10-14T17:04:10Z,"(CNN)It's only the second observed ""interloper"" to cross into our solar system, but interstellar comet 21/Borisov looks incredibly similar to our own comets based on new observations by astronomers. They're also learning new details about the comet, like the … [+4295 chars]",0,4.0,0.0,13.0,0.0
65,the-wall-street-journal,The Wall Street Journal,"David Hodari, Joe Wallace",Commodities Markets Take Hit on Wariness Over Trade Deal,Oil has dropped sharply and copper is down on reports that China wants further talks before signing up to phase one of a trade deal with the U.S.,https://www.wsj.com/articles/commodities-markets-take-hit-on-wariness-over-trade-deal-11571054341?mod=hp_lead_pos4,https://images.wsj.net/im-116615/social,2019-10-14T11:59:00Z,"LONDONOil and industrial metals prices fell Monday as market players focused on obstacles that could prevent the U.S. and China from completing a future trade pact.Brent crude, the global oil benchmark, was down 2% at $59.32 a barrel on Londons ICE Futures ex… [+3396 chars]",1,0.0,0.0,0.0,0.0
73,abc-news,ABC News,The Associated Press,Spanish Supreme Court says judge has issued international arrest warrant for Catalan ex-President Carles Puigdemont,"Get breaking national and world news, broadcast video coverage, and exclusive interviews. Find the top news online at ABC news.",https://abcnews.go.com/International/wireStory/spanish-supreme-court-judge-issued-international-arrest-warrant-66259084,,2019-10-14T12:06:39Z,Spanish Supreme Court says judge has issued international arrest warrant for Catalan ex-President Carles Puigdemont.,0,0.0,0.0,3.0,0.0
7,the-irish-times,The Irish Times,The Irish Times,Trump is right to take troops out of Syria. Now they must leave Iraq and Afghanistan,"The president’s motive for abandoning the Kurds is unclear, but the continued US presence in foreign wars is a disaster",https://www.irishtimes.com/opinion/trump-is-right-to-take-troops-out-of-syria-now-they-must-leave-iraq-and-afghanistan-1.4050210,https://www.irishtimes.com/image-creator/?id=1.4050208&origw=1440,2019-10-14T16:42:22Z,"Donald Trump is right to extricate the US from Syria. American troops have no strategic reason to be in that country. If they stayed any longer they would only be sucked in deeper - if they tried to impose a sort of peace, they would be attacked by all sides.… [+2853 chars]",0,0.0,0.0,1.0,0.0
25,cnn,CNN,,The latest on the Trump impeachment inquiry - CNNPolitics,The House is moving forward with its impeachment inquiry into President Donald Trump.,http://us.cnn.com/politics/live-news/impeachment-inquiry-10-14-2019/index.html,https://cdn.cnn.com/cnnnext/dam/assets/191011170646-04-trump-1011-super-tease.jpg,2019-10-14T13:08:26Z,"Joe Biden said Sunday that even though he was the last top-tier Democratic candidate to call for President Donald Trump's impeachment, ""I'm the reason there is impeachment going on.""
The former VP slammed Trump for asking foreign governments to investigate h… [+1229 chars]",1,0.0,0.0,0.0,0.0
37,the-new-york-times,The New York Times,,The Story of a Kurdish General,"The Americans promised they would protect his people. Now, one Kurdish leader is forced to turn to former foes for help.",https://www.nytimes.com/2019/10/14/podcasts/the-daily/kurds-syria-turkey-ISIS.html,https://static01.nyt.com/images/2019/10/12/world/14daily-sub/merlin_150366024_15201b99-6ed8-4478-9e0a-127cb4f4c9b4-facebookJumbo.jpg,2019-10-14T10:02:48Z,"Ben Hubbard contributed reporting.
The Daily is made by Theo Balcomb, Andy Mills, Lisa Tobin, Rachel Quester, Lynsea Garrison, Annie Brown, Clare Toeniskoetter, Paige Cowett, Michael Simon Johnson, Brad Fisher, Larissa Anderson, Wendy Dorr, Chris Wood, Jessi… [+429 chars]",0,1118.0,403.0,201.0,0.0
47,bbc-news,BBC News,https://www.facebook.com/bbcnews,Brooke Morris: Rugby player missing after night out in Merthyr,Brooke Morris has not been seen since she was dropped off at home in the early hours of Saturday.,https://www.bbc.co.uk/news/uk-wales-50043922,https://ichef.bbci.co.uk/news/1024/branded_news/D720/production/_109227055_brookemorrisnelsonrfc.jpg,2019-10-14T12:54:23Z,"Image copyrightNelson RFCImage caption
 Brooke Morris plays rugby for Nelson RFC
A search of mountains and waterways has taken place after a 22-year-old woman went missing following a night out.
Brooke Morris, 22, from Trelewis, Merthyr Tydfil, disappeared… [+1440 chars]",0,373.0,75.0,1089.0,0.0
43,the-irish-times,The Irish Times,The Irish Times,"NI-born people are considered British until they renounce citizenship, court rules","Derry woman Emma DeSouza, who identified as an Irish citizen, vows to fight on",https://www.irishtimes.com/							/news/ireland/irish-news/ni-born-people-are-considered-british-until-they-renounce-citizenship-court-rules-1.4049810	,https://www.irishtimes.com/image-creator/?id=1.4049809&origw=1440,2019-10-14T10:33:53Z,"A woman who lost a challenge against a Home Office ruling that she is British by birth has vowed to continue her legal battle.
Emma DeSouza, from Co Derry, accused the British government of failing to honour the spirit of a commitment in the Belfast Agreemen… [+5167 chars]",1,,,,
11,business-insider,Business Insider,Jennifer Still,"How to remove the Apple ID from your iPhone in 2 different ways, to wipe your data and information from the device","It's easy to remove the Apple ID from your iPhone in two different ways. When you remove your Apple ID from an iPhone, it will wipe all related data and information from the device. You may want to remove your Apple ID if you're changing accounts or selling y…",https://www.businessinsider.com/how-to-remove-apple-id-from-iphone,https://image.businessinsider.com/5da48066cc4a0a3722092f3c?width=1200&format=jpeg,2019-10-14T16:29:00Z,"Linking your Apple ID to your iPhone is vital to keeping you connected to all your favorite apps and data — including photos and documents, emails and text messages, and even your iTunes library. 
However, having all this information so readily available whe… [+1643 chars]",0,2.0,0.0,4.0,0.0
78,the-new-york-times,The New York Times,José María León Cabrera and Clifford Krauss,Talks in Ecuador Begin Between President and Protesters,"The talks, mediated by the United Nations, were canceled as violent protests wracked the city despite a curfew and the army’s presence on the streets.",https://www.nytimes.com/2019/10/13/world/americas/ecuador-protests-lenin-moreno.html,https://static01.nyt.com/images/2019/10/13/world/13ecuador1/13ecuador1-facebookJumbo.jpg,2019-10-14T00:00:35Z,"He has also received the wholehearted support of the military and security forces, who are concerned that much of the protests are being engineered by former President Rafael Correa, a leftist and ally of President Nicolás Maduro, of Venezuela.
Mr. Moreno wa… [+1148 chars]",0,449.0,56.0,207.0,0.0
6,abc-news,ABC News,The Associated Press,Ex-Texas sergeant acquitted of assault in 2017 inmate death,A former Texas prison sergeant accused of throwing a handcuffed inmate onto a floor so hard that the convicted robber later died has been acquitted,https://abcnews.go.com/US/wireStory/texas-sergeant-acquitted-assault-2017-inmate-death-66265082,,2019-10-14T16:49:09Z,"A former Texas prison sergeant accused of throwing a handcuffed inmate onto a floor so hard that the convicted robber later died has been acquitted.
Lou Joffrion was acquitted last month of aggravated assault in the 2017 death of David Witt. Texas Department… [+688 chars]",0,0.0,0.0,0.0,0.0
61,the-irish-times,The Irish Times,Cliff Taylor,The key sticking points in Johnson’s Brexit customs plan,What are the hard questions the EU is asking about the latest proposals,https://www.irishtimes.com/business/economy/the-key-sticking-points-in-johnson-s-brexit-customs-plan-1.4049803,https://www.irishtimes.com/image-creator/?id=1.4049802&origw=1440,2019-10-14T10:23:59Z,"EU and UK negotiators are continuing to discuss the plan put forward by Boris Johnson to break the Brexit deadlock. But doing a deal will not be easy. So what are the key problems and questions about the customs plan?
No surprise there, of course. The UK is … [+4197 chars]",0,0.0,0.0,2.0,0.0
60,reuters,Reuters,Reuters Editorial,Iran president says there is video footage of attack on Iranian tanker,"Iran's President Hassan Rouhani said an Iranian tanker damaged in the Red Sea on Friday had been hit by at least two rockets, and there is video footage of the incident.",https://af.reuters.com/article/worldNews/idAFKBN1WT1V3,https://s1.reutersmedia.net/resources/r/?m=02&d=20191014&t=2&i=1440752057&w=1200&r=LYNXMPEF9D181,2019-10-14T14:33:51Z,"DUBAI (Reuters) - Iran’s President Hassan Rouhani said an Iranian tanker damaged in the Red Sea on Friday had been hit by at least two rockets, and there is video footage of the incident. 
Iranian authorities reported that the Iranian-owned oil tanker, the S… [+602 chars]",0,0.0,0.0,0.0,0.0
4,newsweek,Newsweek,Jenni Fink,Religious Groups Condemn Governor's 'Infuriating' Decision to Sign Bill Forcing Universities to Offer Abortion Pill,"The California Family Council and California Catholic Conference encouraged Governor Gavin Newsom to veto the bill, as his predecessor, former Governor Jerry Brown, did.",https://www.newsweek.com/religious-groups-condemn-gavin-newsom-signing-california-university-abortion-pill-1465045,https://d.newsweek.com/en/full/1535897/gavin-newsom-california-abortion-criticism-religious-groups.jpg,2019-10-14T16:36:21Z,"The California Family Council and California Catholic Conference publicly criticized Governor Gavin Newsom for signing a bill into law that requires California's public colleges and universities to offer medication abortions.
Newsom signed SB 24, known as th… [+4145 chars]",0,0.0,0.0,2.0,0.0
18,business-insider,Business Insider,Jacquelyn Smith,12 awesome jobs for people who love science,"There is a wide variety of career paths to follow if you love science. Insider used data from the Occupational Information Network to create a list of amazing jobs for science-lovers. The list explains the average salary, job openings, and the basics of the j…",https://www.businessinsider.com/top-jobs-for-people-who-love-science-2015-12,https://image.businessinsider.com/565e0dcbc2814463008b693c?width=1200&format=jpeg,2019-10-14T16:13:00Z,"Did you start your mornings with ""Bill Nye the Science Guy"" as a kid? Did you ace your chemistry and physics classes in high school? Do you dream of wearing a lab coat to work?
If so, you might have a thing for science.
To find the top 12 jobs for science l… [+1291 chars]",0,0.0,0.0,2.0,0.0
72,cbs-news,CBS News,CBS/AP,Vigil held for woman fatally shot in home by Fort Worth officer,"The family's attorney claimed the officer ""didn't have time to perceive a threat"" before opening fire",https://www.cbsnews.com/news/fort-worth-police-shooting-community-holds-vigil-for-woman-fatally-shot-by-officer-in-home-2019-10-13/,https://cbsnews3.cbsistatic.com/hub/i/r/2019/10/13/94572ff1-8e41-4ff1-bdfd-a1499930eb1d/thumbnail/1200x630/2c1dba44c325aa824f472ddaecb6925d/jefferson.jpg,2019-10-14T00:54:45Z,"A vigil was held Sunday outside the home of 28-year-old Atatiana Jefferson who was fatally shot the night prior by a Fort Worth, Texas police officer. Jefferson, who is black, was killed in her home by a white officer who has since been placed on administrati… [+1700 chars]",0,2409.0,745.0,488.0,0.0
22,cbs-news,CBS News,CBS/AP,Mack Truck workers begin strike at plants across 3 states,"About 3,600 workers went on strike Sunday over issues including wage increases and job security",https://www.cbsnews.com/news/mack-truck-strike-2019-workers-begin-strike-at-plants-across-3-states/,https://cbsnews3.cbsistatic.com/hub/i/r/2019/10/14/bfb074db-f950-402c-b5c0-b6127d1f7022/thumbnail/1200x630/d154f28efd9284bc2a829c39610764d7/rts1xmy2.jpg,2019-10-14T14:03:38Z,"About 3,600 Mack Truck workers went on strike Sunday at plants in Florida, Pennsylvania and Maryland, the first such walkout in decades. 
United Automobile Workers union members, many wearing red T-shirts and carrying signs, began picketing in the morning at… [+2522 chars]",0,43.0,7.0,19.0,0.0
69,cbs-news,CBS News,CBS News,"In 2023, California will ban sales and manufacturing of fur products",California will soon become the first state in the nation to ban the sale and manufacture of new fur products. The law takes effect in 2023. Governor Gavin Newsom also signed a new law barring most animals from circus performances.,https://www.cbsnews.com/video/in-2023-california-will-ban-sales-and-manufacturing-of-fur-products/,https://cbsnews3.cbsistatic.com/hub/i/r/2019/10/14/f152ef94-3449-44f6-afaa-b6e14165e1b3/thumbnail/1200x630/f54d1bd9896d2447819de9439de0006a/1013-en-cafurban-vo-1951308-640x360.jpg,2019-10-14T01:02:49Z,,0,1.0,0.0,1.0,0.0
16,abc-news,ABC News,The Associated Press,Where you die can affect your chance of being an organ donor,"Get breaking national and world news, broadcast video coverage, and exclusive interviews. Find the top news online at ABC news.",https://abcnews.go.com/Health/wireStory/die-affect-chance-organ-donor-66263774,https://s.abcnews.com/images/Health/WireAP_028d363490f0420cbf580e28c99f677a_16x9_992.jpg,2019-10-14T16:00:56Z,"If Roland Henry had died in a different part of the country, his organs might have been recovered. And lives could have been saved.
But the local organ collection agency said no. It gave no reason, no explanation to his family, though the Connecticut man app… [+11044 chars]",0,0.0,0.0,0.0,0.0
73,the-new-york-times,The New York Times,,"2 Ohio Teenagers Charged After Log Fell Off Cliff, Killing Woman - The New York Times","2 Ohio Teenagers Charged After Log Fell Off Cliff, Killing Woman The New York Times Two teenage boys were charged after a woman was killed by a falling log in an Ohio park CNN 16-year-old boys arrested for reckless homicide after woman killed by falling log i…",https://www.nytimes.com/2019/10/13/us/Log-kills-woman-Cliff.html,https://static01.nyt.com/images/2019/10/13/multimedia/13xp-log/13xp-log-facebookJumbo.jpg,2019-10-14T02:11:00Z,"The identities of the teenagers were not released because of their ages, the sheriffs office said. They were being held at the Multi-County Juvenile Detention Center in Lancaster, Ohio.
The Gazette reported that the teenagers had a detention hearing on Frida… [+970 chars]",0,636.0,122.0,58.0,0.0
44,cbs-news,CBS News,AP,Nobel in economics awarded to trio for work to alleviate poverty,"American Michael Kremer at Harvard and 2 others at MIT honored for pioneering ways to fight global poverty by focusing on small, more manageable issues",https://www.cbsnews.com/news/nobel-prize-economics-2019-abhijit-banerjee-esther-duflo-michael-kremer-poverty-today-2019-10-14/,https://cbsnews3.cbsistatic.com/hub/i/r/2019/10/14/289cc8f3-bcac-49cd-849d-fc52e204b8f8/thumbnail/1200x630/7c6db32cda8fe821f95c69c2199531f4/2019-10-prize-economics.jpg,2019-10-14T11:55:55Z,"Stockholm — The 2019 Nobel Prize in economics was awarded Monday to Abhijit Banerjee, Esther Duflo and Michael Kremer for pioneering new ways to alleviate global poverty. Banerjee and Duflo are at the Massachusetts Institute of Technology, while Kremer, an Am… [+2703 chars]",0,1532.0,255.0,223.0,0.0
38,bbc-news,BBC News,https://www.facebook.com/bbcnews,Gulf tanker attacks: Iran releases photos of 'attacked' ship,Tehran says the photos are evidence that an Iranian-flagged tanker was attacked last week.,https://www.bbc.co.uk/news/world-middle-east-50040670,https://ichef.bbci.co.uk/news/1024/branded_news/11A32/production/_109224227_mediaitem109224226.jpg,2019-10-14T13:47:16Z,"Image copyrightNational Iranian Tanker CompanyImage caption
 Iran says the photo is evidence its oil tanker was attacked
Iran has released photos of an oil tanker that it says was attacked off the coast of Saudi Arabia.
The photos show two large holes in t… [+1923 chars]",0,3.0,0.0,41.0,0.0
