,source_id,source_name,author,title,description,url,url_to_image,published_at,content,top_article,engagement_reaction_count,engagement_comment_count,engagement_share_count,engagement_comment_plugin_count
46,abc-news,ABC News,The Associated Press,"Ecuador clash site has party clowns, recycling, tear gas","A party clown entertains children, Indigenous Amazonians tote spears and masked men battle police on the field of battle for control of Ecuador's economic future.",https://abcnews.go.com/International/wireStory/ecuador-clash-site-party-clowns-recycling-tear-gas-66228742,https://s.abcnews.com/images/International/WireAP_4e73937de6d148e59cfc4a29327f15eb_16x9_992.jpg,2019-10-12T11:41:56Z,"As a military helicopter circled overhead, a volunteer clown in a red rubber nose sang a nonsense song to laughing children outside a public theater.
Volunteers inside handed juice and sandwiches to members of the Shuar people newly arrived from the Amazon r… [+5564 chars]",0,0.0,0.0,3.0,0.0
3,reuters,Reuters,Reuters Editorial,"A son and father reunited, like many under Nobel winner Abiy's Ethiopia-Eritrea peace deal","For Samson Berhane, the news that Ethiopian Prime Minister Abiy Ahmed had won the 2019 Nobel Peace Prize was deeply personal.",https://af.reuters.com/article/worldNews/idAFKBN1WR0J0,https://s2.reutersmedia.net/resources/r/?m=02&d=20191012&t=2&i=1440113418&w=1200&r=LYNXMPEF9B0ID,2019-10-12T17:11:52Z,"ADDIS ABABA (Reuters) - For Samson Berhane, the news that Ethiopian Prime Minister Abiy Ahmed had won the 2019 Nobel Peace Prize was deeply personal. 
The 27-year old journalist credits Abiy’s peace deal with Eritrea last year for reuniting him with his fath… [+2269 chars]",0,0.0,0.0,0.0,0.0
74,the-irish-times,The Irish Times,John Self,"Booker Prize 2019: The books to read, and the ones you can skip","As Monday's announcement nears, we assess the shortlist and hazard a guess at the winner",https://www.irishtimes.com/culture/books/booker-prize-2019-the-books-to-read-and-the-ones-you-can-skip-1.4037691,https://www.irishtimes.com/image-creator/?id=1.4037679&origw=1440,2019-10-12T05:00:00Z,"This years Booker Prize shortlist provides the hungry book lover with lots to talk about before you even begin reading the books (and who has time for that?). The judges, with scant regard for our busy lives, work demands and social media commitments, have gi… [+7020 chars]",0,62.0,34.0,14.0,0.0
2,the-wall-street-journal,The Wall Street Journal,Christopher Mims,"India’s Richest Man Battles Amazon, Walmart to Work With Mom-and-Pop Shops",Reliance Industries and the U.S. retail giants want small local stores to help them reach India’s middle class,https://www.wsj.com/articles/indias-richest-man-battles-amazon-walmart-to-work-with-mom-and-pop-shops-11570885202,https://images.wsj.net/im-115934/social,2019-10-12T13:20:28Z,"MUMBAIIndias ubiquitous mom-and-pop stores are being weaponized in e-commerce wars, as Walmart Inc. and Amazon.com Inc. square off against Indias richest man in the countrys nascent online retail market. 
The millions of tiny stores and stands across the cou… [+152 chars]",0,149.0,27.0,34.0,0.0
68,reuters,Reuters,Reuters Editorial,"HK leader ditches meeting Ted Cruz, says the U.S. senator","Hong Kong leader Carrie Lam scrapped a scheduled meeting with U.S. Senator Ted Cruz, the highest profile U.S. politician to visit the city since anti-government protests broke out more than four months ago, the senator said on Saturday.",https://www.reuters.com/article/us-hongkong-protests-cruz-idUSKBN1WR0B7,https://s2.reutersmedia.net/resources/r/?m=02&d=20191012&t=2&i=1440032131&w=1200&r=LYNXMPEF9B0DC,2019-10-12T11:03:10Z,"HONG KONG (Reuters) - Hong Kong leader Carrie Lam scrapped a scheduled meeting with U.S. Senator Ted Cruz, the highest profile U.S. politician to visit the city since anti-government protests broke out more than four months ago, the senator said on Saturday. … [+1048 chars]",0,6206.0,599.0,2107.0,0.0
82,bbc-news,BBC News,BBC News,Fierce battle rages over Syrian border town,Turkish forces say they have seized Ras al-Ain as they press the offensive against Kurdish forces.,http://www.bbc.co.uk/news/world-middle-east-50025727,https://ichef.bbci.co.uk/images/ic/1024x576/p07qt31g.jpg,2019-10-12T10:59:07Z,"Media captionThe BBC's Martin Patience explains what's behind the conflict
Fierce fighting is taking place around the Syrian border town of Ras al-Ain as Turkish forces continue their military operation in north-eastern Syria.
Turkey says it has taken the t… [+5329 chars]",1,0.0,0.0,0.0,0.0
50,bbc-news,BBC News,,"Baseball: 'Oh my goodness, a full-on dive!' Zimmerman makes spectacular catch",Watch Washington Nationals' Ryan Zimmerman make a spectacular diving catch to deny Tommy Edman of the St. Louis Cardinals during the Nationals' 2-0 win on Friday.,https://www.bbc.co.uk/sport/av/baseball/50028101,https://m.files.bbci.co.uk/modules/bbc-morph-sport-page/3.3.2/images/bbc-sport-logo.png,2019-10-12T11:55:57Z,,0,7.0,1.0,20.0,0.0
64,abc-news,ABC News,The Associated Press,"Hong Kong protests draw thousands, down from earlier rallies",Protesters are marching again in Hong Kong but in numbers that so far seem significantly reduced from rallies that drew many thousands as recently as last weekend,https://abcnews.go.com/International/wireStory/hong-kong-protests-draw-thousands-earlier-rallies-66227597,https://s.abcnews.com/images/International/WireAP_cb24bed63a834b9ab4b79584f25d1afb_16x9_992.jpg,2019-10-12T08:44:05Z,"Protesters are marching again in Hong Kong but in numbers that so far seem significantly reduced from rallies that drew many thousands as recently as last weekend.
A march in Kowloon on Saturday afternoon drew a couple of thousand people who marched peaceful… [+529 chars]",0,0.0,0.0,3.0,0.0
45,business-insider,Business Insider,Kevin Webb,Blizzard says its ‘relationships in China had no influence on our decision’ to punish an esports athlete who voiced his support for Hong Kong protestors,Blizzard CEO J. Allen Brack has issued the company's first public statement since its decision to ban an esports competitor and withhold his prize money for making statements supporting the protests in Hong Kong at a Blizzard-sponsored event. The company has …,https://www.businessinsider.com/blizzard-ceo-statement-china-hong-kong-blitzchung-protests-boycott-2019-10,https://image.businessinsider.com/5c6349c626289848f202f748?width=1200&format=jpeg,2019-10-12T01:05:56Z,"Blizzard Entertainment President J.Allen Brack has issued the company's first public statement since making the decision to punish Chung Ng Wai, better known as Blitzchung — a ""Hearthstone"" esports competitor who spoke out in favor of the protests in Hong Kon… [+7937 chars]",0,577.0,298.0,88.0,0.0
78,reuters,Reuters,Reuters Editorial,Syria must be freed from foreign military presence - Putin,"Syria must be freed from foreign military presence, Russian President Vladimir Putin according to Russian news agencies.'",https://www.reuters.com/article/syria-security-putin-idUSL5N26X094,https://s4.reutersmedia.net/resources_v2/images/rcom-default.png,2019-10-12T09:58:10Z,"MOSCOW, Oct 12 (Reuters) - Syria must be freed from foreign military presence, Russian President Vladimir Putin according to Russian news agencies. 
“Everyone who is illegitimately on the territory of any state, in this case Syria, must leave this territory.… [+369 chars]",0,0.0,0.0,0.0,0.0
17,the-new-york-times,The New York Times,By Jen A. Miller,"Kipchoge’s Inspiring Marathon Run, Just in Time for Chicago","Between the breaking of the two-hour barrier and the Chicago Marathon, it’s a big weekend in running.",https://www.nytimes.com/2019/10/12/well/move/kipchoges-inspiring-marathon-run-just-in-time-for-chicago.html,https://static01.nyt.com/images/2019/10/12/well/12run-newsletter/merlin_144978963_cf9e8b25-cb31-4c70-bfaf-2c5253b9f261-facebookJumbo.jpg,2019-10-12T12:00:09Z,"Welcome to the Running newsletter! Every Saturday morning, we email runners with news, advice and some motivation to help you get up and running. Sign up here to get it in your inbox.
Dear Readers,
Eliud Kipchoge of Kenya has done what a lot of people thoug… [+1236 chars]",0,19.0,2.0,18.0,0.0
0,newsweek,Newsweek,Jennifer Doherty,French Aristocrat Suspected of Murdering Family Eludes Authorities Yet Again,"A DNA test quickly confirmed that a man detained in Glasgow on Friday evening was not Xavier Dupont de Ligonnès, who has been on the run since 2011.",https://www.newsweek.com/xavier-dupont-de-ligonnes-false-alarm-true-crime-1464828,https://d.newsweek.com/en/full/1535638/xavier-dupont-de-ligonnes.jpg,2019-10-12T17:22:39Z,"European media outlets went wild Friday at the announcement that Xavier Dupont de Ligonnès had been apprehended in Scotland. Dupont de Ligonnès, a French national, has been on the run since April 2011, when authorities discovered the bodies of his wife, Agnes… [+2629 chars]",0,0.0,0.0,0.0,0.0
41,reuters,Reuters,Reuters Editorial,Guatemala president-elect denied entry to Venezuela: Guaido,"Guatemala's president-elect on Saturday was denied entry to Venezuela, where he was scheduled to meet with opposition leader Juan Guaido, according to Venezuela's opposition.",https://www.reuters.com/article/us-venezuela-politics-guatemala-idUSKBN1WR0EE,https://s2.reutersmedia.net/resources/r/?m=02&d=20191012&t=2&i=1440062296&w=1200&r=LYNXMPEF9B0FB,2019-10-12T13:17:50Z,"CARACAS (Reuters) - Guatemala’s president-elect on Saturday was denied entry to Venezuela, where he was scheduled to meet with opposition leader Juan Guaido, according to Venezuela’s opposition. 
Guaido’s office said on Twitter that Alejandro Giammattei, a c… [+1239 chars]",0,30.0,3.0,21.0,0.0
36,abc-news,ABC News,The Associated Press,"For opera legend Placido Domingo, the show goes on in Europe","Even as his U.S. career winds seemingly down amid accusations of sexual harassment, opera legend Placido Domingo remains on the bills of top opera houses in Europe",https://abcnews.go.com/Entertainment/wireStory/opera-legend-placido-domingo-show-europe-66229451,https://s.abcnews.com/images/Entertainment/WireAP_7dc5795c907d47bb84a68ead0c65f21a_16x9_992.jpg,2019-10-12T13:51:36Z,"Even as his U.S. career seemingly winds down amid accusations of sexual harassment, opera legend Placido Domingo remains on the bill of a host of European opera houses. But cracks, even if slight, are beginning to show in his support.
The 78-year-old singer … [+4341 chars]",0,5.0,1.0,3.0,0.0
35,newsweek,Newsweek,Melissa Lemieux,Trump Celebrates New China Trade Deal and Little League Winners at Louisiana Rally,The president tackled multiple subjects while stumping for two Republican candidates for House and Senate.,https://www.newsweek.com/trump-celebrates-new-china-trade-deal-little-league-winners-louisiana-rally-1464777,https://d.newsweek.com/en/full/1535573/full.jpg,2019-10-12T04:00:20Z,"President Donald Trump held a rally Friday in Lake Charles, Louisiana for ""Thousands of loyal rock-ribbed American patriots"" who came out to listen to his stump speeches for Ralph Abraham and Eddie Rispone in their upcoming election against John Bell Edwards.… [+2897 chars]",0,211.0,404.0,16.0,0.0
86,bbc-news,BBC News,BBC News,US Homeland Security chief steps down,Kevin McAleenan was the fourth person to head the agency and oversaw Donald Trump's border policies.,http://www.bbc.co.uk/news/world-us-canada-50023448,https://ichef.bbci.co.uk/images/ic/1024x576/p07qq4c1.jpg,2019-10-12T00:50:02Z,"Media captionTrump's border chief was hounded off stage - a legitimate protest or a violation of freedom of speech?
The acting head of US Homeland Security, Kevin McAleenan, has resigned after six months in the post.
In a tweet, President Donald Trump said … [+669 chars]",1,0.0,0.0,0.0,0.0
8,al-jazeera-english,Al Jazeera English,Al Jazeera,Iran decries 'cowardly attack' on oil tanker off Saudi coast,Iran says will respond appropriately after investigation into the 'cowardly' attack on its oil tanker in Red Sea.,https://www.aljazeera.com/news/2019/10/iran-decries-cowardly-attack-oil-tanker-saudi-coast-191012120501441.html,https://www.aljazeera.com/mritems/Images/2019/10/12/fd23828791e241dcbe26e867ad49986c_18.jpg,2019-10-12T12:47:30Z,"An Iranian government spokesman has described as ""cowardly"" an attack on its oil tanker, which was hit in Red Sea waters off the coast of Saudi Arabia on Friday.
""Iran is avoiding haste, carefully examining what has happened and probing facts,"" spokesman Ali… [+3547 chars]",0,2.0,0.0,29.0,0.0
67,reuters,Reuters,Fayaz Bukhari,At least five injured in grenade attack in Kashmir's Srinagar amid India clampdown,"At least five people were injured in a grenade attack in India-controlled Kashmir's main city of Srinagar on Saturday, police said, the second such attack since India stripped the Himalayan region of its special status.",https://af.reuters.com/article/worldNews/idAFKBN1WR0BD,https://s4.reutersmedia.net/resources_v2/images/rcom-default.png,2019-10-12T11:17:15Z,"SRINAGAR, India (Reuters) - At least five people were injured in a grenade attack in India-controlled Kashmir’s main city of Srinagar on Saturday, police said, the second such attack since India stripped the Himalayan region of its special status. 
“Terroris… [+1667 chars]",0,0.0,0.0,0.0,0.0
6,business-insider,Business Insider,Kat Tenbarge,Gamers say they're earning more money on Facebook's streaming platform than on Twitch and YouTube,"Gaming is a $120 billion industry, and live video game streaming constitutes a growing slice. Twitch pioneered the idea of a game-streaming platform, with YouTube and Microsoft's Mixer emerging as its major competitors. Now, Facebook Gaming is coming out as a…",https://www.businessinsider.com/gamers-earn-more-money-facebook-gaming-twitch-youtube-mixer-streaming-2019-10,https://image.businessinsider.com/5d97996672fd82156a2b3ddc?width=1200&format=jpeg,2019-10-12T15:24:40Z,"As an industry, video games generated $120 billion last year. If the gaming industry was a country, it would rank within the top 100 GDPs in the world.
And not only does that industry involve people buying video games to play themselves, but there's also a r… [+12654 chars]",0,143.0,11.0,33.0,0.0
31,business-insider,Business Insider,Eliza Relman,Trump ratchets up the pressure on Fox News as moderate anchor Shep Smith resigns,"President Donald Trump has recently taken to alternately bashing and praising reporters and opinion hosts at his favorite media outlet, Fox News, in a highly public fashion. ""@FoxNews doesn't deliver for US anymore. It is so different than it used to be. Oh w…",https://www.businessinsider.com/trump-ratchets-up-the-pressure-on-fox-news-ripping-it-apart-2019-10,https://image.businessinsider.com/5bdb1546c957014bd449ce84?width=1200&format=jpeg,2019-10-12T11:55:00Z,"President Donald Trump has recently escalated his attacks on his favorite media outlet — Fox News — in a highly public fashion. 
""Fox isn't working for us anymore!"" he tweeted in late August. 
The president's vitriol has been spurred by some prominent voice… [+8280 chars]",0,192.0,180.0,64.0,0.0
36,bbc-news,BBC News,,2019/10/12 13:00 GMT,The latest five minute news bulletin from BBC World Service.,https://www.bbc.co.uk/programmes/w172wy0k3qjhy8s,https://ichef.bbci.co.uk/images/ic/1200x675/p060dh18.jpg,2019-10-12T13:06:00Z,The latest five minute news bulletin from BBC World Service.,0,0.0,0.0,0.0,0.0
72,abc-news,ABC News,Kelly Mccarthy,Lizzo's team adopts adorable new puppy named Poke,"Lizzo's team adopted a puppy named Poke from a shelter in Madison, Wisconsin.",https://abcnews.go.com/Entertainment/lizzos-team-adopts-adorable-puppy-named-poke/story?id=66212343,https://s.abcnews.com/images/US/lizzo-ht-ml-191011_hpMain_16x9_992.jpg,2019-10-12T05:45:47Z,"The truth is Lizzo and this newly adopted puppy are so cute it hurts!
The ""Good as Hell"" singer posted a series of videos on her Instagram stories playing with puppies that are up for adoption from Underdog Pet Rescue of Wisconsin during an event before her … [+891 chars]",0,6589.0,327.0,309.0,0.0
22,the-new-york-times,The New York Times,Matt Flegenheimer,James Comey Would Like to Help,"The former F.B.I. director wants an end to the Trump presidency. And yes, he knows you might think he caused it.",https://www.nytimes.com/2019/10/12/us/politics/james-comey-trump.html,https://static01.nyt.com/images/2019/10/13/us/politics/13comey-p1/00comey1-facebookJumbo.jpg,2019-10-12T09:00:18Z,"Thanks for giving us Donald Trump, an older woman heckled recently, adding an expletive as Mr. Comey strolled through a Yale Law School building, where he had come for a talk that focused largely on his fateful 2016 decisions and attendant personal anguish.
… [+1824 chars]",1,3768.0,1805.0,1013.0,0.0
20,al-jazeera-english,Al Jazeera English,Jamela Alindogan,Philippines town replaces all-male police force with women,The move is part of a wider government effort at promoting women in the workplace.,https://www.aljazeera.com/news/2019/10/philippines-town-replaces-all-male-police-force-women-191012061324528.html,https://www.aljazeera.com/mritems/images/2019/10/12/665003303001_6094302496001_6094306145001-th.jpg,2019-10-12T06:13:24Z,"A town in the central Philippines has replaced an almost all-male police force with women officers.
It is part of a wider government effort at promoting women in the workplace.
Al Jazeera's Jamela Alindogan reports from Maria in Siquijor province.",0,2.0,1.0,21.0,0.0
32,abc-news,ABC News,The Associated Press,Tunisia: Post-debate handshake hailed as pro-democracy sign,A media mogul and a law professor who are vying to be Tunisia's next president sparred during a televised debate over how to fight terrorism and poverty,https://abcnews.go.com/International/wireStory/tunisia-post-debate-handshake-hailed-pro-democracy-sign-66230139,https://s.abcnews.com/images/International/WireAP_c2944447b352419795f9994aa1882316_16x9_992.jpg,2019-10-12T14:50:07Z,"A media mogul and a former law professor who are vying to be Tunisia's next president sparred during a televised debate over how to fight terrorism and poverty.
Then the two candidates cordially shook hands, an act Tunisian voters are celebrating as a sign t… [+551 chars]",0,2.0,0.0,4.0,0.0
12,bbc-news,BBC News,BBC News,Parachutist hits lamppost on Spain's national day in Madrid,Luis Fernando Pozo was not badly hurt and later met the royal family.,https://www.bbc.co.uk/news/av/world-europe-50029630/parachutist-hits-lamp-post-on-spain-s-national-day-in-madrid,https://ichef.bbci.co.uk/news/1024/branded_news/9DA8/production/_109206304_p07qx72p.jpg,2019-10-12T15:46:20Z,,0,0.0,0.0,2.0,0.0
5,cbs-news,CBS News,CBS News,Doctors risk lives tackling Trump policy sending migrants back to Mexico,"A new report from Physicians for Human Rights claims the Trump administration's policies for asylum seekers are inflicting trauma on migrants. The policy was put in place by Homeland Security Secretary Kevin McAleenan, who resigned on Friday. CBS News has lea…",https://www.cbsnews.com/video/doctors-risk-lives-tackling-trump-policy-sending-migrants-back-to-mexico/,https://cbsnews2.cbsistatic.com/hub/i/r/2019/10/12/34c5338f-b907-422b-9498-b6ec246f8760/thumbnail/1200x630/08c78301ff135ec68a8ead5b27759aa5/1012-satmo-migrantsmissing-villarreal-1950658-640x360.jpg,2019-10-12T15:58:27Z,,1,0.0,0.0,0.0,0.0
19,al-jazeera-english,Al Jazeera English,Al Jazeera,Ethiopia's Prime Minister Abiy Ahmed Ali wins Nobel Peace Prize,Abiy Ahmed gets the award amid cautions over 'far from done' reforms and unfinished diplomatic efforts.,https://www.aljazeera.com/news/2019/10/ethiopias-prime-minister-abiy-ahmed-ali-wins-nobel-peace-prize-191012061335215.html,https://www.aljazeera.com/mritems/images/2019/10/12/665003303001_6094302512001_6094300757001-th.jpg,2019-10-12T06:13:35Z,"Ethiopian Prime Minister Abiy Ahmed Ali's awarding of the Nobel Peace Prize has been ushered in by praise for his efforts in ending two decades of hostility with neighbouring Eritrea and initiating broad domestic changes, but it also calls for tackling outsta… [+1015 chars]",0,27.0,2.0,23.0,0.0
9,business-insider,Business Insider,Kat Tenbarge,Comey keeps place card from 'loyalty' dinner with Trump in his office - Business Insider,"James Comey has been politically active since his departure from the FBI, and at home he keeps reminders of his clash with President Donald Trump.",http://www.businessinsider.com/james-comey-place-card-trump-dinner-loyalty-in-home-office-2019-10,https://image.businessinsider.com/5da1e25acc4a0a07be46b592?width=1200&format=jpeg,2019-10-12T17:08:08Z,"After being dismissed from his role as FBI director, James Comey filled his home office in Virginia with reminders of the twists and turns in his career. One of those trinkets is the place card from his infamous dinner with President Donald Trump, The New Yor… [+2181 chars]",1,0.0,0.0,0.0,0.0
66,bbc-news,BBC News,Bbc News,Sperm whale dies close to Northumberland shore,"British Divers Marine Life Rescue says the mammal's prognosis was always ""incredibly poor"".",https://www.bbc.co.uk/news/uk-england-tyne-50026342,https://ichef.bbci.co.uk/news/1024/branded_news/0032/production/_109205000_hi057233383.jpg,2019-10-12T09:33:19Z,"Image copyrightOwen Humphreys/PAImage caption
 Sperm whales are not often seen in the North Sea as it lacks the large squid they would usually feed on
A sperm whale beached in shallow water off the Northumberland coast has died.
The 43ft (13m) mammal was f… [+1239 chars]",0,5472.0,473.0,253.0,0.0
10,abc-news,ABC News,The Associated Press,California power shutdowns raise air pollution worries,Power shutdowns intended to prevent more devastating California wildfires are raising concerns about another environmental threat: air pollution,https://abcnews.go.com/Business/wireStory/california-power-shutdowns-raise-air-pollution-worries-66231858,https://s.abcnews.com/images/Technology/WireAP_106c4be0db234b699afd28df41fda535_16x9_992.jpg,2019-10-12T16:17:25Z,"Power shutdowns intended to prevent more devastating California wildfires are raising new concerns about another longstanding environmental threat: air pollution.
As utilities halted service to more than 2 million people this week, lines formed at hardware s… [+5301 chars]",0,0.0,0.0,0.0,0.0
24,business-insider,Business Insider,Áine Cain,Ikea exec explains how the chain's upcoming store in Queens will be the first of its kind in the US,"Ikea is set to open a store in Rego Park, Queens, in the summer of 2020. The new location won't be a traditional blue big box, however. Ikea US COO Leontyne Green Sykes told Business Insider that the store will feature a hybrid format, with some products avai…",https://www.businessinsider.com/ikea-queens-new-store-format-executive-interview-2019-10,https://image.businessinsider.com/5da084e64af909118d7a98a2?width=1200&format=jpeg,2019-10-12T12:55:00Z,"The Ikea store coming to Queens in 2020 will be the first location of its kind to open in the United States.
New York City already has two Ikea locations: a classic blue box store in Brooklyn and a planning studio on the Upper East Side of Manhattan. But the… [+2413 chars]",0,46.0,3.0,16.0,0.0
78,abc-news,ABC News,The Associated Press,Gas balloon teams reach Canada in annual distance contest,Polish balloon pilot Krzysztof Zapart and American teammate Andy Cayton are the apparent winners of the 2019 America's Challenge gas balloon race,https://abcnews.go.com/US/wireStory/gas-balloon-teams-reach-canada-annual-distance-contest-66226355,,2019-10-12T04:59:54Z,"Polish balloon pilot Krzysztof Zapart and American teammate Andy Cayton are the apparent winners of the 2019 America's Challenge gas balloon race.
The team crossed the Canadian border and landed Thursday just south of Hudson Bay, having traveled more than 1,… [+608 chars]",0,0.0,0.0,0.0,0.0
22,bbc-news,BBC News,,Ivorian forward Gervinho extends contract at Serie A side Parma,"Ivorian forward Gervinho extends his contract with Italian Serie A side Parma, with his new deal keeping him at the club until June 2022.",https://www.bbc.co.uk/sport/football/50029021,https://ichef.bbci.co.uk/onesport/cps/624/cpsprodpb/C08A/production/_109209294_gettyimages-1172622723.jpg,2019-10-12T14:37:48Z,"Ivory Coast international Gervinho
Ivorian forward Gervinho has extended his contract with Italian Serie A side Parma for another season.
The club confirmed that the new deal extends his stay at the club until 30 June 2022. 
The 32-year-old former Arsenal … [+748 chars]",0,0.0,0.0,1.0,0.0
59,the-irish-times,The Irish Times,Malachy Clerkin,Drawn-out process for picking new Clare manager provokes anger on all sides,"Whoever finally emerges, it promises to be a rocky start to life for the incoming boss",https://www.irishtimes.com/sport/gaelic-games/hurling/drawn-out-process-for-picking-new-clare-manager-provokes-anger-on-all-sides-1.4047840,https://www.irishtimes.com/image-creator/?id=1.4047836&origw=1440,2019-10-12T05:00:00Z,"In Clareabbey on Wednesday night, if felt at timesl like there was a severed electrical cable flapping this way and that, live and dangerous and hard to control.
The Clare County Board had convened a meeting of the clubs with a single item on the agenda, tha… [+6906 chars]",0,8.0,3.0,4.0,0.0
