,source_id,source_name,author,title,description,url,url_to_image,published_at,content,top_article,engagement_reaction_count,engagement_comment_count,engagement_share_count,engagement_comment_plugin_count
16,the-new-york-times,The New York Times,Liz Alderman and Elian Peltier,Roman Polanski Accused of 1975 Rape,A French photographer said the director hit her and assaulted her when she was 18. She is the sixth woman to publicly accuse him of sexual abuse.,https://www.nytimes.com/2019/11/09/world/europe/roman-polanski-rape-france.html,https://static01.nyt.com/images/2019/11/09/world/09polanski/09polanski-facebookJumbo.jpg,2019-11-09T13:53:15Z,"Every season theres a new accusation, a new absurd story from a woman Ive never seen in my life and who accuses me of things that supposedly happened a half century ago. 
In 2017, a German former actress, Renate Langer, accused Mr. Polanski of raping her in … [+1357 chars]",0,1374.0,778.0,230.0,0.0
43,business-insider,Business Insider,Christopher Competiello,'We're going to have to have a severe recession if we're ever going to build a viable economy': Here’s why one market expert says the US is doomed to default on its debt no matter what,"Peter Schiff, the outspoken CEO and president of Euro Pacific Capital, thinks the gargantuan amount of debt the US is carrying is primed to default. He calls repayment ""impossible"" and sees this mess ending in either an ""honest"" or ""dishonest"" default. Click …",https://www.businessinsider.com/next-recession-peter-schiff-us-will-default-on-national-debt-2019-11,https://image.businessinsider.com/5dc59dbc7eece512521d3a89?width=1200&format=jpeg,2019-11-09T11:05:00Z,"For one reason or another, the towering amount of debt the US has racked up over the years seems to be of little concern to market participants and politicians alike.
Currently, that figure tops $22 trillion — and is growing fast. What's more, as modern mone… [+3169 chars]",0,34.0,12.0,59.0,0.0
8,the-new-york-times,The New York Times,Derrick Bryson Taylor,Missing Clark Atlanta University Student Is Found Dead,"Alexis Crawford was reported missing on Nov. 1, just days after she filed a sexual assault report against her roommate’s boyfriend, officials said.",https://www.nytimes.com/2019/11/09/us/Alexis-Crawford-Clark-Atlanta.html,https://static01.nyt.com/images/2019/11/09/multimedia/09xp-atlanta/09xp-atlanta-facebookJumbo.jpg,2019-11-09T16:59:13Z,"Late on Nov. 1, Ms. Crawford was reported missing by her mother and two sisters, who all said they last communicated with her on Oct. 30.
Ms. Jones was also interviewed by investigators. She was not on speaking terms with Ms. Crawford because of a separate u… [+769 chars]",0,24.0,0.0,23.0,0.0
14,business-insider,Business Insider,INSIDER,"Tale of SS Richard Montgomery sunk off London with 1,400 tonnes of TNT - Business Insider","75 years ago the SS Richard Montgomery went down at the end of the River Thames with 1,400 tonnes of TNT onboard. Its payload is becoming unstable.",http://www.businessinsider.com/london-ss-montgomery-story-doomsday-wreck-1400-tonnes-tnt-2019-10,https://image.businessinsider.com/5dc3f30be94e863c480dee7b?width=1200&format=jpeg,2019-11-09T09:06:00Z,"A cargo ship which sank 75 years ago at the mouth easterly end of London's River Thames, bearing hundreds of tonnes of TN, could poses a threat to the capital decades later.
In August 1944, SS Richard Montgomery, a US vessel ferrying munitions in World War I… [+2108 chars]",1,2.0,6.0,21.0,0.0
19,cnn,CNN,CNN,READ: House GOP's letter requesting witnesses to testify in impeachment probe,House Republicans submitted a list of witnesses they'd like to testify as part of the chamber's impeachment inquiry into President Donald Trump and Ukraine.,https://www.cnn.com/2019/11/09/politics/read-house-gop-witness-request-hunter-biden-whistleblower/index.html,https://cdn.cnn.com/cnnnext/dam/assets/190724125719-46-mueller-hearing-0724-super-tease.jpg,2019-11-09T15:37:35Z,,0,4.0,14.0,25.0,0.0
43,the-irish-times,The Irish Times,,The Tribe: Caitríona Perry on the political influence of Irish America,"Book review: Catríona Perry writes on Irish-US relations in a crisp, accessible style",https://www.irishtimes.com/culture/books/the-tribe-caitr%C3%ADona-perry-on-the-political-influence-of-irish-america-1.4069172,,2019-11-09T06:00:00Z,,0,16.0,4.0,7.0,0.0
49,bbc-news,BBC News,,Nottingham Forest 1-0 Derby County: Lewis Grabban scores winner for hosts,Lewis Grabban takes advantage of a Derby County error to give Nottingham Forest victory over their local rivals.,https://www.bbc.co.uk/sport/football/50271668,https://ichef.bbci.co.uk/onesport/cps/624/cpsprodpb/148B5/production/_109594148_grabban4.jpg,2019-11-09T14:24:37Z,"Nottingham Forest have won successive Championship games, with Lewis Grabban scoring in both matches
Lewis Grabban took advantage of a Derby County error to give Nottingham Forest victory over their local rivals at the City Ground.
Right-back Jayden Bogle's… [+1143 chars]",0,260.0,52.0,33.0,0.0
6,business-insider,Business Insider,Grace Panetta,How Trump could be impeached and removed but win re-election in 2020 - Business Insider,"After removing a president, the Senate must separately vote by simple majority to prevent them from holding a federal office in the future.",http://www.businessinsider.com/how-trump-could-be-impeached-convicted-but-win-reelection-2020-2019-11,https://image.businessinsider.com/5dc1daf27eece513244511b2?width=1200&format=jpeg,2019-11-09T19:11:00Z,"President Donald Trump is currently facing an impeachment inquiry led by three House of Representatives committees, but he could still be re-elected in 2020 even if Congress removes him from office.
Some conservative pundits have compared the impeachment inq… [+5738 chars]",1,267.0,265.0,43.0,0.0
29,abc-news,ABC News,The Associated Press,"Greek counterterror operation yields 3 arrests, arms cache","Greek authorities say they have arrested three people and detained a further 15 in a ""wide sweep"" by the police's counterterrorism squad on suspected left-wing extremists",https://abcnews.go.com/International/wireStory/greek-counterterror-operation-yields-arrests-arms-cache-66874058,null,2019-11-09T12:41:09Z,"Greek authorities say they have arrested three people and detained a further 15 in a ""wide sweep"" by the police's counterterrorism squad on suspected left-wing extremists that also yielded an arms cache.
Another person is at large, police announced Saturday.… [+567 chars]",0,0.0,0.0,4.0,0.0
25,cnn,CNN,"Kara Scannell, Scott Glover and Curt Devine, CNN",Giuliani's Soviet-born associates lived lavishly despite questionable finances,"As federal prosecutors pursue their case against a pair of South Florida businessmen at the center of an alleged plot to hijack the US political process, their trail is sure to lead here if it hasn't already.",https://www.cnn.com/2019/11/09/politics/giuliani-associates-parnas-fruman-questionable-finances-invs/index.html,https://cdn.cnn.com/cnnnext/dam/assets/191010154229-trump-giuliani-associates-file-super-tease.jpg,2019-11-09T14:53:00Z,"Sunny Isles Beach, FL (CNN)As federal prosecutors pursue their case against a pair of South Florida businessmen at the center of an alleged plot to hijack the US political process, their trail is sure to lead here if it hasn't already.
This strip of white sa… [+14312 chars]",0,119.0,39.0,214.0,0.0
51,the-irish-times,The Irish Times,Ian O'Riordan,Mícheál Ó Muircheartaigh: ‘I’m well enough. I don’t worry about anything’,"At 89, the legendary broadcaster retains his unique zest for life – and Gaelic games in particular",https://www.irishtimes.com/sport/gaelic-games/m%C3%ADche%C3%A1l-%C3%B3-muircheartaigh-i-m-well-enough-i-don-t-worry-about-anything-1.4076782?localLinksEnabled=false,,2019-11-09T06:00:00Z,,0,0.0,0.0,0.0,0.0
68,abc-news,ABC News,The Associated Press,7 Hong Kong pro-democracy lawmakers detained or face arrest,"Seven Hong Kong pro-democracy lawmakers have either been detained or face arrest Saturday, in a move expected to escalate public fury during months of unrest",https://abcnews.go.com/International/wireStory/hong-kong-pro-democracy-lawmakers-detained-face-arrest-66868622,https://s.abcnews.com/images/International/WireAP_204d7c8e88434368a17c5f1fc179c618_16x9_992.jpg,2019-11-09T03:37:30Z,"Seven Hong Kong pro-democracy lawmakers have either been detained or face arrest Saturday, in a move expected to escalate public fury during months of unrest.
A police statement said one of the lawmakers was charged Saturday. All of them will appear in court… [+308 chars]",0,75.0,10.0,21.0,0.0
30,newsweek,Newsweek,Ramsey Touchberry,"Joe Biden Has a Michael Bloomberg Problem, Democratic Strategists Say",A potential 2020 bid from the former New York mayor could create some headaches for Biden's ability to maintain the support from moderate Democrats that he needs to remain a frontrunner.,https://www.newsweek.com/joe-biden-has-michael-bloomberg-problem-democratic-strategists-say-1470750,https://d.newsweek.com/en/full/1544011/joe-biden-has-michael-bloomberg-problem.jpg,2019-11-09T13:00:01Z,"The expected candidacy of former New York City Mayor Michael Bloomberg for president has the ability to pose a significant threat to one of the current Democratic frontrunners.
That person is Joe Biden, several Democratic strategists told Newsweek.
One of t… [+7200 chars]",0,50.0,55.0,9.0,0.0
58,abc-news,ABC News,The Associated Press,India state broadcaster: Top court rules disputed religious ground in favor of Hindus with alternate land for Muslims,India state broadcaster: Top court rules disputed religious ground in favor of Hindus with alternate land for Muslims,https://abcnews.go.com/International/wireStory/india-state-broadcaster-top-court-rules-disputed-religious-66871303,null,2019-11-09T05:54:19Z,India state broadcaster: Top court rules disputed religious ground in favor of Hindus with alternate land for Muslims.,0,0.0,0.0,3.0,0.0
14,cbs-news,CBS News,CBS News,"Audible brings jobs, hope to Newark, NJ","Newark, New Jersey has seen its share of hard times. Most recently, like Flint, Michigan, it's found itself battling a lead water crisis, but a lot is looking up in the ""brick city."" Some of the success is thanks to innovative, public-private partnerships lik…",https://www.cbsnews.com/video/audible-brings-jobs-hope-to-newark-nj/,https://cbsnews2.cbsistatic.com/hub/i/r/2019/11/09/9bde3889-0d2f-410a-a9e9-776be1123fdb/thumbnail/1200x630/bbb423e4441027ad2c93bde7380b2032/1109-satmo-audible-miller-1973833-640x360.jpg,2019-11-09T14:00:38Z,,0,254.0,36.0,45.0,0.0
18,cnn,CNN,Theresa Waldrop,"Woman found after being abducted, raped and 'left to die' in desert, police say","A man and his daughter abducted and raped a Las Vegas woman, taking her to California and holding her about a week before she was ""left to die"" outside Edwards Air Force Base in California's Mojave Desert, investigators said.",http://us.cnn.com/2019/11/09/us/las-vegas-abduction-father-daughter-charged/index.html,https://cdn.cnn.com/cnnnext/dam/assets/191109075706-edwards-air-force-base-super-tease.jpg,2019-11-09T16:20:09Z,"(CNN)A man and his daughter abducted and raped a Las Vegas woman, taking her to California and holding her about a weekbefore she was ""left to die""outside Edwards Air Force Base in California's Mojave Desert, investigators said.
Among the charges against Sta… [+1574 chars]",1,0.0,0.0,0.0,0.0
53,the-new-york-times,The New York Times,Noah Weiland,Impeachment Briefing: Anatomy of a Scene From the Hill Testimony,The transcript of Fiona Hill’s interview describes a cinematic White House scene. Our reporters help break it down.,https://www.nytimes.com/2019/11/08/us/politics/impeachment-testimony-hill.html,https://static01.nyt.com/images/2019/11/08/us/politics/oakImage-1573247917096/oakImage-1573247917096-facebookJumbo.png,2019-11-09T01:12:15Z,"This is a special edition of the Impeachment Briefing, The Timess newsletter about the impeachment investigation. Sign up here to get it in your inbox every weeknight.
Impeachment investigators released interview transcripts on Friday for two major witnesses… [+6125 chars]",0,52.0,25.0,111.0,0.0
50,the-new-york-times,The New York Times,"Nicholas Fandos, Michael D. Shear and Peter Baker","Bolton Said to Know of ‘Many Relevant Meetings’ on Ukraine, but Will Not Testify","A lawyer for John R. Bolton said he had information to share with impeachment investigators. But, so far, he will not defy the White House.",https://www.nytimes.com/2019/11/08/us/politics/john-bolton-mick-mulvaney-trump.html,https://static01.nyt.com/images/2019/11/08/us/08dc-impeachcsub/merlin_164064282_411ac65a-76cc-43f4-b606-d2d695f8d5a8-facebookJumbo.jpg,2019-11-09T01:46:03Z,"House Democrats complained that Mr. Bolton was stiff-arming them, but said they would not subpoena him because they did not want to get dragged into lengthy court proceedings. Instead, Democrats have suggested that they may cite the refusal to testify as evid… [+1819 chars]",0,381.0,198.0,432.0,0.0
67,reuters,Reuters,Reuters Editorial,UPDATE 2-A-League Results,"Nov  9 (OPTA) - Results and fixtures for the A-League on Friday (start times are AEDT)
 Melbourne City  (1)  3  Central Coast Mariners  (0)  1

 Saturday, November  9 fixtures (AEDT/GMT)
 Newcastle Jets     v  Perth Glory               (1700/0600)
 Western Un…",https://uk.reuters.com/article/soccer-australia-results-idUKMTZXEFB8NE7E32,https://s4.reutersmedia.net/resources_v2/images/rcom-default.png,2019-11-09T10:59:10Z,,0,0.0,0.0,0.0,0.0
11,business-insider,Business Insider,"feedback@businessinsider.com (Michael Gordon), Michael Gordon",Republicans should face reality: It's time for President Pence,"Associated Press/Manuel Balce Ceneta President Donald Trump's scandals have made the 2020 elections less than certain for many Republicans. Given recent election results and Trump's approval ratings, it is clear that the GOP should move on from Trump and move…",https://www.businessinsider.com/republicans-congress-dump-trump-make-pence-president-2019-11,https://image.businessinsider.com/5ccd8784021b4c260c78f0b3?width=1200&format=jpeg,2019-11-09T16:36:00Z,"Conventional wisdom has it that Republicans will and should stick with President Donald Trump, and conventional wisdom is usually wrong.
I'm the last person to give advice to Republicans, but the GOP needs to move on to a President Mike Pence.
Trump's drip-… [+3784 chars]",0,1021.0,966.0,151.0,0.0
41,the-new-york-times,The New York Times,Damien Cave,At Least 2 Dead as Fires Rage Across East Australia,"Firefighters warned of dry, windy conditions to come, signaling an early start for what could be the country’s worst fire season in decades.",https://www.nytimes.com/2019/11/09/world/australia/fires-two-killed-climate-change.html,https://static01.nyt.com/newsgraphics/images/icons/defaultPromoCrop.png,2019-11-09T07:54:15Z,"The two people who were killed died near Glen Innes, a small town of around 6,000 people northeast of Coffs Harbour. 
Firefighters said they found a body on Saturday in a burned car. Another woman, found on Friday unconscious and with serious burns, later di… [+595 chars]",0,2.0,1.0,32.0,0.0
17,cnn,CNN,,NYT: Local TV bringing back late-night Anthem sign-off,"The New York Times reports location TV stations are bringing back the patriotic sign-off of playing the National Anthem, saying it encourages unity at a time of deep division. CNN's Michael Smerconish discusses with musicologist Mark Clague.",https://www.cnn.com/videos/us/2019/11/09/national-anthem-partisan-local-tv-sign-off-mark-clague-intv-smerconish-vpx.cnn,https://cdn.cnn.com/cnnnext/dam/assets/191109103730-national-anthem-partisan-local-tv-sign-off-mark-clague-intv-smerconish-vpx-00000705-super-tease.jpg,2019-11-09T15:44:21Z,Chat with us in Facebook Messenger. Find out what's happening in the world as it unfolds.,0,1.0,0.0,28.0,0.0
18,al-jazeera-english,Al Jazeera English,,"France, secularism and hijab paranoia",We debate whether the veil is being demonised in France with Rim-Sarah Alouane and Benjamin Haddad.,https://www.aljazeera.com/programmes/upfront/2019/11/france-secularism-hijab-paranoia-191108215217038.html,,2019-11-09T09:29:24Z,,0,0.0,0.0,9.0,0.0
26,cbs-news,CBS News,CBS News,Arctic air isn't going away yet,"Parts of the Midwest could be battling one of the coldest Veterans Day ever, as another blast of arctic air is set to move into the central and eastern portions of the country by Sunday. Plunging temperatures are also helping to bring early November snow to t…",https://www.cbsnews.com/video/arctic-air-isnt-going-away-yet/,https://cbsnews2.cbsistatic.com/hub/i/r/2019/11/09/5e788586-a1f2-45cc-b1b1-6642ad751cd6/thumbnail/1200x630/5dd00e38084c715b251ef33f595dc74f/1109-satmo-coldweather-vo-new-1973770-640x360.jpg,2019-11-09T12:51:58Z,,0,103.0,31.0,28.0,0.0
24,the-irish-times,The Irish Times,The Irish Times,Germany marks 30 years since the fall of the Berlin Wall,"Germany is marking 30 years since the Berlin Wall fell, a pivotal moment in the events that brought down Communism in eastern Europe. Leaders from Germany and other European nations are attending ceremonies on Saturday in Berlin recalling the peaceful protest…",https://www.irishtimes.com/news/world/europe/germany-marks-30-years-since-the-fall-of-the-berlin-wall-1.4078094,https://www.irishtimes.com/image-creator/?id=1.4078093&origw=1440,2019-11-09T11:31:59Z,"Germany is marking 30 years since the Berlin Wall fell, a pivotal moment in the events that brought down Communism in eastern Europe.
Leaders from Germany and other European nations are attending ceremonies on Saturday in Berlin recalling the peaceful protes… [+982 chars]",0,0.0,0.0,0.0,0.0
40,bbc-news,BBC News,https://www.facebook.com/bbcnews,Welsh Assembly protestors want it renamed Senedd,"They want Wales' parliament to have a ""unique"" name, like the German Bundestag or Dáil in Ireland.",https://www.bbc.co.uk/news/uk-wales-50361583,https://ichef.bbci.co.uk/news/1024/branded_news/145F9/production/_109594438_mediaitem109594437.jpg,2019-11-09T15:42:50Z,"Image caption
 Protestors gathered on the steps of the assembly building in Cardiff Bay
About 100 people have joined a protest calling for the Welsh Assembly to be renamed Senedd. 
Last month assembly members voted to replace the title with a bilingual nam… [+1619 chars]",0,0.0,0.0,0.0,0.0
21,the-new-york-times,The New York Times,The New York Times,"Pep Guardiola, Jurgen Klopp and English football’s cultural leap","Klopp and Guardiola are helping to change English football. But they can only do it because English football had changed so much anyway. The post Pep Guardiola, Jurgen Klopp and English football’s cultural leap appeared first on Firstpost.",https://www.nytimes.com/2019/11/08/sports/liverpool-manchester-city-guardiola-klopp.html,https://images.firstpost.com/wp-content/uploads/2019/11/GUARDIOLA-NYT_opt-2.jpg,2019-11-09T12:24:40Z,"Rochdale (England): Alfie McLellan was grumbling as he walked out of the low-slung, lopsided stadium that his team, Rochdale, calls home.
It was not so much that Rochdale has lost that bothered McLellan. Rochdale fans like him know, from long experience, not… [+9452 chars]",0,57.0,11.0,24.0,0.0
29,reuters,Reuters,Nicolás Misculin,Argentina's Fernandez joins leftist leaders for 'Puebla Group' summit,"Argentine President-elect Alberto Fernandez joined the inaugural meeting of the so-called Puebla Group in Buenos Aires on Saturday, a conference of left-leaning regional political leaders.",https://www.reuters.com/article/us-argentina-puebla-group-idUSKBN1XJ0CB,https://s2.reutersmedia.net/resources/r/?m=02&d=20191109&t=2&i=1450248361&w=1200&r=LYNXMPEFA80FI,2019-11-09T15:56:52Z,"BUENOS AIRES (Reuters) - Argentine President-elect Alberto Fernandez joined the inaugural meeting of the so-called Puebla Group in Buenos Aires on Saturday, a conference of left-leaning regional political leaders. 
Fernandez, who is considered a moderate Per… [+1469 chars]",0,43.0,5.0,17.0,0.0
63,abc-news,ABC News,PAUL J. WEBER Associated Press,All eyes on Texas governor as calls grow to halt execution,All eyes are on Texas Gov. Greg Abbott and whether he'll allow the execution of a death row inmate to proceed despite pressure from lawmakers and celebrities to call it off,https://abcnews.go.com/US/wireStory/eyes-texas-governor-calls-grow-halt-execution-66870412,https://s.abcnews.com/images/US/WireAP_e6f0dccc24a24a30aff34713dee57dfe_16x9_992.jpg,2019-11-09T05:02:40Z,"In his five years as Texas' governor, Republican Greg Abbott has overseen the execution of nearly 50 prisoners while only once sparing a condemned man's life, after a victims' family asked him to do so.
But Abbott who has proudly referred to the death penalt… [+4143 chars]",0,10.0,0.0,6.0,0.0
31,al-jazeera-english,Al Jazeera English,Santiago Saez,Spain's general election: Seven things to know,"Will the deadlock be broken, and is there a growing far-right threat? All you need to know about Spain's vote on Sunday.",https://www.aljazeera.com/indepth/features/spain-general-election-191109064015003.html,https://www.aljazeera.com/mritems/Images/2019/11/9/ff26a3bbc69e4db98e61ee22a87fa0c4_18.jpg,2019-11-09T07:05:50Z,"Madrid, Spain - Spain will hold its fourth general election on Sunday in as many years to try and break a deadlock.
At the last vote, in April this year, acting Prime Minister Pedro Sanchez of the Spanish Socialist Workers' Party (PSOE), won most seats. But … [+6754 chars]",0,204.0,10.0,40.0,0.0
46,the-new-york-times,The New York Times,Zolan Kanno-Youngs and Miriam Jordan,New Trump Administration Proposal Would Charge Asylum Seekers an Application Fee,The proposal also includes increasing fees for those applying for citizenship by more than 60 percent.,https://www.nytimes.com/2019/11/08/us/politics/immigration-fees-trump.html,https://static01.nyt.com/images/2019/11/08/us/08dc-immig/merlin_160958094_a70dce11-ec26-45fc-8f98-29a67dd48495-facebookJumbo.jpg,2019-11-09T03:34:32Z,"United States Citizenship and Immigration Services, he said in a statement, is required to examine incoming and outgoing expenditures, just like a business, and make adjustments based on that analysis. He said the proposed changes would help an overextended s… [+1430 chars]",0,3421.0,735.0,563.0,0.0
41,bbc-news,BBC News,https://www.facebook.com/bbcnews,Bloodhound land speed car will be back racing next week,Engineers think they understand why a heat sensor has been playing up on the superfast desert vehicle.,https://www.bbc.co.uk/news/science-environment-50361783,https://ichef.bbci.co.uk/news/1024/branded_news/7303/production/_109534492_bloodhound_track_map_640-nc.png,2019-11-09T15:28:24Z,"Image caption
 The upper-chassis was lifted off to one side of the car
The Bloodhound land speed challenger is likely to be back out on its South African lakebed track early next week.
Engineers are now satisfied they understand why a heat alarm has been t… [+4071 chars]",0,162.0,8.0,25.0,0.0
61,the-new-york-times,The New York Times,Mariel Padilla,"Man Charged in Sexual Assault of Woman on a Flight, Officials Say","An American Airlines flight from North Carolina to Utah was diverted to Tulsa, Okla., where the man was arrested, officials said.",https://www.nytimes.com/2019/11/08/us/american-airlines-passenger-groping.html,https://static01.nyt.com/images/2019/11/08/multimedia/08xp-americanairlines/merlin_163219710_515d53cc-5224-4aeb-8252-6cb9b63b5bba-facebookJumbo.jpg,2019-11-09T00:28:29Z,"A 32-year-old man was accused of sexually assaulting a female passenger during a flight, prompting it to be diverted to allow for his removal, federal prosecutors said on Friday. 
The man, James Clayton Cholewinski-Boyd, a retired speedskater, was in an aisl… [+470 chars]",0,1914.0,608.0,182.0,0.0
5,the-wall-street-journal,The Wall Street Journal,Amol Sharma and Joe Flint,The Great Streaming Battle Is Here. No One Is Safe. - The Wall Street Journal,"The Great Streaming Battle Is Here. No One Is Safe. The Wall Street Journal Netflix co-founder on a potential password sharing crackdown: 'You’re not scared, are you?' Yahoo Finance Netflix vs Disney Plus IG UK Hulu New Home of FX Past & Future Lineup | Scree…",https://www.wsj.com/articles/the-great-streaming-battle-is-here-no-one-is-safe-11573272000,https://si.wsj.net/public/resources/images/OG-DK588_201911_SOC_20191108184942.gif,2019-11-09T04:00:00Z,A new era is dawning in the entertainment world and youre about to get a whole lot more choicesfor better or worse. The streaming wars are here.Titans of media and technology are wagering billions that consumers will pay them a monthly fee to stream TV and mo… [+18744 chars],0,46.0,47.0,80.0,0.0
64,the-irish-times,The Irish Times,Dan Mulhall,The Tribe: Caitríona Perry on the political influence of Irish America,"Book review: Catríona Perry writes on Irish-US relations in a crisp, accessible style",https://www.irishtimes.com/culture/books/the-tribe-caitr%C3%ADona-perry-on-the-political-influence-of-irish-america-1.4069172?localLinksEnabled=false,,2019-11-09T06:00:00Z,,0,0.0,0.0,0.0,0.0
28,the-new-york-times,The New York Times,Knvul Sheikh,This Is What Climate Change Sounds Like,Scientists and artists hope the emotional power of music will help move people to act on the climate crisis.,https://www.nytimes.com/2019/11/09/science/climate-change-music-sound.html,https://static01.nyt.com/images/2019/11/12/science/08TB-CLIMATEMUSIC/08TB-CLIMATEMUSIC-facebookJumbo.jpg,2019-11-09T10:00:19Z,"Daniel and I have been shocked at how many people continue to contact us because they are moved by the music, Dr. St. George said. When I teach my classes and I put up the latest temperature plots, I dont get that kind of reaction from my students. Graphics j… [+1533 chars]",0,52.0,15.0,42.0,0.0
