,source_id,source_name,author,title,description,url,url_to_image,published_at,content,top_article,engagement_reaction_count,engagement_comment_count,engagement_share_count,engagement_comment_plugin_count
1,the-irish-times,The Irish Times,The Irish Times,Leicester go second as pressure grows on Arsenal boss Emery,Jamie Vardy and James Maddison on target as Foxes make it five straight league wins,https://www.irishtimes.com/sport/soccer/english-soccer/leicester-go-second-as-pressure-grows-on-arsenal-boss-emery-1.4078185,https://www.irishtimes.com/image-creator/?id=1.4078182&origw=1200,2019-11-09T19:40:35Z,"Leicester City 2 Arsenal 0
Red-hot Jamie Vardy piled the pressure on Arsenal boss Unai Emery as the Leicester striker continued to haunt the Gunners.
The forward scored his ninth goal in nine games against the Gunners to inspire the Foxes to a 2-0 win and i… [+2513 chars]",0,0.0,0.0,0.0,0.0
45,cnn,CNN,"Ray Sanchez, CNN",Mexico's security strategy called into question after Mormon killings and other violence,"After three women and six children were slaughtered on a remote dirt road in Mexico, relatives and members of their small religious community stood around the smoldering carnage for hours before local authorities arrived.",https://www.cnn.com/2019/11/09/americas/mexico-mormon-massacre-security/index.html,https://cdn.cnn.com/cnnnext/dam/assets/191107124957-mexico-mormon-massacre-matt-rivers-super-tease.jpg,2019-11-09T09:25:57Z,"(CNN)After three women and six children were slaughtered on a remote dirt road in Mexico, relatives and members of their small religious community stood around the smoldering carnage for hours before local authorities arrived.
The horrific broad-daylight cri… [+7768 chars]",0,2.0,0.0,15.0,0.0
26,the-irish-times,The Irish Times,Andy Hunter,Alisson driven by missing out so closely in last year’s title race,The Liverpool goalkeeper has in 2019 conquered Europe with Liverpool and South America with Brazil in the Copa América,https://www.irishtimes.com/sport/soccer/english-soccer/alisson-driven-by-missing-out-so-closely-in-last-year-s-title-race-1.4077181,https://www.irishtimes.com/image-creator/?id=1.4077179&origw=1440,2019-11-09T09:00:04Z,"Champions League glory elevated Liverpool in June, and ingrained a relentless winning mentality that now propels their pursuit of a first league title for 30 years. That is the popular perception anyway. 
Liverpool goalkeeper Alisson offers an alternative th… [+7926 chars]",0,58.0,0.0,1.0,0.0
26,business-insider,Business Insider,Mark Matousek,A lawyer who represents cruise-ship workers reveals why it's nearly impossible for them to sue their employers when they feel like they've been mistreated,"It's very difficult for cruise-ship workers to sue their employers if they feel they've been mistreated. When cruise-ship workers sign their employment contracts, they agree that if they have a conflict with the cruise line, they will settle it through arbitr…",https://www.businessinsider.com/why-its-nearly-impossible-for-cruise-workers-to-sue-employers-2019-11,https://image.businessinsider.com/5dc59d437eece511646aa3a7?width=1200&format=jpeg,2019-11-09T14:32:00Z,A lawsuit or a report to a regulator are two last-resort options available to many workers who feel like their employers have mistreated them. But doing either can be difficult or ineffective for a cruise-ship worker because cruise lines often require workers… [+3121 chars],0,20.0,3.0,19.0,0.0
70,bbc-news,BBC News,BBC News,Urchinbot could help ocean clean-up and other tech news,BBC Click's Lara Lewington looks at some of the week's best technology stories.,https://www.bbc.co.uk/news/av/technology-50242072/urchinbot-could-help-ocean-clean-up-and-other-tech-news,https://ichef.bbci.co.uk/news/1024/branded_news/CEC8/production/_109563925_p07t8zst.jpg,2019-11-09T09:54:43Z,,0,0.0,0.0,0.0,0.0
75,abc-news,ABC News,Abc News,Iowa inmate's claim he briefly died won't end life sentence,Iowa inmate's claim he briefly died won't end life sentence go.com,https://abcnews.go.com/Weird/wireStory/iowa-inmates-claim-briefly-died-end-life-sentence-66849331,https://s.abcnews.com/images/Weird/WireAP_a3c94f07112b43af890c448c1ae744b6_16x9_992.jpg,2019-11-09T01:19:43Z,"The Iowa Appeals Court has ruled against a convicted killer who says he ""died"" during a medical emergency and thus fulfilled his life sentence.
Wapello County court records say Benjamin Schreiber has been serving the life term since being convicted in 1997 o… [+517 chars]",0,3450.0,859.0,718.0,0.0
6,cbs-news,CBS News,CBS News,Women in Japan fight expectation to wear high heels to work,Wearing them is considered a kind of office etiquette,https://www.cbsnews.com/news/kutoo-movement-women-in-japan-fight-expectation-to-wear-high-heels-to-work-2019-11-09/,https://cbsnews1.cbsistatic.com/hub/i/r/2019/11/09/fb38ce5c-29d7-45c4-b39f-7324e4606f26/thumbnail/1200x630/34d02659734bc21f9ea43e6cd91f18d6/kutoo-movement.jpg,2019-11-09T16:31:56Z,"Women in Japan are fighting back against the expectation that they wear high heals to work. Taking a page from the #MeToo movement, tens of thousands are participating in a social media campaign called #KuToo, which means shoe suffering.  
Activist Yumi Ishi… [+1271 chars]",1,2.0,3.0,8.0,0.0
41,cnn,CNN,"Paul Vercammen, CNN","A World War II veteran finally gets a Silver Star, decades after dying in the Battle of the Bulge","Staff Sgt. Edmund ""Eddie"" Sternot of the 101st Airborne Division rushed his machine gunners to move in front of a surprise German breakthrough in January 1945, according to the US Army.",https://www.cnn.com/2019/11/09/us/veterans-day-edmund-sternot-silver-star/index.html,https://cdn.cnn.com/cnnnext/dam/assets/191108183046-01-wwii-hero-silver-star-super-tease.jpg,2019-11-09T10:01:46Z,"(CNN)Staff Sgt. Edmund ""Eddie"" Sternot of the 101st Airborne Division rushed his machine gunners to move in front of a surprise German breakthrough in January 1945, according to the US Army.
Sternot's isolated men held their icy ground in the Belgian forest … [+3572 chars]",0,333.0,14.0,143.0,0.0
57,bbc-news,BBC News,https://www.facebook.com/bbcnews,"Fall of Berlin Wall remembered at Imjin Barracks, near Gloucester","Maj Laurence Roach says it is a ""quirk of history"" that the section of wall should be in the UK.",https://www.bbc.co.uk/news/uk-england-gloucestershire-50335237,https://ichef.bbci.co.uk/news/1024/branded_news/7F11/production/_109592523_img_1058.jpg,2019-11-09T12:16:48Z,"Image caption
 Maj Laurence Roach (l) and Lt/Col Florian Raebel said the piece of wall ""reminds us that there are still divided cities and divided people""
Soldiers at an army barracks in Britain that boasts its own section of the Berlin Wall are marking 30 … [+1842 chars]",0,25.0,3.0,22.0,0.0
77,abc-news,ABC News,MARK STEVENSON Associated Press,Descendants meet in Mexico on 500th anniversary of conquest,Descendants of Spanish conquistador Hernán Cortés and Aztec emperor Moctezuma have met in Mexico City to mark the 500th anniversary of their forebearers' first encounter,https://abcnews.go.com/International/wireStory/descendants-meet-mexico-500th-anniversary-conquest-66865263,https://s.abcnews.com/images/International/WireAP_1b3af04e314d496ca71804d5d343bb2c_16x9_992.jpg,2019-11-09T01:04:41Z,"Descendants of Spanish conquistador Hernán Cortés and Aztec emperor Moctezuma met Friday in Mexico City to mark the 500th anniversary of their forebearers' first encounter.
The hope was that the meeting, at a colonial church where Cortés is buried, would go … [+2666 chars]",0,2.0,0.0,6.0,0.0
11,reuters,Reuters,Reuters Editorial,Trump says will probably release second Ukraine transcript on Tuesday,U.S. President Donald Trump said on Saturday that the White House would probably release a transcript of a second call with Ukrainian President Volodymyr Zelenskiy on Tuesday.,https://www.reuters.com/article/us-usa-trump-impeachment-ukraine-idUSKBN1XJ0F0,https://s2.reutersmedia.net/resources/r/?m=02&d=20191109&t=2&i=1450283671&w=1200&r=LYNXMPEFA80IF,2019-11-09T18:15:49Z,"WASHINGTON (Reuters) - U.S. President Donald Trump said on Saturday that the White House would probably release a transcript of a second call with Ukrainian President Volodymyr Zelenskiy on Tuesday. 
“We have another transcript coming out which is very impor… [+356 chars]",0,10.0,6.0,7.0,0.0
35,bbc-news,BBC News,https://www.facebook.com/bbcnews,Teenager racially abused and attacked near Pittodrie stadium,"The 18-year-old suffered facial injuries in the assault, which happened in Aberdeen on Friday evening.",https://www.bbc.co.uk/news/uk-scotland-north-east-orkney-shetland-50360994,https://ichef.bbci.co.uk/news/1024/branded_news/13C2B/production/_109593908_mediaitem109593904.jpg,2019-11-09T15:56:48Z,"Image copyrightGoogleImage caption
 The incident happened in Pitttodrie Lane
A teenager has been subjected to racist abuse and assaulted near Aberdeen's Pittodrie Stadium.
Police said the 18-year-old suffered injuries to his face in the incident which happ… [+496 chars]",0,52.0,13.0,9.0,0.0
18,abc-news,ABC News,RACHEL LERMAN AP Business Writer,"Despite fires, California wine is doing just fine - for now",The wineries of Sonoma County are largely unharmed despite fires that raged through the area this fall,https://abcnews.go.com/Business/wireStory/fires-california-wine-fine-now-66876409,https://s.abcnews.com/images/Lifestyle/WireAP_a8b653bb816b4e998998e024f02d2488_16x9_992.jpg,2019-11-09T15:49:55Z,"If you're worried that wildfires might have created shortages of Northern California's 2019 cabernet sauvignon, or even just imparted it with an undesirable smoky flavor, you can relax. The wine is just fine. For now.
Despite a late October blaze that raged … [+5224 chars]",1,0.0,0.0,10.0,0.0
15,the-irish-times,The Irish Times,Gerry Moriarty,Journalist and broadcaster Eamonn Mallie publishes collection of poetry,Journalist’s first collection ‘anchored’ in his upbringing in south Armagh,https://www.irishtimes.com/news/ireland/irish-news/journalist-and-broadcaster-eamonn-mallie-publishes-collection-of-poetry-1.4078127,https://www.irishtimes.com/image-creator/?id=1.4078125&origw=1440,2019-11-09T14:00:29Z,"Journalist, broadcaster and art expert Eamonn Mallie has embarked on yet another career direction with the publication of his first collection of poetry, Under the Tilley Lamp to be launched with a reading at the Lyric Theatre in Belfast on Sunday night.
The… [+3387 chars]",0,1.0,0.0,1.0,0.0
22,newsweek,Newsweek,Dan Cancian,"College Football TV Schedule 2019: Where to Watch Iowa vs. Wisconsin, TV Channel, Live Stream and Odds",Iowa travels to Wisconsin on Saturday in one of only three top-25 matchups in Week 11 of the college football season.,https://www.newsweek.com/college-football-2019-iowa-wisconsin-where-watch-tv-channel-live-stream-1469894,https://d.newsweek.com/en/full/1542905/iowa-hawkeyes.jpg,2019-11-09T15:00:01Z,"Wisconsin and Iowa collide on Saturday in the second of two potentially season-defining matchups as far as the Big Ten is concerned.
The Badgers and the Hawkeyes debuted at No.13 and No.18 respectively in the first College Football Playoff ranking of the sea… [+3219 chars]",0,0.0,0.0,2.0,0.0
31,business-insider,Business Insider,"feedback@businessinsider.com (竹下 郁子), 竹下 郁子",Women in Japan have been told not to wear glasses at work to avoid looking 'cold' and 'unfeminine',"Getty Images / Atsushi Yamada Women aren't being allowed to wear glasses by various employers in Japan. From department stores and showrooms to the hospitality industry and beauty clinics, a number of workplaces have banned women from wearing the eyewear. Rea…",https://www.businessinsider.com/women-japan-banned-from-wearing-glasses-as-its-not-elegant-2019-11,https://image.businessinsider.com/5dc65e563afd3732bc03f1a2?width=1200&format=jpeg,2019-11-09T13:57:18Z,"Women in a variety of workplaces across Japan, including receptions at department stores and showrooms to hospitality staff and nurses at beauty clinics, have been banned from wearing glasses.
Apparently, glasses aren't being treated as just medical aids; wh… [+8787 chars]",0,833.0,242.0,171.0,0.0
3,abc-news,ABC News,The Associated Press,Manafort's former son-in-law sentenced for multiple scams,The former son-in-law of Paul Manafort has been sentenced in Los Angeles to nine years in prison for a series of schemes,https://abcnews.go.com/US/wireStory/manaforts-son-law-sentenced-multiple-scams-66878507,null,2019-11-09T18:59:24Z,"The former son-in-law of Paul Manafort has been sentenced in Los Angeles to nine years in prison for a series of schemes, including one that bilked $3 million from actor Dustin Hoffman.
A federal judge ordered Jeffrey Yohai to pay $6.7 million in restitution… [+541 chars]",1,3.0,0.0,15.0,0.0
8,the-irish-times,The Irish Times,Brian Hutton,"RTÉ needs government rescue plan, says Moya Doherty",Chair of broadcaster’s board claims it will struggle to adapt without licence fee rise,https://www.irishtimes.com/news/ireland/irish-news/rt%C3%A9-needs-government-rescue-plan-says-moya-doherty-1.4078156,https://www.irishtimes.com/image-creator/?id=1.4078154&origw=1440,2019-11-09T16:58:23Z,"RTÉ will not survive without a government rescue plan for its existential financial crisis, the chair of the independent body which oversees the State broadcaster has warned.
Moya Doherty, chair of the RTÉ board, said the pace of change in media globally was… [+1504 chars]",0,2.0,1.0,3.0,0.0
71,cnn,CNN,"Ryan Prior, CNN","When a Waffle House was short on staff, customers jumped behind the counter to help out","Late last Saturday night, Ethan Crispo had just left a friend's birthday party in Birmingham, Alabama, and walked into a Waffle House around midnight to grab a bite.",https://www.cnn.com/2019/11/08/us/waffle-house-customers-help-out-trnd/index.html,https://cdn.cnn.com/cnnnext/dam/assets/191108173834-01-waffle-house-customers-super-tease.jpg,2019-11-09T01:46:50Z,"(CNN)Late last Saturday night, Ethan Crispo had just left a friend's birthday party in Birmingham, Alabama, and walked into a Waffle House around midnight to grab a bite.
Crispo told CNN only a single employee was working in the restaurant.
He described the… [+2193 chars]",0,1001.0,253.0,728.0,0.0
9,the-irish-times,The Irish Times,Marie O'Halloran,Boylan claims maternity hospital site still under religious control,"Outstanding issues need to be resolved before building begins at St Vincent’s site, says Harris",https://www.irishtimes.com/news/politics/boylan-claims-maternity-hospital-site-still-under-religious-control-1.4078153,https://www.irishtimes.com/image-creator/?id=1.4078150&origw=1440,2019-11-09T16:24:47Z,"Minister for Health Simon Harris has said that all outstanding issues about the National Maternity Hospital have to be resolved before substantial building work begins on the site.
Former master of the hospital Peter Boylan said on Saturday that the site was… [+2820 chars]",0,76.0,43.0,19.0,0.0
22,bbc-news,BBC News,,2019/11/09 17:01 GMT,The latest five minute news bulletin from BBC World Service.,https://www.bbc.co.uk/programmes/w172wy0nd48880g,https://ichef.bbci.co.uk/images/ic/1200x675/p060dh18.jpg,2019-11-09T17:04:00Z,The latest five minute news bulletin from BBC World Service.,0,0.0,0.0,0.0,0.0
63,reuters,Reuters,Reuters Editorial,Iraqi PM calls for protests to allow a return to 'normal life',"Iraq's Prime Minister Abdul Mahdi said on Saturday that although protests were important in bringing about reform, life in the country must be allowed to return to normal.",https://www.reuters.com/article/us-iraq-protests-idUSKBN1XJ07V,https://s1.reutersmedia.net/resources/r/?m=02&d=20191109&t=2&i=1450179749&w=1200&r=LYNXMPEFA809A,2019-11-09T11:15:54Z,"BAGHDAD (Reuters) - Iraq’s Prime Minister Abdul Mahdi said on Saturday that although protests were important in bringing about reform, life in the country must be allowed to return to normal. 
“The protests have helped and will help pressure political groups… [+375 chars]",0,38.0,11.0,2463.0,0.0
4,cbs-news,CBS News,CBS News,Mural of activist Greta Thunberg goes up in San Francisco,It aims to draw attention to climate change,https://www.cbsnews.com/news/san-francisco-mural-greta-thunberg-aims-draw-attention-climate-change-2019-11-09/,https://cbsnews2.cbsistatic.com/hub/i/r/2019/11/09/afe86c05-a1d8-4401-95b8-05cc2b80cf7c/thumbnail/1200x630/3923b2f6ef19d54b2d39eba30b314895/ap-19312752092180.jpg,2019-11-09T17:18:12Z,"San Francisco – The newest addition to the San Francisco skyline is a work of art: a mural depicting activist Greta Thunberg, designed to draw attention to climate change, CBS SF Bay Area reports.
Thunberg is the 16-year-old who has inspired young people all… [+1824 chars]",1,5.0,6.0,17.0,0.0
2,bbc-news,BBC News,,Lewandowski's scoring run continures as Bayern thrash Dortmund,"Robert Lewandowski's incredible scoring run continues as Bayern Munich thrashed Borussia Dortmund in ""Der Klassiker"" on Saturday evening.",https://www.bbc.co.uk/sport/football/50363167,https://ichef.bbci.co.uk/onesport/cps/624/cpsprodpb/17ABF/production/_109595969_gettyimages-1181095211.jpg,2019-11-09T19:30:07Z,"Robert Lewandowski has only failed to score in one game this season for Bayern, a German Cup game against Bochum
Robert Lewandowski's incredible scoring run continued as Bayern Munich thrashed Borussia Dortmund in 'Der Klassiker' on Saturday evening.
Lewand… [+324 chars]",0,124.0,27.0,12.0,0.0
55,the-irish-times,The Irish Times,Seán Moran,Weekend Gaelic Games club previews,There’s action in football and hurling at county and interprovincial levels,https://www.irishtimes.com/sport/gaelic-games/weekend-gaelic-games-club-previews-1.4077212,https://www.irishtimes.com/image-creator/?id=1.4077210&origw=1440,2019-11-09T06:00:00Z,"FOOTBALL - SATURDAY
TIPPERARY SFC FINALClonmel Commercials v JK Brackens, Semple Stadium, 2.30 Clonmel look to maintain their recent record of winning the title in alternate years and having added a Munster title four years ago, are understandably hot favour… [+7242 chars]",0,0.0,0.0,0.0,0.0
5,reuters,Reuters,Reuters Editorial,Turkish and Russian presidents discuss northeast Syria,"President Tayyip Erdogan and Russia's Vladimir Putin discussed Turkey's military offensive in Syria in a phone call on Saturday, Turkey's presidency said.",https://af.reuters.com/article/worldNews/idAFKBN1XJ0FU,https://s4.reutersmedia.net/resources/r/?m=02&d=20191109&t=2&i=1450296059&w=1200&r=LYNXMPEFA80IX,2019-11-09T19:05:43Z,"ISTANBUL (Reuters) - President Tayyip Erdogan and Russia’s Vladimir Putin discussed Turkey’s military offensive in Syria in a phone call on Saturday, Turkey’s presidency said. 
Turkey launched its cross-border offensive one month ago, saying it aimed to driv… [+1066 chars]",0,0.0,0.0,0.0,0.0
52,abc-news,ABC News,Mark Osborne,Witness saw suspect force missing 19-year-old into car against her will: Affidavit,"Get breaking national and world news, broadcast video coverage, and exclusive interviews. Find the top news online at ABC news.",https://abcnews.go.com/US/witness-suspect-force-aniah-blanchard-missing-stepdaughter-ufc/story?id=66872047,https://s.abcnews.com/images/US/ibraheem-zaheed-mug-wings-ho-mo-20191109_hpMain_16x9_992.jpg,2019-11-09T07:12:44Z,"A witness outside an Alabama convenience store said he saw the man arrested in the disappearance of Aniah Blanchard force the 19-year-old stepdaughter of UFC fighter Walt Harris into her own car and kidnap her, according to an arrest affidavit.
Ibraheem Yaze… [+3223 chars]",0,1321.0,585.0,275.0,0.0
41,the-irish-times,The Irish Times,Marie O'Halloran,"Labour will only support government that backs its policies, says Howlin",Leader claims party ‘indifferent’ on partnership with either Fine Gael or Fianna Fáil,https://www.irishtimes.com/							/news/politics/labour-will-only-support-government-that-backs-its-policies-says-howlin-1.4078110	,https://www.irishtimes.com/image-creator/?id=1.4078114&origw=1440,2019-11-09T13:02:57Z,"Labour will only go into government with other parties if its non-negotiable stance on five policy areas are adhered to, party leader Brendan Howlin has said.
Speaking to the media at the partys national conference in Mullingar, Mr Howlin said the four byele… [+3533 chars]",1,,,,
4,al-jazeera-english,Al Jazeera English,Al Jazeera,"Amid protests, Morales says 'coup' risks democracy in Bolivia",Bolivian leader's statement on Twitter comes as police join opposition protests following disputed election result.,https://www.aljazeera.com/news/2019/11/protests-morales-coup-risks-democracy-bolivia-191109135800823.html,https://www.aljazeera.com/mritems/Images/2019/11/5/abf6d60c42614eae8b689655943ff018_18.jpg,2019-11-09T16:27:47Z,"Bolivian President Evo Morales denounced what he called a coup by violent groups on Saturday, as police officers joined opposition protests amid a weeks-long standoff over a disputed election.
Morales, Latin America's longest-standing leader, won the electio… [+2072 chars]",0,60.0,3.0,15.0,0.0
12,al-jazeera-english,Al Jazeera English,Al Jazeera,Indonesia: Police arrest businessman over journalists' murder,Wibharry Padmoasmolo detained for allegedly ordering the killing of two journalist in the northern Sumatra province.,https://www.aljazeera.com/news/2019/11/indonesia-police-arrest-businessman-journalists-murder-191109095604769.html,https://www.aljazeera.com/mritems/Images/2019/10/13/8c4301d7a4a040ecbbf55b31ab2836e1_18.jpg,2019-11-09T11:33:36Z,"Indonesian police have arrested a businessman for allegedly ordering the killing of two journalists in the northern Sumatra province. 
The bodies of the journalists, Maraden Sianipar and Maratua Siregar, who were mediating a land dispute between the business… [+1730 chars]",0,1.0,0.0,16.0,0.0
0,cnn,CNN,"Kate Sullivan and Ryan Nobles, CNN",Virginia Democrats elect first female speaker of the House,"For the first time in Virginia's 400-year legislative history, a woman will become speaker of the House.",https://www.cnn.com/2019/11/09/politics/virginia-democrats-first-female-speaker-eileen-filler-corn/index.html,https://cdn.cnn.com/cnnnext/dam/assets/191109135152-eileen-filler-corn-va-speaker-of-the-house-restricted-super-tease.jpg,2019-11-09T19:47:54Z,,0,2.0,0.0,33.0,0.0
35,the-irish-times,The Irish Times,Rosita Boland,"Meet the woman who packs your online shopping, and carries a ‘gun’","Marie McMahon is moving with the speed of a rollerblader among the aisles of SuperValu’s Castletroy branch in Limerick. McMahon is a full-time “picker” and driver of home-delivery groceries. She is one of a team of five pickers and three drivers, who service …",https://www.irishtimes.com/life-and-style/food-and-drink/meet-the-woman-who-packs-your-online-shopping-and-carries-a-gun-1.4074499,https://www.irishtimes.com/image-creator/?id=1.4074481&origw=1440,2019-11-09T06:35:00Z,"Marie McMahon is moving with the speed of a rollerblader among the aisles of SuperValus Castletroy branch in Limerick.
McMahon is a full-time picker and driver of home-delivery groceries. She is one of a team of five pickers and three drivers, who service up… [+6630 chars]",0,1.0,0.0,1.0,0.0
43,reuters,Reuters,ladylove,Israel's Netanyahu appoints far-right Bennett as defence minister,"Israeli Prime Minister Benjamin Netanyahu appointed the head of a far-right political party as defence minister of his caretaker government, a spokesman for the premier's right-wing Likud party said on Friday.",https://uk.reuters.com/article/uk-israel-politics-defence-idUKKBN1XI1WM,https://s4.reutersmedia.net/resources/r/?m=02&d=20191108&t=2&i=1449881480&w=1200&r=LYNXMPEFA71HS,2019-11-09T13:48:47Z,"JERUSALEM (Reuters) - Israeli Prime Minister Benjamin Netanyahu appointed the head of a far-right political party as defence minister of his caretaker government, a spokesman for the premier’s right-wing Likud party said on Friday. 
Naftali Bennett, who head… [+2002 chars]",0,0.0,0.0,1.0,0.0
69,the-irish-times,The Irish Times,Ethna Viney,Is this a summer truffle I found in the local woods? Readers’ nature queries,"Ethna Viney on summer truffles, painted ladies and wall geckos",https://www.irishtimes.com/news/environment/is-this-a-summer-truffle-i-found-in-the-local-woods-readers-nature-queries-1.4069190,https://www.irishtimes.com/image-creator/?id=1.4069186&origw=1200,2019-11-09T06:00:00Z,"I thought Id hit the jackpot when this peeked up at me in the local woods. It matched the description of summer truffle, tastes nutty but doesnt smell of anything. Lynda Jones, Rooskey, Co LeitrimYes, it is a summer truffle.
Summer truffle 
I found this mus… [+1391 chars]",0,0.0,0.0,0.0,0.0
37,bbc-news,BBC News,,Hibernian 'an option' - Harry Kewell,"Former Liverpool forward Harry Kewell describes Hibernian as ""another option"" as he watches the managerless side take on St Johnstone.",https://www.bbc.co.uk/sport/football/50361733,https://ichef.bbci.co.uk/onesport/cps/624/cpsprodpb/9FF5/production/_109594904_19652764.jpg,2019-11-09T15:49:16Z,"Kewell was sacked as Notts County boss last November
Former Liverpool forward Harry Kewell has described Hibernian as ""another option"" as he watched the managerless side take on St Johnstone.
The Australian was sacked by English League Two Notts County last… [+1561 chars]",0,21.0,12.0,7.0,0.0
