,source_id,source_name,author,title,description,url,url_to_image,published_at,content,top_article,engagement_reaction_count,engagement_comment_count,engagement_share_count,engagement_comment_plugin_count
21,reuters,Reuters,Thomson Reuters,"U.S. officers train Guatemalan agents, see shortcomings","The U.S. training mission for Guatemalan security forces, which includes instruction in using biometric devices, stems from the first of two accords aimed at making the Central American country halt flows of asylum-seekers heading north. Colette Luke has more.",https://www.reuters.com/video/2019/11/01/us-officers-train-guatemalan-agents-see?videoId=619868674,https://s3.reutersmedia.net/resources/r/?d=20191101&i=OVB3PNGM7&w=1200&r=OVB3PNGM7&t=2,2019-11-01T17:00:26Z,"Reuters, the news and media division of Thomson Reuters, is the worlds largest international multimedia news provider reaching more than one billion people every day. Reuters provides trusted business, financial, national, and international news to profession… [+169 chars]",0,0.0,0.0,0.0,0.0
17,the-new-york-times,The New York Times,Benjamin Mueller,"For Vietnam’s ‘Box People,’ a Treacherous Journey","Despite the perils, 18,000 Vietnamese people a year are smuggled to Europe, because for most the rewards are worth the risk.",https://www.nytimes.com/2019/11/01/world/europe/vietnamese-migrants-europe.html,https://static01.nyt.com/images/2019/11/01/world/01britain-migrants1-promo/01britain-migrants1-facebookJumbo.jpg,2019-11-01T16:27:41Z,"But when Britain fails to deliver on that promise, migrants can end up in a dreadful limbo, kept from seeking help by the countrys harsh immigration system and living in the grip of a shadowy system of traffickers and the employers who rely on them.
I always… [+1327 chars]",0,0.0,0.0,33.0,0.0
17,business-insider,Business Insider,Business Insider,Career advice: Experts explain how to change your job and be happier - Business Insider,Career advice often focuses on changing your job so it's more fulfilling. That might mean quitting — or it might mean working slowly toward your goal.,http://www.businessinsider.com/career-advice-how-to-change-your-job-if-you-feel-stuck,https://image.businessinsider.com/5db8b748dee01972cc3f3783?width=1200&format=jpeg,2019-11-01T12:00:00Z,"Most working professionals have at some point found themselves stuck in a rut.
It could be that their boss is a tyrant; it could also be that they're bored and curious to see what else is out there.
Whatever the situation, there's almost assuredly a way out… [+2859 chars]",1,0.0,0.0,0.0,0.0
18,bbc-news,BBC News,https://www.facebook.com/bbcnews,Stefan Sutherland: Police visit Caithness locations,Officers are reviewing the initial investigation into the disappearance and death of Stefan Sutherland.,https://www.bbc.co.uk/news/uk-scotland-highlands-islands-50261555,https://ichef.bbci.co.uk/news/1024/branded_news/15654/production/_108963678_stefanone.jpg,2019-11-01T16:58:10Z,"Image copyrightStefan Sutherland familyImage caption
 Stefan Sutherland's body was found 11 days after he was reported missing
Detectives carrying out a review into the death of a man six years ago have met with his family and visited locations connected to… [+1397 chars]",0,0.0,0.0,1.0,0.0
5,cnn,CNN,"Sandra Gonzalez, CNN","Kelly Clarkson just announced a Las Vegas residency, y'all",Kelly Clarkson fans have been waiting for a moment like this: The singer is getting her very own Las Vegas residency.,https://www.cnn.com/2019/11/01/entertainment/kelly-clarkson-las-vegas/index.html,https://cdn.cnn.com/cnnnext/dam/assets/190503081129-01-kelly-clarkson-super-tease.jpg,2019-11-01T17:10:49Z,,0,0.0,0.0,9.0,0.0
32,the-irish-times,The Irish Times,Jennifer Bray,Regina Doherty praises Maria Bailey’s strength of character,‘She has been through an incredible amount but we’re a democratic party’,https://www.irishtimes.com/news/politics/regina-doherty-praises-maria-bailey-s-strength-of-character-1.4069327,https://www.irishtimes.com/image-creator/?id=1.4069326&origw=620,2019-11-01T13:51:00Z,"The Minister for Social Protection Regina Doherty has said the Fine Gael party needs to listen to the views of members in Maria Baileys constituency who passed a motion calling for an urgent review of the ticket.
Ms Doherty said that on a personal level, I a… [+2788 chars]",0,19.0,12.0,5.0,0.0
14,newsweek,Newsweek,Jenni Fink,"California Wildfires Cause Columbia, University of Virginia, Other Colleges to Extend Early Action and Decision Application Deadline","Along with having to deal with the stress of the fires, some students could be without power, making submitting online applications difficult.",https://www.newsweek.com/early-action-early-decision-deadline-extended-colleges-california-wildfire-1469253,https://d.newsweek.com/en/full/1542035/early-action-decision-college-extended-wildfire-california.jpg,2019-11-01T16:46:42Z,"California's wildfires came at a particularly bad time for high school students trying to submit their early action and early decision college applications.
In the days leading up to the Friday, November 1, application deadline, wildfires ravaged parts of Ca… [+2717 chars]",0,0.0,0.0,0.0,0.0
17,the-irish-times,The Irish Times,The Irish Times,"Man settles case over ‘fall on stairs’ after Christmas party for €550,000",Co-workers thought Edmund O’Shea (61) sleeping off effects of drink when found in hallway,https://www.irishtimes.com/news/crime-and-law/courts/high-court/man-settles-case-over-fall-on-stairs-after-christmas-party-for-550-000-1.4069514,https://www.irishtimes.com/image-creator/?id=1.4069513&origw=1440,2019-11-01T16:18:16Z,"A man who ended up with a serious head injury after allegedly falling on stairs when he stayed over at a colleagues house after an office Christmas party has settled his High Court action for 550,000.
Edmund OShea, it was alleged, was intoxicated and others … [+2478 chars]",0,97.0,128.0,20.0,0.0
59,business-insider,Business Insider,Zachary Hendrickson,UnitedHealth's Optum has acquired Vivify Health to tackle hospital readmission rates,"This story was delivered to Business Insider Intelligence Digital Health Pro subscribers earlier this morning. To get this story plus others to your inbox each day, hours before they're published on Business Insider, click here. UnitedHealth subsidiary Optum …",https://www.businessinsider.com/unitedhealth-optum-acquired-vivify-health-2019-11,https://image.businessinsider.com/5dbc40ade0ee7e471446b459?width=1200&format=jpeg,2019-11-01T14:43:00Z,"UnitedHealth subsidiary Optum acquired Texas-based remote patient monitoring (RPM) startup Vivify Health for an undisclosed amount, according to CNBC. 
 Business Insider Intelligence
Vivify equips payers and providers with a comprehensive RPM platform, comp… [+3641 chars]",0,0.0,0.0,2.0,0.0
9,newsweek,Newsweek,David Harding,The U.S. Wants a Backdoor to Your Encrypted Messages. Sweden Just Showed Up With a Battering Ram | Opinion,Swedish police will soon be able to secretly install spyware to read encrypted messages on the computers and telephones of crime suspects. The results will be keenly watched in Washington and beyond.,https://www.newsweek.com/sweden-us-encrpytion-telegram-whatsapp-1469284,https://d.newsweek.com/en/full/1542078/backdoor-getty.jpg,2019-11-01T17:20:29Z,"As the U.S. government continues to press Facebook to create a backdoor into its encrypted messages apps to allow police to access private communications, Sweden has performed the equivalent of smashing down the door without bothering to knock.
Mikael Damber… [+3995 chars]",0,0.0,0.0,0.0,0.0
15,cnn,CNN,"Anneken Tappe, CNN Business",Stocks could end Friday with another record after a strong jobs report,"Stocks are rallying Friday, with the S&P 500 and the Nasdaq Composite both on track for another record day.",https://www.cnn.com/2019/11/01/investing/sp-nasdaq-dow-stock-market-record/index.html,https://cdn.cnn.com/cnnnext/dam/assets/191101123139-02-nyse-1031-super-tease.jpg,2019-11-01T16:38:24Z,,0,3.0,1.0,10.0,0.0
11,reuters,Reuters,Reuters Editorial,"U.S., China reach consensus on principles after trade talks: Xinhua","The United States and China have reached consensus after talks between their main trade negotiators on Friday, Beijing's state-media Xinhua News Agency reported.",https://www.reuters.com/article/us-usa-trade-china-consensus-idUSKBN1XB4RM,https://s4.reutersmedia.net/resources_v2/images/rcom-default.png,2019-11-01T17:40:09Z,"(Reuters) - The United States and China have reached consensus after talks between their main trade negotiators on Friday, Beijing’s state-media Xinhua News Agency reported. 
“The two sides conducted serious and constructive discussions on properly addressin… [+276 chars]",0,0.0,0.0,835.0,0.0
4,the-wall-street-journal,The Wall Street Journal,Christopher Mims,Fitbit to Be Acquired by Alphabet,Deal values Fitbit at approximately $2.1 billion,https://www.wsj.com/articles/fitbit-to-be-acquired-by-google-llc-11572613473,https://images.wsj.net/im-122865/social,2019-11-01T13:09:20Z,"Fitbit Inc. said on Friday that its agreed to be acquired by Googles parent company Alphabet Inc. for $2.1 billion. 
Google will acquire the maker of wearable fitness trackers for $7.35 a share in cash. The deal is expected to close in 2020, the company said… [+84 chars]",0,778.0,144.0,293.0,0.0
21,cbs-news,CBS News,CBS/AP,RFK granddaughter's cause of death revealed,"Toxicology test found methadone, fluoxetine, norfluoxetine, diazepam, nordiazepam and alcohol in her system",https://www.cbsnews.com/news/saoirse-kennedy-hill-death-rfk-granddaughter-cause-of-death-drug-overdose-reports-today-2019-11-30/,https://cbsnews2.cbsistatic.com/hub/i/r/2019/08/03/04d48077-b231-4191-8941-61d9433c3757/thumbnail/1200x630/492ed9dc13104e19a021e03acde4147e/0803-ctm-kennedydeath-saoirse-1903999-640x360.jpg,2019-11-01T15:44:08Z,"Authorities have determined that Saoirse Kennedy Hill, the 22-year-old granddaughter of assassinated presidential candidate Robert F. Kennedy, died of a drug overdose. The Boston Globe and WCVB-TV reported Friday that a toxicology test found methadone, fluoxe… [+1049 chars]",0,1523.0,347.0,236.0,0.0
68,cnn,CNN,"Lisa Respers France, CNN",'The Witcher' trailer reveals release date,"If you are into fantasy, go ahead and take December 20 off of work.",https://www.cnn.com/2019/11/01/entertainment/witcher-trailer-netflix-trnd/index.html,https://cdn.cnn.com/cnnnext/dam/assets/191101075522-the-witcher-netflix-super-tease.jpg,2019-11-01T12:48:12Z,,0,1.0,0.0,9.0,0.0
12,the-new-york-times,The New York Times,Tina Jordan,‘I’ll Go to My Grave Ranting About How Important Fact-Checkers Are’,"Ronan Farrow wrestled with hard truths when writing “Catch and Kill,” which remains at No. 2 on the nonfiction list this week.",https://www.nytimes.com/2019/11/01/books/review/inside-list-ronan-farrow-catch-and-kill.html,https://static01.nyt.com/images/2019/10/16/arts/10insidethelist-Web/10insidethelist-Web-facebookJumbo-v2.jpg,2019-11-01T16:45:07Z,"Its fall, when the publishing world releases its blockbusters, and the best-seller lists brim with new books.
There are three new titles on the fiction list this week and three on nonfiction, including John Lithgows Dumpty, a collection of political protest … [+728 chars]",0,0.0,0.0,3.0,0.0
18,reuters,Reuters,Jonathan Stempel,Berkshire's Marmon unit buys medical device provider from Pritzker company,"Marmon Holdings Inc, a unit of Warren Buffett's Berkshire Hathaway Inc, on Friday said it bought a 60% stake in Colson Medical Cos, regaining control of a medical device maker it sold 17 years ago to wealthy Chicago businessman Robert Pritzker.",https://www.reuters.com/article/colson-ma-berkshire-marmon-idUSL2N27H0YG,https://s4.reutersmedia.net/resources_v2/images/rcom-default.png,2019-11-01T17:05:01Z,"Nov 1 (Reuters) - Marmon Holdings Inc, a unit of Warren Buffett’s Berkshire Hathaway Inc, on Friday said it bought a 60% stake in Colson Medical Cos, regaining control of a medical device maker it sold 17 years ago to wealthy Chicago businessman Robert Pritzk… [+1698 chars]",0,0.0,0.0,0.0,0.0
24,al-jazeera-english,Al Jazeera English,Al Jazeera,Lebanese President Aoun calls for 'non-sectarian' system,Michel Aoun says Lebanon must change from confessional to civil state as protesters call for a technocratic government.,https://www.aljazeera.com/news/2019/11/lebanese-president-aoun-calls-sectarian-system-191101055607826.html,https://www.aljazeera.com/mritems/Images/2019/11/1/8ace1e7e11444bd7b5969d6daada413e_18.jpg,2019-11-01T07:40:38Z,"Lebanon's president has said he is seeking to transform the country to a civil state, following the resignation of Prime Minister Saad Hariri amid nationwide protests against dire economic conditions.
The Mediterranean country's political system is based on … [+2619 chars]",0,448.0,26.0,81.0,0.0
32,the-new-york-times,The New York Times,Kai Schultz and Suhasini Raj,"New Delhi, Choking on Toxic Air, Declares Health Emergency","Schools were closed after pollution in India’s capital soared, reaching levels many times the global safe limit.",https://www.nytimes.com/2019/11/01/world/asia/delhi-pollution-health-emergency.html,https://static01.nyt.com/images/2019/11/01/world/01india-air/01india-air-facebookJumbo.jpg,2019-11-01T14:05:58Z,"Dr. Arvind Kumar, a chest surgeon in the city, said that 90 percent of his lung cancer patients three decades ago were smokers. Today, he said, the ratio was one to one, with at least 10 percent of his clients only in their 30s.
Fifty percent of the patients… [+1453 chars]",0,2062.0,356.0,528.0,0.0
15,abc-news,ABC News,The Associated Press,Conor McGregor fined in Ireland for assault,"Get breaking national and world news, broadcast video coverage, and exclusive interviews. Find the top news online at ABC news.",https://abcnews.go.com/Sports/wireStory/conor-mcgregor-fined-ireland-assault-66689984,https://s.abcnews.com/images/Sports/WireAP_86930e0594eb46249a51b2823866e520_16x9_992.jpg,2019-11-01T16:44:53Z,"Conor McGregor has been fined 1,000 euros ($1,120) for assaulting a man in a pub.
The retired mixed martial arts fighter from Ireland pleaded guilty to a charge of assault during an appearance at Dublin District Court.
Video footage of the incident in April… [+429 chars]",1,0.0,0.0,10.0,0.0
51,the-new-york-times,The New York Times,Nicole Sperling,‘Irishman’s’ Short Window From Big Screen to Small Has Theaters Fuming,"Scorsese’s Netflix gangster epic will play in select theaters before it streams. “It’s a disgrace,” says John Fithian, the head of the theater owners organization.",https://www.nytimes.com/2019/11/01/business/irishman-netflix-theaters.html,https://static01.nyt.com/images/2019/11/01/business/01IRISHMAN-01/merlin_163117860_3dc6e9ef-3374-4fe2-88b6-a03d9f53a528-facebookJumbo.jpg,2019-11-01T12:00:05Z,"If Netflix had agreed to an exclusive 60-day run for The Irishman, other studios would have most likely demanded the same for their films. A new industry standard would have been set in a business that has clung to the belief that you close the theatrical win… [+1699 chars]",0,26.0,7.0,56.0,0.0
0,reuters,Reuters,Reuters Editorial,U.S. disappointed by WTO decision allowing China to slap trade sanctions on U.S. goods,"The United States is disappointed by a World Trade Organization (WTO) decision that China may slap compensatory sanctions on U.S. imports worth $3.579 billion annually for the U.S. failure to remove anti-dumping duties, a U.S. official said on Friday.",https://www.reuters.com/article/us-china-trade-usa-reaction-idUSKBN1XB4TW,https://s3.reutersmedia.net/resources/r/?m=02&d=20191101&t=2&i=1447392618&w=1200&r=LYNXMPEFA03B7,2019-11-01T18:03:25Z,"WASHINGTON (Reuters) - The United States is disappointed by a World Trade Organization (WTO) decision that China may slap compensatory sanctions on U.S. imports worth $3.579 billion annually for the U.S. failure to remove anti-dumping duties, a U.S. official … [+546 chars]",0,0.0,0.0,879.0,0.0
6,al-jazeera-english,Al Jazeera English,Al Jazeera,Nasrallah: New government must restore trust with Lebanese people,"Hezbollah leader calls for quick formation of new government which, he said, must listen to demands of people.",http://www.aljazeera.com/news/2019/11/nasrallah-government-restore-trust-lebanese-people-191101145235067.html,https://www.aljazeera.com/mritems/Images/2019/10/27/c1dd20e7a5844c40ab370db26648966e_18.jpg,2019-11-01T16:39:00Z,"Hassan Nasrallah, the leader of Iran-backed Hezbollah, has called for the quick formation of a new Lebanese government that must listen to the demands of protesters and work to restore confidence.
In a televised speech on Friday, Nasrallah said Prime Ministe… [+2659 chars]",1,0.0,0.0,0.0,0.0
43,newsweek,Newsweek,Rosie McCall,"Schools Close Across Vermont, Maine, Connecticut, Rhode Island Due to Severe Weather, Power Outages","Local websites have listed the names of educational faculties that will remain shut today in light of the power shortages affecting Vermont, Maine, Connecticut and Rhode Island this week.",https://www.newsweek.com/school-closings-vermont-maine-connecticut-rhode-island-severe-weather-power-outages-1469201,https://d.newsweek.com/en/full/1541914/school-bus.jpg,2019-11-01T13:58:14Z,"Dozens of schools have been forced to shut their doors in response to power outages across New England following severe weather affecting the northeastern states.
Local websites have listed the names of educational faculties that will remain shut on Friday i… [+2437 chars]",0,0.0,0.0,1.0,0.0
31,reuters,Reuters,Reuters Editorial,World Series champion Nationals to visit Trump at White House,The Washington Nationals have accepted an invitation to visit U.S. President Donald Trump at the White House on Monday to celebrate the franchise's first World Series triumph.,https://www.reuters.com/article/us-usa-trump-nationals-idUSKBN1XB4NK,https://s3.reutersmedia.net/resources/r/?m=02&d=20191101&t=2&i=1447368881&w=1200&r=LYNXMPEFA0375,2019-11-01T16:25:30Z,"(Reuters) - The Washington Nationals have accepted an invitation to visit U.S. President Donald Trump at the White House on Monday to celebrate the franchise’s first World Series triumph. 
The Nationals, who began playing in the U.S. capital in 2005 when the… [+1150 chars]",0,0.0,0.0,1.0,0.0
6,abc-news,ABC News,The Associated Press,"Popular LGBT club in Slovenia capital attacked, no injuries","Get breaking national and world news, broadcast video coverage, and exclusive interviews. Find the top news online at ABC news.",https://abcnews.go.com/International/wireStory/popular-lgbt-club-slovenia-capital-attacked-injuries-66691926,,2019-11-01T17:02:40Z,"Police in Slovenia say unknown assailants have attacked a popular LGBT club in Slovenia's capital Ljubljana.
Police say they are treating the incident as a hate crime. Slovenia's Prime Minister Marjan Sarec and LGBT rights groups have condemned the attack.
… [+485 chars]",0,0.0,0.0,3.0,0.0
0,cbs-news,CBS News,CBS News,Dancing priest joins Catholic school pep rally,"Cheerleaders from Cardinal Gibbons High School in Florida were joined by a special guest during their pep rally – Father Ricardo, the dancing priest. Video of the performance has gone viral.",https://www.cbsnews.com/video/dancing-priest-joins-catholic-school-pep-rally/,https://cbsnews1.cbsistatic.com/hub/i/r/2019/11/01/2045dfaa-f58f-4fdb-8097-b88dab4aea02/thumbnail/1200x630/0334a771f91b1e82cacbdf894d685f52/cheerleaderspeprallypreist-social-1968348-640x360.jpg,2019-11-01T18:20:26Z,,0,0.0,0.0,1.0,0.0
20,newsweek,Newsweek,Aristos Georgiou,Earthquakes in Southern California Put Stress on a Major Fault Line That's Been Dormant Since Records Began,"""The Garlock Fault has been quiet for a long time. But there's geologic evidence that there have been large earthquakes on it,"" the lead author of a new study said.",https://www.newsweek.com/earthquakes-southern-california-stress-major-fault-dormant-since-records-began-1469257,https://d.newsweek.com/en/full/1542027/ridgecrest-earthquakes.jpg,2019-11-01T16:23:24Z,"A series of earthquakes which shook Southern California earlier this year may have increased stress on parts of a major dormant fault line which has not produced any significant activity since records began, according to a study.
Scientists from the Universi… [+2411 chars]",0,0.0,0.0,0.0,0.0
55,the-irish-times,The Irish Times,The Irish Times,Cyclist dies after being hit by cement mixer in Dublin,"A cyclist has died in a road traffic collision that occurred on Friday morning on the South Circular Road, Dublin, at the junction of Bulfin Road. The collision involved a lorry, believed to be a cement mixer, and a male cyclist. Bulfin Road is at the rear of…",https://www.irishtimes.com/news/crime-and-law/cyclist-dies-after-being-hit-by-cement-mixer-in-dublin-1.4069178,https://www.irishtimes.com/polopoly_fs/1.4069177.1572605020!/image/image.jpg,2019-11-01T10:43:52Z,"A cyclist has died in a road traffic collision that occurred on Friday morning on the South Circular Road, Dublin, at the junction of Bulfin Road.
The collision involved a lorry, believed to be a cement mixer, and a male cyclist. Bulfin Road is at the rear o… [+699 chars]",0,578.0,110.0,115.0,0.0
1,reuters,Reuters,Reuters Editorial,U.S. cites progress in U.S.-China trade talks,"U.S. Trade Representative Robert Lighthizer and Treasury Secretary Steven Mnuchin made progress on a variety of issues during a telephone call on Friday with China's Vice Premier Liu He about an interim trade agreement, USTR said in a statement.",https://www.reuters.com/article/us-usa-trade-china-ustr-idUSKBN1XB4TB,https://s1.reutersmedia.net/resources/r/?m=02&d=20191101&t=2&i=1447392621&w=1200&r=LYNXMPEFA03B1,2019-11-01T18:03:25Z,"WASHINGTON (Reuters) - U.S. Trade Representative Robert Lighthizer and Treasury Secretary Steven Mnuchin made progress on a variety of issues during a telephone call on Friday with China’s Vice Premier Liu He about an interim trade agreement, USTR said in a s… [+390 chars]",0,0.0,0.0,877.0,0.0
2,the-new-york-times,The New York Times,James Poniewozik,Review: ‘His Dark Materials’ Paints a Vivid Children’s Crusade,"HBO’s Philip Pullman adaptation loses some of the books’ edge, but gains stunning imagery (think armored polar bears).",https://www.nytimes.com/2019/11/01/arts/television/review-his-dark-materials-hbo.html,https://static01.nyt.com/images/2019/11/03/arts/03materials/03materials-facebookJumbo.jpg,2019-11-01T17:52:51Z,"In HBOs spirited fantasy epic His Dark Materials, Lyra Belacqua (Dafne Keen), a runaway girl with a secret destiny, comes into possession of an alethiometer, a golden clockwork gizmo with the power to answer any question. One mystery, however, still eludes he… [+1196 chars]",0,1.0,0.0,3.0,0.0
1,newsweek,Newsweek,K Thor Jensen,Washington Tribe Buying Iconic Snoqualmie Falls for $125 Million,The purchase will represent the single largest conservation deal in the history of the Pacific Northwest.,https://www.newsweek.com/washington-tribe-buying-snoqualmie-falls-1469095,https://d.newsweek.com/en/full/1541768/snoqualmie-falls-salish-lodge.jpg,2019-11-01T18:00:01Z,"Washington's Snoqualmie tribe has announced that it will purchase Snoqualmie Falls, the adjacent Salish Lodge and 45 acres of land for $125 million.
The 276-foot waterfall on the Snoqualmie River is one of the state's most popular attractions, drawing more t… [+3680 chars]",0,40.0,5.0,17.0,0.0
67,the-irish-times,The Irish Times,"Donald Clarke, Tara Brady",Six of the best films to see in cinemas this weekend,"New this weekend: Monos, The Aeronauts, Sorry We Missed You, Doctor Sleep, Brittany Runs a Marathon",https://www.irishtimes.com/culture/film/six-of-the-best-films-to-see-in-cinemas-this-weekend-1.4067135,https://www.irishtimes.com/image-creator/?id=1.4067131&origw=1199,2019-11-01T09:45:00Z,"MONOSDirected by Alejandro Landes. Starring Sofia Buenaventura, Moises Arias, Julianne Nicholson, Moises Arias, Deiby Rueda, Karen Quintero, Laura Castrillon. 15A cert, lim release, 103 minLord of the Flies is an obvious reference for this nervy, thrilling ta… [+4692 chars]",0,0.0,0.0,0.0,0.0
31,cbs-news,CBS News,CBS News,Trump to host Washington Nationals at White House,The Washington Nationals won the World Series for the first time in franchise history this week,https://www.cbsnews.com/news/donald-trump-to-host-world-series-champions-washington-nationals-at-white-house-monday/,https://cbsnews3.cbsistatic.com/hub/i/r/2019/11/01/931dab34-de8d-4e1a-900f-e67f51ac3594/thumbnail/1200x630/fac9de39a27ccf037e264571f7a41169/gettyimages-1184538218.jpg,2019-11-01T14:23:40Z,"President Trump will host the World Series champion Washington Nationals on Monday in a celebratory event on the White House South Lawn, the White House confirmed. 
The Nationals made history when they won the title for the first time in franchise history We… [+455 chars]",0,1378.0,1002.0,103.0,0.0
34,newsweek,Newsweek,Phillip Martinez,"'WWE 2K20' Update 1.02 Fixes Bugs, Glitches & Braids - Patch Notes",Bianca Belair's entrance has seemingly been fixed.,https://www.newsweek.com/wwe-2k20-update-1-02-patch-notes-ps4-xbox-one-pc-1469231,https://d.newsweek.com/en/full/1541946/wwe-2k20-bianca-belair-entrance.png,2019-11-01T14:52:38Z,"WWE 2K20 had a disastrous launch last week, and 2K Sports has released the first patch to fixing many of the game's problems including graphics and gameplay.
Before WWE 2K20 was released, many previews and some reviews dinged this year's installment as an ov… [+2319 chars]",0,0.0,0.0,2.0,0.0
