,source_id,source_name,author,title,description,url,url_to_image,published_at,content,top_article,engagement_reaction_count,engagement_comment_count,engagement_share_count,engagement_comment_plugin_count
55,abc-news,ABC News,The Associated Press,Vatican police chief resigns over leak of police flyer identifying Vatican officials suspended in financial probe,"Get breaking national and world news, broadcast video coverage, and exclusive interviews. Find the top news online at ABC news.",https://abcnews.go.com/International/wireStory/vatican-police-chief-resigns-leak-police-flyer-identifying-66260320,,2019-10-14T13:05:09Z,Vatican police chief resigns over leak of police flyer identifying Vatican officials suspended in financial probe.,0,0.0,0.0,3.0,0.0
30,al-jazeera-english,Al Jazeera English,Al Jazeera,Vietnam pulls 'Abominable' film over South China Sea map,Animation film pulled over scene that shows map with China's unilaterally declared 'nine-dash line' of South China Sea.,https://www.aljazeera.com/news/2019/10/vietnam-pulls-abominable-film-south-china-sea-map-191014100622601.html,https://www.aljazeera.com/mritems/Images/2019/10/14/d4489c48b14140fea88f0beec3bf9254_18.jpg,2019-10-14T10:23:21Z,"Vietnam has pulled the animated DreamWorks film ""Abominable"" from cinemas over a scene featuring a map which shows China's unilaterally declared ""nine-dash line"" in the South China Sea, state media reported on Monday.
The U-shaped line is a feature used on C… [+1696 chars]",0,0.0,0.0,12.0,0.0
72,reuters,Reuters,Reuters Editorial,Tunisia's Nabil Karoui concedes election defeat to Kais Saied,"Nabil Karoui on Monday conceded defeat in Sunday's presidential election, issuing a statement of congratulations to his opponent Kais Saied, whom exit polls had earlier showed winning by a landslide.",https://www.reuters.com/article/us-tunisia-election-karoui-idUSKBN1WT1S8,https://s3.reutersmedia.net/resources/r/?m=02&d=20191014&t=2&i=1440743445&w=1200&r=LYNXMPEF9D16M,2019-10-14T13:57:58Z,"TUNIS (Reuters) - Nabil Karoui on Monday conceded defeat in Sunday’s presidential election, issuing a statement of congratulations to his opponent Kais Saied, whom exit polls had earlier showed winning by a landslide. 
“I would like to congratulate you on yo… [+232 chars]",0,0.0,0.0,6.0,0.0
20,al-jazeera-english,Al Jazeera English,Al Jazeera,Senior UAE official in Tehran on secret mission: MEE,The visit by Tahnoun bin Zayed marks the highest-level meeting between UAE and Iran since the tanker attacks in May.,https://www.aljazeera.com/news/2019/10/senior-uae-official-tehran-secret-mission-mee-191014095559179.html,https://www.aljazeera.com/mritems/Images/2019/8/1/d0082e00263445a8ab7874c6587ba67f_18.jpg,2019-10-14T11:39:42Z,"The national security adviser of the United Arab EmiratesTahnoun bin Zayed has been visiting Tehran on a secret mission aiming to defuse the tensions in the Gulf, a senior security source in the UAE told London-based news outlet Middle East Eye (MEE).
MEE co… [+2841 chars]",0,2.0,0.0,34.0,0.0
75,the-new-york-times,The New York Times,Michael S. Schmidt,Macabre Video of Fake Trump Shooting Media and Critics Is Shown at His Resort,The video was shown at a conference attended by Donald Trump Jr. and Sarah Huckabee Sanders. They said they did not see it.,https://www.nytimes.com/2019/10/13/us/politics/trump-video.html,https://static01.nyt.com/images/2019/10/13/us/politics/13dc-video1/13dc-video1-facebookJumbo.jpg,2019-10-14T00:38:44Z,"A spokesman for Mr. Trumps campaign said he knew nothing about the video.
That video was not produced by the campaign, and we do not condone violence, said Tim Murtaugh, the spokesman.
A DeSantis spokeswoman did not respond to an email seeking comment.
The… [+1791 chars]",1,85135.0,28656.0,24728.0,0.0
9,the-irish-times,The Irish Times,Joe Brennan,Green Reit deal on track despite tax shock,"Green Reit said on Monday that its planned €1.34 billion takeover by UK property firm Henderson Park is progressing towards a conclusion, after shares in the Dublin-based firm were rattled last week as it emerged that the deal will incur an unforeseen tax bil…",https://www.irishtimes.com/business/commercial-property/green-reit-deal-on-track-despite-tax-shock-1.4050198,https://www.irishtimes.com/image-creator/?id=1.4050196&origw=1440,2019-10-14T16:34:05Z,"Green Reit said on Monday that its planned 1.34 billion takeover by UK property firm Henderson Park is progressing towards a conclusion, after shares in the Dublin-based firm were rattled last week as it emerged that the deal will incur an unforeseen tax bill… [+1447 chars]",0,0.0,0.0,0.0,0.0
76,newsweek,Newsweek,Dan Cancian,"2019 College Football TV Schedule: Week 8 Games, Where to Watch, Live Stream","Top-ranked Alabama hosts Tennessee, while No. 2 ranked LSU and No. 3 ranked Clemson are on the road in Week 8.",https://www.newsweek.com/college-football-week-8-schedule-tv-channel-1464613,https://d.newsweek.com/en/full/1535756/lsu-tigers.jpg,2019-10-14T07:47:14Z,"Week 7 had a dramatic impact on the college football rankings, with Clemson sliding to No. 3 and Georgia losing seven spots.
The national champions routed ACC rival Florida State 45-14 and extended their winning run to 21 games but slid to third in the Assoc… [+3766 chars]",0,1.0,0.0,1.0,0.0
6,business-insider,Business Insider,Rachel Premack,Shopify is quickly gobbling up e-commerce. Its director of product reveals how avoiding the Amazon model helped fuel its meteoric rise.,"Shopify has a market cap of $42.3 billion — making it worth more than Twitter, Snap, Square, and Lyft. But you'd never search for products on the e-commerce company's website. Instead, the company is a backend for entrepreneurs to build their own shopping web…",https://www.businessinsider.com/shopifys-director-product-explains-why-avoids-amazon-model-2019-10,https://image.businessinsider.com/5da0a432cc4a0a45db6a83a9?width=1200&format=jpeg,2019-10-14T16:40:11Z,"Rachel Premack: Just to start off, how would you say Shopify looks at retailers or sellers as part of the platform? 
Michael Perry: We've always played kind of a background role for sellers — to be a hub and spoke model to allow them to sell and connect with… [+14005 chars]",0,16.0,0.0,11.0,0.0
1,abc-news,ABC News,The Associated Press,2 teens die in fiery crash when Porsche falls from overpass,"Get breaking national and world news, broadcast video coverage, and exclusive interviews. Find the top news online at ABC news.",https://abcnews.go.com/US/wireStory/teens-die-fiery-crash-porsche-falls-overpass-66256143,,2019-10-14T09:13:26Z,"Police say two teenagers are dead and a third is hospitalized with serious injuries after a crash that sent a Porsche plunging from an overpass onto train tracks, where it burst into flames.
Authorities in Rockland County told news outlets the Porsche fell f… [+551 chars]",1,1.0,0.0,13.0,0.0
2,bbc-news,BBC News,,Bury: Prospective buyer withdraws interest after due diligence on club,"A prospective buyer for Bury FC withdraws their interest after doing due diligence, says supporters' group Forever Bury.",https://www.bbc.co.uk/sport/football/50048869,https://ichef.bbci.co.uk/onesport/cps/624/cpsprodpb/A617/production/_108891524_bury_get.jpg,2019-10-14T17:07:33Z,"Bury were founded in 1885 and have twice won the FA Cup
A prospective buyer for expelled former League One club Bury has ended their interest after doing due diligence, says supporters' group Forever Bury.
The club, who plan to apply for a place in the 2019… [+933 chars]",0,26.0,6.0,9.0,0.0
16,business-insider,Business Insider,Tyler Lauletta,Steelers fans took over the Chargers' home stadium as the team continues to struggle to attract fans 3 years after moving to Los Angeles,"Pittsburgh fans took over the Chargers home stadium on Sunday, turning the stands at Dignity Health Sports Park into a sea of black and yellow and Terrible Towels. The Chargers often look like the road team at home since they relocated to Los Angeles. The Cha…",https://www.businessinsider.com/steelers-fans-take-over-chargers-stadium-terrible-towels-2019-10,https://image.businessinsider.com/5da49091cc4a0a51bf703a93?width=1200&format=jpeg,2019-10-14T16:17:44Z,"The Pittsburgh Steelers were on the road against the Los Angeles Chargers on Sunday night, but you wouldn't know it by the sound of the crowd.
The game was in primetime on national television, and Steelers fans took over Dignity Health Sports Park and turned… [+2406 chars]",0,0.0,0.0,1.0,0.0
55,the-new-york-times,The New York Times,Alexandra Marvar,Fly Fishing Is the New Bird-Watching,It’s the latest “old timey” hobby to gain a dedicated new following.,https://www.nytimes.com/2019/10/14/style/fly-fishing-returns.html,https://static01.nyt.com/images/2019/10/14/fashion/14flyfishing17/14flyfishing17-facebookJumbo.jpg,2019-10-14T09:00:11Z,"Step aside, goat yoga. The chic way to unwind now is fly fishing.
Thats right. For some of the same reasons millennials recently flocked to bird-watching, this sport long dominated by old white men is gaining popularity with a younger set. 
For those who ca… [+1032 chars]",1,199.0,42.0,101.0,0.0
19,cbs-news,CBS News,CBS News,Search efforts continue in Japan following deadly typhoon,Rescue crews in Japan are continuing their search efforts in the aftermath of the typhoon. It has been downgraded to a tropical storm but the death toll is still growing. CBS News foreign correspondent Ramy Inocencio joins CBSN with more.,https://www.cbsnews.com/video/search-efforts-continue-in-japan-following-deadly-typhoon/,https://cbsnews3.cbsistatic.com/hub/i/r/2019/10/14/0bfba0d2-d3e6-40cf-b96e-3709cc1724da/thumbnail/1200x630/e903ae6f75e075f6383c09b83ab4da0b/1014-cbsn-gwq-japantyphoon-1951508-640x360.jpg,2019-10-14T14:42:24Z,,0,0.0,0.0,0.0,0.0
73,the-irish-times,The Irish Times,Jack Power,Two GAA players remain in hospital after Enniskerry lorry fall,Nine members of men’s team were hospitalised on Saturday evening following championship win,https://www.irishtimes.com/news/ireland/irish-news/two-gaa-players-remain-in-hospital-after-enniskerry-lorry-fall-1.4049757,https://www.irishtimes.com/image-creator/?id=1.4049756&origw=1440,2019-10-14T08:53:15Z,"Two Enniskerry GAA players remain in hospital after some of the team was injured in a fall from the top of a lorry during a homecoming celebration in the Co Wicklow village. 
Nine members of the mens team were hospitalised on Saturday evening for injuries fr… [+1416 chars]",0,0.0,0.0,0.0,0.0
65,bbc-news,BBC News,,Catalan Football Federation suspends matches after separatist leaders jailed,The Catalan Football Federation suspends all matches in the region after nine Catalan separatist leaders are jailed.,https://www.bbc.co.uk/sport/football/50039790,https://ichef.bbci.co.uk/onesport/cps/624/cpsprodpb/7C6C/production/_109225813_gettyimages-864752032.jpg,2019-10-14T11:29:44Z,"Barcelona is the regional capital of Barcelona
The Catalan Football Federation has suspended all matches in the region on Monday after nine Catalan separatist leaders were jailed.
Spain's Supreme Court sentenced the leaders for sedition over their role in a… [+1338 chars]",0,7.0,0.0,30.0,0.0
44,the-irish-times,The Irish Times,The Irish Times,Brexit: Coveney says deal possible this week as EU seeks UK concessions,Johnson coming under pressure to concede more ground to Brussels as talks resume,https://www.irishtimes.com/							/news/politics/brexit-coveney-says-deal-possible-this-week-as-eu-seeks-uk-concessions-1.4049752	,https://www.irishtimes.com/image-creator/?id=1.4049751&origw=1440,2019-10-14T08:30:09Z,"Tánaiste Simon Coveney has said a Brexit deal is still possible this week, despite the DUP hardening its opposition to a potential solution to the deadlock over the weekend.
Speaking on Monday morning, Mr Coveney said: A deal is possible, and its possible th… [+3869 chars]",1,,,,
31,reuters,Reuters,Tamara Mathias,HIV-positive British living in Spain could lose healthcare post-Brexit,"(Reuters Health) - British citizens with HIV who live in Spain could face serious healthcare challenges post-Brexit, potentially risking public health at large, researchers say.",https://www.reuters.com/article/us-health-brexit-hiv-idUSKBN1WT1ZP,https://s4.reutersmedia.net/resources_v2/images/rcom-default.png,2019-10-14T15:35:28Z,"(Reuters Health) - British citizens with HIV who live in Spain could face serious healthcare challenges post-Brexit, potentially risking public health at large, researchers say. 
A no-deal Brexit could leave many patients with HIV or other chronic conditions… [+3869 chars]",0,1.0,0.0,6.0,0.0
0,abc-news,ABC News,Jon Haworth,Nobel prize in economics given to 3 economists for work on alleviating global poverty,"The Nobel prize in economics has been awarded to 3 economists ""for their experimntal approach to alleviating global poverty.""",https://abcnews.go.com/International/nobel-prize-economics-economists-work-alleviating-global-poverty/story?id=66256845,https://s.abcnews.com/images/International/esther-duflo-priness-asturias-award_hpMain_20191014-060952_16x9_992.jpg,2019-10-14T10:20:30Z,"The Nobel prize in economics has been awarded to 3 economists ""for their experimntal approach to alleviating global poverty.""
Abhijit Banerjee, Esther Duflo and Michael Kremer were announced as the winners on Monday morning.
Banerjee and Duflo work at Massa… [+1262 chars]",1,673.0,106.0,93.0,0.0
36,business-insider,Business Insider,David Slotnick,A woman got her arm cut off by a propeller on a plane that her husband was preparing to fly,"A woman's arm was severed by the propeller of a plane, according to the Miami Herald. The woman and her husband were getting ready to taxi to the runway, but when the plane wouldn't move, they got out to see what was wrong. The woman tried to remove a chock f…",https://www.businessinsider.com/womans-arm-cut-off-by-plane-propeller-florida-2019-10,https://image.businessinsider.com/5da489e14af9093b847d5562?width=1200&format=jpeg,2019-10-14T15:20:59Z,"A Florida woman lost her arm on Saturday when she inadvertently stepped in front of the private plane she was flying on and was struck by the propeller.
According to the Miami Herald, Rebecca Lynn Gray, 45, and her husband Walter Gray, 46, were getting ready… [+829 chars]",0,92.0,18.0,1555.0,0.0
47,the-irish-times,The Irish Times,The Irish Times,"What sold for €730k in Harold’s Cross, Clontarf, Ranelagh, Naas","A city redbrick, a swish seaside duplex and a luxury Kildare home",https://www.irishtimes.com/							/life-and-style/homes-and-property/what-sold-for-730k-in-harold-s-cross-clontarf-ranelagh-naas-1.4043872	,https://www.irishtimes.com/image-creator/?id=1.4043871&origw=660,2019-10-14T05:00:00Z,"5 Casimir Avenue, Harolds Cross, Dublin 6W
An Edwardian three-bedroom terraced redbrick in a popular location. There is around 122 sq m of of living space with some original details and a paved back garden.
Asking: 725,000
Sold: 730,000
Difference: 1 per … [+1312 chars]",1,,,,
22,abc-news,ABC News,The Associated Press,Report: Softbank could take control of WeWork,"Get breaking national and world news, broadcast video coverage, and exclusive interviews. Find the top news online at ABC news.",https://abcnews.go.com/Business/wireStory/report-softbank-control-wework-66262998,,2019-10-14T15:23:25Z,"Japanese investment firm Softbank could take control of WeWork as part of a financial package to address the company's cash crunch since its botched effort to sell the public its stock, according to The Wall Street Journal.
The deal would further sideline co… [+579 chars]",0,0.0,0.0,0.0,0.0
28,abc-news,ABC News,The Associated Press,Far-right groups protest Ukrainian president's peace plan,"Get breaking national and world news, broadcast video coverage, and exclusive interviews. Find the top news online at ABC news.",https://abcnews.go.com/Business/wireStory/groups-protest-ukrainian-presidents-peace-plan-66262181,https://s.abcnews.com/images/International/WireAP_d06a3175a8bc4c458ef9d7fdd65b1262_16x9_992.jpg,2019-10-14T14:49:10Z,"Shooting off flares and shouting ""glory to Ukraine,"" thousands of far-right and nationalist activists marched Monday through Kyiv, protesting President Volodymyr Zelenskiy's leadership and his long-awaited peace plan for eastern Ukraine.
Zelenskiy sought to … [+3557 chars]",0,0.0,0.0,0.0,0.0
66,abc-news,ABC News,The Associated Press,EU moves toward an arms export ban against Turkey,"European Union nations vented their outrage at Turkey's offensive in northern Syria and committed to join France and Germany in banning arms sales to Ankara, a rare move against a NATO ally for many of them",https://abcnews.go.com/International/wireStory/eu-moves-arms-export-ban-turkey-66259266,https://s.abcnews.com/images/International/WireAP_586b60c2871d4b848d5009b502e202ee_16x9_992.jpg,2019-10-14T12:18:53Z,"European Union nations are venting outrage at Turkey's offensive in northern Syria and are joining France and Germany in banning arms sales to Ankara, a rare move against a NATO ally for many of them.
Many EU foreign ministers were looking beyond a strong st… [+535 chars]",0,0.0,0.0,3.0,0.0
35,abc-news,ABC News,The Associated Press,"Montgomery County police officer shot, rushed to hospital",Authorities say a police officer has been shot in Maryland after responding to a call about a disorderly person in a parking garage,https://abcnews.go.com/US/wireStory/montgomery-county-police-officer-shot-rushed-hospital-66261652,,2019-10-14T14:28:09Z,"A police officer in Maryland has been shot while responding to a call about a disorderly person in a parking garage.
Montgomery County Police tweeted Monday morning that the officer was shot in Silver Spring shortly before 9 a.m.
Police said the injured off… [+206 chars]",0,0.0,0.0,1.0,0.0
15,the-irish-times,The Irish Times,Mary Carolan,Solicitor to be struck off over professional misconduct,"A solicitor who was found guilty of professional misconduct is to be struck off the roll of solicitors at the end of this year, the president of the High Court has ordered. Among the findings against Maurice O’Sullivan - previously practising as Maurice O’Sul…",https://www.irishtimes.com/news/crime-and-law/courts/high-court/solicitor-to-be-struck-off-over-professional-misconduct-1.4050159,https://www.irishtimes.com/polopoly_fs/1.4050158.1571069607!/image/image.jpg,2019-10-14T16:13:29Z,"A solicitor who was found guilty of professional misconduct is to be struck off the roll of solicitors at the end of this year, the president of the High Court has ordered.
Among the findings against Maurice OSullivan - previously practising as Maurice OSull… [+3440 chars]",0,0.0,0.0,0.0,0.0
0,cbs-news,CBS News,AP,Family: Cop who killed woman in her home should be fired and charged,"Atatiana Jefferson, 28, was playing video games with her young nephew when she was killed by a Fort Worth officer",https://www.cbsnews.com/news/fort-worth-police-shooting-latest-cop-who-killed-atatiana-jefferson-in-her-home-should-be-fired-charged-family-says/,https://cbsnews3.cbsistatic.com/hub/i/r/2019/10/14/c082ea12-a4d4-4b6f-bf43-79239a1c429e/thumbnail/1200x630/654c33f726d409c7afa3903d8c177c7e/fort-worth-ap-19286617357929.jpg,2019-10-14T17:08:18Z,The family of a 28-year-old black woman who was shot and killed by a white police officer in her Fort Worth home as she played video games with her nephew expressed outrage Monday that the officer has not been arrested or fired. The Fort Worth Police Departme… [+4393 chars],1,291.0,117.0,39.0,0.0
6,bbc-news,BBC News,https://www.facebook.com/bbcnews,Sports Direct calls for probe into Nike and Adidas dominance,"The Mike Ashley-owned retailer says the ""must-have"" brands hold too much market power.",https://www.bbc.co.uk/news/business-50047230,https://ichef.bbci.co.uk/news/1024/branded_news/3AC3/production/_107134051_mikeashley.jpg,2019-10-14T16:42:35Z,"Image copyrightReutersImage caption
 Sports Direct owner Mike Ashley's grievance against Adidas' supply power dates back to 2013
Mike Ashley's Sports Direct has called for an investigation into the sportswear industry, complaining about the dominance of Adi… [+2168 chars]",0,0.0,0.0,18.0,0.0
45,the-irish-times,The Irish Times,The Irish Times,Elton John: ‘George Michael was too stubborn to get sober’,"Elton answers questions from celeb fans Victoria Beckham, Billie Eilish, Bob Dylan and more",https://www.irishtimes.com/culture/music/elton-john-george-michael-was-too-stubborn-to-get-sober-1.4049110,https://www.irishtimes.com/image-creator/?id=1.4049109&origw=1440,2019-10-14T05:00:00Z,"On a Thursday morning in his Toronto hotel room, Elton John is in high spirits. He is 12 months into a three-year farewell tour that has sold out arenas and sports stadiums around the world, and earned some of the most rapturous reviews of his 50-year career.… [+18329 chars]",1,308.0,61.0,75.0,0.0
51,reuters,Reuters,Tom Allard,Special Report: The hunt for Asia's El Chapo,"He is Asia’s most-wanted man. He is protected by a guard of Thai kickboxers. He flies by private jet. And, police say, he once lost $66 million in a single night at a Macau casino.",http://feeds.reuters.com/~r/reuters/topNews/~3/zPQ9fXBn50w/special-report-the-hunt-for-asias-el-chapo-idUSKBN1WT1J1,https://s4.reutersmedia.net/resources/r/?m=02&d=20191014&t=2&i=1440710923&w=1200&r=LYNXMPEF9D10W,2019-10-14T17:15:02Z,"BANGKOK (Reuters) - He is Asia’s most-wanted man. He is protected by a guard of Thai kickboxers. He flies by private jet. And, police say, he once lost $66 million in a single night at a Macau casino. 
Tse Chi Lop, a Canadian national born in China, is suspe… [+29103 chars]",1,14.0,4.0,1738.0,0.0
54,cnn,CNN,"Jen Christensen, CNN","Suicide attempts by black teens are increasing, study says","From 1991 to 2017, the rate of reported suicide attempts by African-American teens rose, especially the rate among black boys, according to a study published Monday in the medical journal Pediatrics. The rate for black youths grew even as the rate of suicide …",https://www.cnn.com/2019/10/14/health/black-teen-suicide-attempts-study/index.html,https://cdn.cnn.com/cnnnext/dam/assets/191014072234-black-teen-suicide-attempts-study-stock-super-tease.jpg,2019-10-14T11:31:11Z,"(CNN)From 1991 to 2017, the rate of reported suicide attempts by African-American teens rose, especially the rate among black boys, according to a study published Monday in the medical journal Pediatrics. The rate for black youths grew even as the rate of sui… [+3985 chars]",0,1048.0,362.0,437.0,0.0
61,abc-news,ABC News,The Associated Press,"New stories of an aging Olive in 'Olive, Again'","Get breaking national and world news, broadcast video coverage, and exclusive interviews. Find the top news online at ABC news.",https://abcnews.go.com/Entertainment/wireStory/stories-aging-olive-olive-66259848,https://s.abcnews.com/images/Entertainment/WireAP_251204287f6b4edb8f2bfe892f1137ca_16x9_992.jpg,2019-10-14T12:45:44Z,"""Olive, Again,"" Random House, by Elizabeth Strout
It should come as no surprise that Olive Kitteridge does not mellow with age.
The large, gruff woman who was the propelling force in Elizabeth Strout's book of short stories that won the 2009 Pulitzer Prize … [+2275 chars]",0,0.0,0.0,0.0,0.0
52,cnn,CNN,"Danielle Rossingh, for CNN","At 15, Coco Gauff is only getting started","Teen tennis sensation Cori 'Coco' Gauff talks exclusively to CNN Sport about winning her first  tournament title in Linz, Austria.",https://edition.cnn.com/2019/10/14/sport/coco-gauff-tennis-linz-wtc-spt-intl/index.html,https://cdn.cnn.com/cnnnext/dam/assets/191013152710-gauff-title-super-tease.jpg,2019-10-14T11:32:29Z,,0,73.0,9.0,33.0,0.0
2,cbs-news,CBS News,CBS News,12-year-old boy builds Lego wheelchair for dog born without legs,"This puppy named Gracie was born without front legs, so a 12-year-old volunteer at an animal shelter changed her life by building a wheelchair out of Legos. Now, she's known as ""Amazing Gracie.""",https://www.cbsnews.com/video/12-year-old-boy-builds-lego-wheelchair-for-dog-born-without-legs/,https://cbsnews1.cbsistatic.com/hub/i/r/2019/10/14/a98017e4-ac81-4810-beaf-526c3e4d7c4f/thumbnail/1200x630/9f64869641845d59e81e9ec873832116/amazinggracie-1951573-640x360.jpg,2019-10-14T17:01:03Z,,1,0.0,0.0,1.0,0.0
63,cnn,CNN,Kate  Mackay,Places to visit in Scotland: The best spots for your holiday,"Scotland's lochs, castles, mountains and lush isles make it a great destination. But with so much to see, are you wondering where to start? CNN Travel rounds up the best places to visit in Scotland for a holiday.",https://www.cnn.com/travel/article/places-to-visit-scotland/index.html,https://dynaimage.cdn.cnn.com/cnn/w_1200/http%3A%2F%2Fcdn.cnn.com%2Fcnnnext%2Fdam%2Fassets%2F171116175427-edinburgh-allinclusive-super-tease.jpg,2019-10-14T10:43:52Z,"(CNN) With its lochs, castles, mountains, rugged shores and lush isles, the UK's northernmost country certainly has its share of dramatic landscapes. 
Striking scenery combined with a rich history and culture make Scotland a great destination for the intrepi… [+5146 chars]",0,2.0,0.0,17.0,0.0
51,abc-news,ABC News,The Associated Press,Pope's bodyguard resigns over new financial leaks scandal,Pope Francis' chief bodyguard has resigned over the leak of a Vatican police flyer identifying five Holy See employees who were suspended as part of a financial investigation,https://abcnews.go.com/International/wireStory/popes-bodyguard-resigns-financial-leaks-scandal-66260756,,2019-10-14T13:33:09Z,"Pope Francis' chief bodyguard has resigned over the leak of a Vatican police flyer identifying five Holy See employees who were suspended as part of a financial investigation.
Interested in Catholic Church?
Add Catholic Church as an interest to stay up to d… [+757 chars]",0,0.0,0.0,17.0,0.0
