,source_id,source_name,author,title,description,url,url_to_image,published_at,content,top_article,engagement_reaction_count,engagement_comment_count,engagement_share_count,engagement_comment_plugin_count
38,the-irish-times,The Irish Times,,Our campaign to eliminate insects is self-destructive,"There are some 1.5 million insect species globally, many of whom perform tasks vital to sustain humans. Despite this, we treat insects as pests; enemies that must be exterminated. The campaign to eliminate them is working, but in doing so mankind and all life…",https://www.irishtimes.com/news/science/our-campaign-to-eliminate-insects-is-self-destructive-1.4054079?localLinksEnabled=false,,2019-10-17T14:48:09Z,,0,0.0,0.0,0.0,0.0
67,reuters,Reuters,Reuters Editorial,Three buyout groups view for Scout24's Autoscout unit -sources,"German classifieds group Scout24 Scout24 has picked three private equity firms for the second round of bidding for its autos unit AutoScout24, people close to the matter said on Thursday.",https://www.reuters.com/article/us-scout24-m-a-idUSKBN1WW2AG,https://s3.reutersmedia.net/resources/r/?m=02&d=20191017&t=2&i=1441945335&w=1200&r=LYNXMPEF9G1NL,2019-10-17T15:44:55Z,"FRANKFURT (Reuters) - German classifieds group Scout24 (G24n.DE) Scout24 has picked three private equity firms for the second round of bidding for its autos unit AutoScout24, people close to the matter said on Thursday. 
Permira, Apax and Hellman &amp; Fried… [+202 chars]",0,0.0,0.0,0.0,0.0
31,abc-news,ABC News,The Associated Press,"GM contract: worker pay hikes, factory closings move forward","Under tentative four year contract at GM, raises and bonuses for workers, company can close factories in Ohio, Michigan and one near Baltimore",https://abcnews.go.com/US/wireStory/gm-contract-worker-pay-hikes-factory-closings-move-66348695,https://s.abcnews.com/images/US/WireAP_296a948fdbf94eea96a6cfa2aa93e6e3_16x9_992.jpg,2019-10-17T16:49:36Z,"A tentative four year contract with striking General Motors gives workers a mix of pay raises, lump sum payments and an $11,000 signing bonus.
In return, the contract allows GM to proceed with factory closures in Lordstown, Ohio, Warren, Michigan, and near B… [+888 chars]",0,0.0,0.0,0.0,0.0
77,bbc-news,BBC News,https://www.facebook.com/bbcnews,Simon Smith: Triple baby killer moved to open prison,"The mother of one of Simon Smith's victims says she is ""devastated"" and ""horrified"" by the decision.",https://www.bbc.co.uk/news/uk-england-stoke-staffordshire-50085441,https://ichef.bbci.co.uk/news/1024/branded_news/C5EE/production/_105407605_smith303.jpg,2019-10-17T12:44:08Z,"Image copyrightRachel PlayfairImage caption
 Simon Smith was pictured the night before murdering his three-month-old daughter Lauren
A triple killer who murdered his own babies by suffocating them has been moved to an open prison.
Simon Smith killed three-… [+1787 chars]",0,13.0,4.0,27.0,0.0
40,al-jazeera-english,Al Jazeera English,Al Jazeera,"Turkey, Saudi Arabia and Europe's 'double standard' in arms sales",Europe's swift move to ban arms sales to Turkey stands in stark contrast to its reluctance to sanction Saudi Arabia.,https://www.aljazeera.com/news/2019/10/turkey-saudi-arabia-europe-double-standard-arms-sales-191016231548811.html,https://www.aljazeera.com/mritems/Images/2019/10/16/343feccc71c341dc95c10fbbcb7e4317_18.jpg,2019-10-17T00:43:12Z,"European powers have moved quickly to censure Turkey over its long-threatened military offensive in northeast Syria.
Soon after Turkish troops launched the cross-border operation on October 9 - aiming to ""eliminate"" Kurdish fighters it considers ""terrorists""… [+6057 chars]",0,2140.0,682.0,373.0,0.0
21,al-jazeera-english,Al Jazeera English,Al Jazeera,US Democratic Congressman Elijah Cummings dies aged 68,"As chairman of the House Oversight and Reform Committee, Cummings led multiple investigations into Donald Trump.",https://www.aljazeera.com/news/2019/10/democratic-congressman-elijah-cummings-dies-aged-68-191017093753195.html,https://www.aljazeera.com/mritems/Images/2019/10/17/b29eb50ed4a7427cbacbf2f56397c923_18.jpg,2019-10-17T10:11:54Z,"Maryland Democratic Representative Elijah Cummings died on Thursday at Johns Hopkins Hospital after complications from longstanding health challenges, his congressional office said.
Cummings, who was 68, became the powerful chairman of a US House committee t… [+633 chars]",0,64.0,11.0,31.0,0.0
49,newsweek,Newsweek,Jenni Fink,College Credit: Ashton Kutcher's Childhood Jobs Enabled Him to Drop Out of School and Take Chance on Acting,"After spending the last 22 years pursuing his passion, Kutcher recommended the current generation of high school and college students consider the financial implications of their decisions.",https://www.newsweek.com/college-credit-ashton-kutcher-going-broke-university-education-1465142,https://d.newsweek.com/en/full/1536452/ashton-kutcher-going-broke-college-loan.jpg,2019-10-17T12:00:01Z,"While studying biomedical engineering at the University of Iowa, Ashton Kutcher had the chance to pursue a career in acting, but it meant dropping out of school. Leaving college to seize the life-changing opportunity was possible because he worked hard in hig… [+6127 chars]",0,6.0,2.0,2.0,0.0
37,business-insider,Business Insider,Aria Bendix,Notre-Dame's melted scaffolding is putting the structure at risk of collapse. Take a look at the work to save the cathedral.,"Workers are set to remove the scaffolding from the Notre-Dame Cathedral in Paris in a matter of weeks. The metal lattice fused together during a massive fire on April 15, so workers now have to disassemble it piece by piece. If it collapses or pieces fall off…",https://www.businessinsider.com/notre-dame-cathedral-update-on-restoration-2019-10,https://image.businessinsider.com/5da778efcc4a0a3e4c075b66?width=1200&format=jpeg,2019-10-17T15:41:00Z,"After 14 months of assembly, the scaffolding on top of the Notre-Dame Cathedral in Paris was nearly finished. The metal lattice was there to support the building's spire, a 19th-century relic that was undergoing a $6.8 million renovation.
But before workers … [+4465 chars]",0,37.0,2.0,18.0,0.0
69,bbc-news,BBC News,https://www.facebook.com/bbcnews,Man jailed for raping woman as she slept beside her daughter,Andris Valainis attacked the woman at a house in North Lanarkshire while she slept next to her daughter.,https://www.bbc.co.uk/news/uk-scotland-glasgow-west-50085750,https://ichef.bbci.co.uk/news/1024/branded_news/126FD/production/_109271557_hi054632661.jpg,2019-10-17T13:06:29Z,"Image copyrightPA MediaImage caption
 Valainis was jailed for four years at the High Court in Glasgow
A man who raped a woman while she slept beside her young daughter has been jailed for four years.
Andris Valainis was found guilty of raping the woman at … [+1479 chars]",0,23.0,7.0,9.0,0.0
4,newsweek,Newsweek,Federico Borello and Dan Mahanty,We Americans Always Say We Do Our Best Not to Hurt Civilians. But Our Best Isn't Good Enough | Opinion,"War is messy. You can't expect a clean war or ""zero"" civilian casualties. But it's been 18 years, and we've all gotten too complacent about death.",https://www.newsweek.com/civilian-casulaties-doing-everything-we-can-not-good-enough-1466029,https://d.newsweek.com/en/full/1537612/iraq-casualties.jpg,2019-10-17T17:20:22Z,"There's a popular fable that makes its way around the U.S. State Department, commonly attributed to Winston Lord, Henry Kissinger's speech writer. The short version goes something like this: Lord takes his boss a draft of a speech. ""Is that the best you can d… [+7275 chars]",0,0.0,0.0,0.0,0.0
77,cnn,CNN,,'Air of euphoria' in Brussels as Brexit deal is agreed,"After months of negotiations, the UK and EU agreed a new withdrawal Brexit deal on Thursday, according to statement from British Prime Minister Boris Johnson and European Commission President Jean-Claude Juncker. The next challenge for Johnson will be getting…",https://www.cnn.com/videos/world/2019/10/17/brexit-deal-eu-summit-boris-johnson-jean-claude-juncker-intl-vpx.cnn,https://cdn.cnn.com/cnnnext/dam/assets/190916133517-boris-johnson-jean-claude-juncker-super-tease.jpg,2019-10-17T10:45:41Z,Chat with us in Facebook Messenger. Find out what's happening in the world as it unfolds.,0,0.0,0.0,60.0,0.0
75,cbs-news,CBS News,Nicole Sganga,"Michael Bennet slams ""idiotic"" DNC rules that kept him from debate","Bennet said the Democratic National Committee's rules make his opponents ""seem more viable than I am, but I'm not sure they are""",https://www.cbsnews.com/news/michael-bennet-2020-slams-idiotic-dnc-rules-that-kept-him-out-of-democratic-debate/,https://cbsnews3.cbsistatic.com/hub/i/r/2019/08/02/564b7832-1b8d-4847-ac06-c4098ec3ff8a/thumbnail/1200x630g2/0d9e7d37049e5ba54b6f426ed0038793/michael-bennet-1162629366.jpg,2019-10-17T01:34:56Z,"The day after the fourth Democratic presidential debate, Colorado Senator Michael Bennet slammed what he called the ""idiotic"" Democratic National Committee rules that kept him out of last night's contest. 
""One of my frustrations about watching people on tha… [+3785 chars]",0,141.0,108.0,16.0,0.0
45,the-new-york-times,The New York Times,Emily Laber-Warren,You’re Only as Old as You Feel,Simply asking people how old they feel may tell you a lot about their health and well-being.,https://www.nytimes.com/2019/10/17/well/mind/age-subjective-feeling-old.html,https://static01.nyt.com/images/2019/10/22/smarter-living/00well_subjectiveage/00well_subjectiveage-facebookJumbo-v5.jpg,2019-10-17T11:04:54Z,"A few intriguing studies suggest that a youthful frame of mind can have a powerful effect. When scientists trick older people into feeling younger, most tend to instantly become more capable. In a 2013 experiment by Dr. Stephan and colleagues, for example, pe… [+2800 chars]",0,433.0,119.0,334.0,0.0
64,business-insider,Business Insider,Daniel Strauss,'We feel worse about subscriber growth': Here's why Wall Street is striking a more cautious tone after Netflix's latest earnings,"The market rewarded Netflix on Thursday for demonstrating it can still grow its business on a global basis and beat earnings forecasts. The company reported international subscribers additions that came in ahead of estimates, while gross margins and earnings …",https://www.businessinsider.com/netflix-q3-earnings-wall-street-analyst-reaction-to-subscriber-growth-2019-10,https://image.businessinsider.com/5d362cd6100a242ca549f1b5?width=1200&format=jpeg,2019-10-17T14:09:54Z,"<ul><li>The market rewarded Netflix on Thursday for demonstrating it can still grow its business on a global basis and beat earnings forecasts. </li><li>The company reported international subscribers additions that came in ahead of estimates, while gross marg… [+1798 chars]",0,0.0,0.0,4.0,0.0
11,al-jazeera-english,Al Jazeera English,Al Jazeera,"British political parties, world leaders react to Brexit deal",Several UK parties have said they will vote against the Johnson's new deal in the parliament.,https://www.aljazeera.com/news/2019/10/british-political-parties-world-leaders-react-brexit-deal-191017113033717.html,https://www.aljazeera.com/mritems/Images/2019/10/17/87cb09e739314c319b4f68a7636de4c5_18.jpg,2019-10-17T13:11:35Z,"The United Kingdom and the European Union have agreed a revised Brexit deal.
The president of the European Commission, Jean-Claude Juncker, announced the agreement on Thursday just hours before EU leaders meet in Brussels.
""Where there is a will, there is a… [+3359 chars]",0,8.0,4.0,20.0,0.0
11,the-new-york-times,The New York Times,James Poniewozik,Review: ‘Watchmen’ Is an Audacious Rorschach Test,"Damon Lindelof’s entertaining comic-book rethink takes on the Big Bad of white supremacy, explosively and sometimes unsteadily.",https://www.nytimes.com/2019/10/17/arts/television/watchmen-review.html,https://static01.nyt.com/images/2019/10/17/arts/17watchmen/17watchmen-facebookJumbo.jpg,2019-10-17T15:42:19Z,"Lindelofs superpowers get put to full use here: the disorienting cold open, the clever and poignant twist, the pop-culture hyperliteracy. His world is like a superhero Leftovers, in which characters are left to muddle ahead after staggering events. (Dr. Manha… [+1699 chars]",0,3.0,3.0,15.0,0.0
9,the-new-york-times,The New York Times,Reuters,UK Marketing Spending Dips in Third-Quarter as Brexit Deadline Looms-Survey,"British companies cut spending on marketing for the first time in seven years during the third quarter, as a rocky Brexit pushed businesses to keep a tight lid on costs, a survey showed.",https://www.nytimes.com/reuters/2019/10/17/business/16reuters-britain-marketing.html,https://static01.nyt.com/newsgraphics/images/icons/defaultPromoCrop.png,2019-10-17T15:47:17Z,"(Reuters) - British companies cut spending on marketing for the first time in seven years during the third quarter, as a rocky Brexit pushed businesses to keep a tight lid on costs, a survey showed.
The IPA Bellwether, conducted by IHS Markit, and based on a… [+742 chars]",0,0.0,0.0,0.0,0.0
12,cnn,CNN,"Alicia Wallace, CNN Business","Canada's Cannabis 2.0: Edibles, beverages, vapes on deck",It's time for Cannabis 2.0 in Canada.The planned enhancement is projected to be a billion-dollar boon for the country's burgeoning cannabis businesses.,https://www.cnn.com/2019/10/17/business/canada-cannabis-legalization-2-0/index.html,https://cdn.cnn.com/cnnnext/dam/assets/191016192323-canada-cannabis-sales-file-super-tease.jpg,2019-10-17T16:53:21Z,,0,0.0,0.0,12.0,0.0
62,the-irish-times,The Irish Times,Colm Keena,Minister’s stance in vaccination case likened to former Soviet bloc,"Claim made by counsel for Aoife Bennett (26), who says she developed narcolepsy from Pandemrix vaccine",https://www.irishtimes.com/news/crime-and-law/courts/high-court/minister-s-stance-in-vaccination-case-likened-to-former-soviet-bloc-1.4053938,https://www.irishtimes.com/image-creator/?id=1.4053937&origw=1440,2019-10-17T12:51:21Z,"The position being taken by the Minister for Health has been likened to that of authoritarian regimes in the former Soviet bloc and elsewhere in a major vaccination case being heard in the High Court.
Counsel for a woman suing over alleged side-effects of th… [+3014 chars]",0,6.0,0.0,8.0,0.0
2,reuters,Reuters,Reuters Editorial,Trump says 'great news out of Turkey' after Pence talks on Syria,"U.S. President Donald Trump said on Twitter on Thursday there was ""great news out of Turkey"" after a U.S. delegation held talks in Ankara over Turkey's military incursion into northeast Syria.",https://www.reuters.com/article/us-syria-security-turkey-usa-talks-idUSKBN1WW2K8,https://s2.reutersmedia.net/resources/r/?m=02&d=20191017&t=2&i=1441977824&w=1200&r=LYNXMPEF9G1UI,2019-10-17T17:44:42Z,"ANKARA (Reuters) - U.S. President Donald Trump said on Twitter on Thursday there was “great news out of Turkey” after a U.S. delegation held talks in Ankara over Turkey’s military incursion into northeast Syria. 
“Thank you to (Turkish President Tayyip) Erdo… [+400 chars]",0,0.0,0.0,25.0,0.0
11,the-irish-times,The Irish Times,Gordon Deegan,"Savoy Cinema owners object to Apollo House, Screen Cinema plans",New plans by Marlet include 500-seat venue along with increase in height at the Dublin city centre development,https://www.irishtimes.com/business/commercial-property/savoy-cinema-owners-object-to-apollo-house-screen-cinema-plans-1.4054319,https://www.irishtimes.com/image-creator/?id=1.4054318&origw=1440,2019-10-17T17:14:18Z,"The owners of the Savoy Cinema in Dublin have put the brakes on the Marlet Group amending its ambitious plans for the Apollo House, College House and Screen Cinema site on Dublins Pearse Street.
This follows the Dublin Cinema Group Ltd lodging an appeal to A… [+2507 chars]",0,0.0,0.0,0.0,0.0
20,reuters,Reuters,Reuters Editorial,Renault warns 2019 sales drop will be steeper than expected,"France's Renault on Thursday cut its sales guidance for 2019 further and lowered its profitability forecast, as automakers globally struggle with slumping demand in major markets like China and costly shifts to cleaner car models.",https://uk.reuters.com/article/uk-renault-results-idUKKBN1WW2DW,https://s1.reutersmedia.net/resources/r/?m=02&d=20191017&t=2&i=1441963032&w=1200&r=LYNXMPEF9G1SA,2019-10-17T16:59:18Z,"PARIS (Reuters) - France’s Renault (RENA.PA) on Thursday cut its sales guidance for 2019 further and lowered its profitability forecast, as automakers globally struggle with slumping demand in major markets like China and costly shifts to cleaner car models. … [+1272 chars]",0,0.0,0.0,0.0,0.0
64,bbc-news,BBC News,https://www.facebook.com/bbcnews,Google and BBC scrap VR projects,"Virtual reality may still be a few years from realising its potential, says one expert.",https://www.bbc.co.uk/news/technology-50080594,https://ichef.bbci.co.uk/news/1024/branded_news/15CB2/production/_109266298_mediaitem109266297.jpg,2019-10-17T13:37:30Z,"Image caption
 The BBC made a range of content, including educational VR content
The BBC has disbanded the team it created to make virtual reality (VR) content, saying its funding has ended.
It comes as Google halts sales of its Daydream View headsets, adm… [+2476 chars]",0,1.0,0.0,26.0,0.0
5,the-irish-times,The Irish Times,Suzanne Lynch,Trump selects Trump hotel to host next G7 summit,White House says Trump National Doral Miami is ‘best choice’ to host world leaders,https://www.irishtimes.com/news/world/us/trump-selects-trump-hotel-to-host-next-g7-summit-1.4054347,https://www.irishtimes.com/image-creator/?id=1.4054345&origw=1440,2019-10-17T17:39:59Z,"The Trump administration has selected a Trump hotel in Florida as the location for next years G7 summit, in a move that is likely to spark widespread concern about ethics violations by the US president.
It makes perfect sense, acting White House chief of sta… [+2685 chars]",0,0.0,0.0,1.0,0.0
7,cnn,CNN,"Sara Tonks and Judson Jones, CNN Meteorologist",Tropical storm warnings issued for Gulf Coast states as weather system strengthens,"A disorganized area of storms in the Gulf of Mexico is expected to develop into a tropical or subtropical storm Thursday as it heads toward the US Gulf Coast, the National Hurricane Center said.",https://www.cnn.com/2019/10/17/weather/tropical-cyclone-gulf-mexico-wxc/index.html,https://cdn.cnn.com/cnnnext/dam/assets/191017121603-weather-potential-tropical-cyclone-track-20191017-super-tease.jpg,2019-10-17T17:19:37Z,,0,1.0,0.0,19.0,0.0
27,cnn,CNN,"Matt Egan, CNN Business",How Elizabeth Warren could 'vaporize' America's oil boom,Elizabeth Warren doesn't just pose a threat to Wall Street. Her rising 2020 polling numbers are also striking fear in the heart of Big Oil.,https://www.cnn.com/2019/10/17/business/elizabeth-warren-oil-fracking-ban/index.html,https://cdn.cnn.com/cnnnext/dam/assets/191015084844-02-elizabeth-warren-0925-super-tease.jpg,2019-10-17T15:47:16Z,"It would be wildly bullish for crude oil prices. We'd be heading back to triple-digit prices very fast.""
Bob McNally, president of Rapidan Energy Group",0,24.0,29.0,28.0,0.0
66,newsweek,Newsweek,Harriet Sinclair,Congressman Elijah Cummings Dead: Central figure in Trump Impeachment Inquiry Dies Aged 68,"Cummings was head of the House Committee for Oversight and Reform, and had been away from work following a medical procedure.",https://www.newsweek.com/congressman-elijah-cummings-dead-central-figure-trump-impeachment-inquiry-dies-aged-68-1465893,https://d.newsweek.com/en/full/1537408/elijah-cummings.jpg,2019-10-17T09:25:51Z,"Congressman Elijah Cummings has died aged 68. The representative for Maryland's 7th Congressional district was a key figure in the impeachment inquiry into President Donald Trump.
His office said in a statement that he had died at John Hopkins Hospital follo… [+247 chars]",0,1618.0,317.0,227.0,0.0
26,the-new-york-times,The New York Times,,New Models of Democracy,Leaders from around the globe tackle issues facing the evolving state of world democracy.,https://www.nytimes.com/2019/10/17/opinion/athens-democracy-forum-issues.html,https://static01.nyt.com/images/2019/10/18/multimedia/18wr-excerpts-inyt-1/18wr-excerpts-inyt-1-facebookJumbo.jpg,2019-10-17T14:00:37Z,"MS. ALDERMAN Anna, one of the issues is the continued development, the continued entry, for example, of artificial intelligence technology in the workplace, also the continued spread of the so-called gig economy, which as we are discovering is not all its cra… [+2258 chars]",0,0.0,0.0,2.0,0.0
77,newsweek,Newsweek,Brendan Cole,Witness Describes Horror of Seeing Mother-of-Two Fall to Death From Funfair Ride: 'I'm Traumatized',"Police are questioning four people, including the owners and operators of the rides at the park in Firminy, in the Loire region.",https://www.newsweek.com/france-firminy-funfair-fatality-1465367,https://d.newsweek.com/en/full/1536375/fairground.jpg,2019-10-17T07:50:43Z,"A witness has spoken of his horror at seeing two women flung out of a carousel in France in a fatal accident that has raised questions about safety at funfairs.
The Sky Flyer ride was part of the annual Vogue Des Noix funfair, which is one of France's bigges… [+2174 chars]",0,0.0,0.0,1.0,0.0
77,reuters,Reuters,Reuters Editorial,"Ford partners with Volkswagen, Amazon to build charging network for cars",Ford Motor Co said on Thursday it was teaming up with Volkswagen AG and Amazon.com to give its future electric car customers a range of charging options from highways to homes.,https://in.reuters.com/article/ford-motor-electric-idINKBN1WW27G,https://s3.reutersmedia.net/resources/r/?m=02&d=20191017&t=2&i=1441937359&w=1200&r=LYNXMPEF9G1LO,2019-10-17T15:29:38Z,"(Reuters) - Ford Motor Co said on Thursday it was teaming up with Volkswagen AG and Amazon.com to give its future electric car customers a range of charging options from highways to homes. 
The network of charging stations will be the largest in North Americ… [+516 chars]",0,0.0,0.0,0.0,0.0
29,al-jazeera-english,Al Jazeera English,Al Jazeera,Japan PM visits typhoon-hit areas as royals signal parade delay,"Typhoon Hagibis death toll has risen to 77 with nine people still missing while 105,000 households remain without water.",https://www.aljazeera.com/news/2019/10/japan-pm-visits-typhoon-hit-areas-royals-signal-parade-delay-191017060328020.html,https://www.aljazeera.com/mritems/Images/2019/10/17/b596217bb91a4fa284ec5f712069e9e6_18.jpg,2019-10-17T06:37:17Z,"Japan's Prime Minister Shinzo Abe on Thursday visited the towns devasted by the deadly Typhoon Hagibis to meet residents to assess damage and their needs.
Rescue and relief efforts for stranded or missing people in flooded mountain villages continued on Thur… [+1028 chars]",0,2.0,0.0,14.0,0.0
58,reuters,Reuters,Reuters Editorial,Vivendi third-quarter revenue up 7.2% on strong Universal performance,"French media conglomerate Vivendi reported a 7.2% rise in comparable third-quarter sales on Thursday, beating estimates thanks to a continued strong performance by its music division Universal.",https://in.reuters.com/article/vivendi-results-idINKBN1WW2AW,https://s3.reutersmedia.net/resources/r/?m=02&d=20191017&t=2&i=1441945545&w=1200&r=LYNXMPEF9G1NP,2019-10-17T15:59:37Z,"PARIS (Reuters) - French media conglomerate Vivendi reported a 7.2% rise in comparable third-quarter sales on Thursday, beating estimates thanks to a continued strong performance by its music division Universal. 
The Paris-based group said revenues advanced … [+391 chars]",0,0.0,0.0,0.0,0.0
40,the-irish-times,The Irish Times,The Irish Times,Paul Gascoigne cleared of sexually assaulting woman on train,"Former England footballer Paul Gascoigne has been found not guilty of sexually assaulting a woman he kissed on a train. Gascoigne, 52, was accused of drunkenly grabbing the woman’s face and “forcibly and sloppily” kissing her on the lips on August 20th last y…",https://www.irishtimes.com/news/world/uk/paul-gascoigne-cleared-of-sexually-assaulting-woman-on-train-1.4054101,https://www.irishtimes.com/image-creator/?id=1.4054100&origw=1440,2019-10-17T14:47:56Z,"Former England footballer Paul Gascoigne has been found not guilty of sexually assaulting a woman he kissed on a train.
Gascoigne, 52, was accused of drunkenly grabbing the womans face and forcibly and sloppily kissing her on the lips on August 20th last yea… [+5314 chars]",0,0.0,0.0,0.0,0.0
10,bbc-news,BBC News,,James Maddison: Leicester boss Brendan Rodgers backs midfielder after casino 'mistake',Leicester boss Brendan Rodgers defends James Maddison after he was seen in a casino after pulling out of England squad because of illness.,https://www.bbc.co.uk/sport/football/50087592,https://ichef.bbci.co.uk/onesport/cps/624/cpsprodpb/EBC5/production/_109275306_gettyimages-1168233269.jpg,2019-10-17T17:07:51Z,"James Maddison is expected to feature in Leicester's Premier League match against Burnley on Saturday
Leicester midfielder James Maddison ""knows he made a mistake"" in visiting a casino after withdrawing from England duty, says Foxes boss Brendan Rodgers.
Th… [+1841 chars]",0,1.0,2.0,4.0,0.0
6,the-irish-times,The Irish Times,Emmet Malone,Shields hoping cross-Border competition can be stepping stone to all-island league,Dundalk will take on Linfield in two-legged clash for Unite the Union Champions Cup,https://www.irishtimes.com/sport/soccer/national-league/shields-hoping-cross-border-competition-can-be-stepping-stone-to-all-island-league-1.4054343,https://www.irishtimes.com/image-creator/?id=1.4054341&origw=1440,2019-10-17T17:37:30Z,"Chris Shields has described the new cross-Border competition in which Dundalk will face Linfield next month as a great initiative, with the midfielder suggesting he would like to see the two-legged clash between the title winners serve as a stepping stone to … [+4037 chars]",0,0.0,0.0,0.0,0.0
