,source_id,source_name,author,title,description,url,url_to_image,published_at,content,top_article,engagement_reaction_count,engagement_comment_count,engagement_share_count,engagement_comment_plugin_count
71,abc-news,ABC News,The Associated Press,Swine fever: New Indonesian festival celebrates pigs,Swine fever: Christian residents in Muslim-majority Indonesia's remote Lake Toba region launch new festival celebrating pigs,https://abcnews.go.com/International/wireStory/swine-fever-indonesian-festival-celebrates-pigs-66867970,https://s.abcnews.com/images/International/WireAP_6bf86d7dbb2848c8a2cc6149fe2f5aee_16x9_992.jpg,2019-11-09T03:14:28Z,"Christian residents in Muslim-majority Indonesia's remote Lake Toba region have launched a new festival celebrating pigs that they say is a response to efforts to promote halal tourism in the area.
The festival features competitions in barbecuing, pig callin… [+1386 chars]",0,29.0,9.0,9.0,0.0
5,cbs-news,CBS News,Arshad R. Zargar,Indian court rules in favor of Hindus in dispute at heart of tension,The ruling paves the way for the building of a Hindu temple at a site where a mosque once stood,https://www.cbsnews.com/news/top-court-rules-in-favor-of-hindus-in-dispute-at-heart-of-religious-tension-in-india/,https://cbsnews1.cbsistatic.com/hub/i/r/2019/11/09/a38f0a72-88f2-45fd-bf31-bb25c186d18b/thumbnail/1200x630/fa3f6397b49d248acc0113babbe2a958/ap-19313573968778.jpg,2019-11-09T16:44:57Z,"New Delhi – India's Supreme Court ruled Saturday that a disputed piece of land in the town of Ayodhya be given to Hindus, paving the way for the building of a Hindu temple at the site where a mosque once stood for Muslim worshippers.
The verdict ends a decad… [+3214 chars]",1,0.0,0.0,2.0,0.0
11,cnn,CNN,"Shannon Liao, CNN Business",Instagram will test hiding US users' likes,Posting on Instagram can come with a rush of validation when likes from friends and strangers come pouring in. But those likes will soon be hidden for some US users.,https://www.cnn.com/2019/11/09/tech/instagram-hiding-likes-us/index.html,https://cdn.cnn.com/cnnnext/dam/assets/190429194222-20190429-instagram-likes-super-tease.jpg,2019-11-09T16:14:06Z,,0,22.0,13.0,31.0,0.0
58,cnn,CNN,,Video shows acid attack on a Milwaukee man,"Milwaukee police say a man has been arrested after allegedly throwing acid in the face of a US citizen, who says his attacker told him to ""go back to (his) country.""",https://www.cnn.com/videos/us/2019/11/04/us-citizen-milwaukee-acid-attack-vpx.wdjt,https://cdn.cnn.com/cnnnext/dam/assets/191104035208-us-citizen-milwaukee-acid-attack-vpx-00003513-super-tease.jpg,2019-11-09T04:08:01Z,Chat with us in Facebook Messenger. Find out what's happening in the world as it unfolds.,0,119.0,128.0,83.0,0.0
22,abc-news,ABC News,The Associated Press,Lebanon's president meets bankers amid liquidity crisis,Lebanon's president is meeting with several Cabinet ministers and top banking officials in search for solutions for the deepening financial and economic crisis,https://abcnews.go.com/International/wireStory/lebanons-president-meets-bankers-amid-liquidity-crisis-66876017,https://s.abcnews.com/images/International/WireAP_c28c00f289d44c329efce977bc66773b_16x9_992.jpg,2019-11-09T15:19:16Z,"Lebanon's president is meeting with several Cabinet ministers and top banking officials in search for solutions for the deepening financial and economic crisis.
The country's financial troubles have worsened since nationwide protests initially against new ta… [+547 chars]",0,0.0,0.0,3.0,0.0
37,newsweek,Newsweek,Sophia Waterfield,"Are Banks Open on Veterans Day? Bank of America, Chase, Wells Fargo, Citigroup and More","The majority of financial institutions observe Veterans Day as a holiday, however, there are some exceptions to the rule.",https://www.newsweek.com/veterans-day-will-banks-remain-open-november-11-2019-1469896,https://d.newsweek.com/en/full/1542907/veterans-day-banks-2019.jpg,2019-11-09T11:00:01Z,"November 11 marks Veterans Day in the U.S., a day where Americans pay tribute to those who serve their country in times of war and peace. Originally known as Armistice Day, it was renamed in 1954 to incorporate all veterans, rather than just soldiers that ser… [+5366 chars]",0,0.0,0.0,0.0,0.0
39,newsweek,Newsweek,Brendan Cole,"Mega Millions Results, Numbers for 11/08/2019: Did Anyone Win the $145 Million Jackpot on Friday Night?","The results, winners, numbers for Mega Millions, plus how to play, Megaplier and Just the Jackpot explained.",https://www.newsweek.com/lottery-mega-millions-11-08-2019-winner-1470772,https://d.newsweek.com/en/full/1544052/mega-millions-ticket.jpg,2019-11-09T09:29:40Z,"A life-changing jackpot was up for grabs in the Mega Millions draw on Friday but did anybody have all their numbers come up? The jackpot stood at $145 million, with a cash-value option of $96.2 million.
The Mega Millions winning numbers were: 3, 4, 10, 39, 5… [+2541 chars]",0,0.0,0.0,1.0,0.0
49,cnn,CNN,"Julia Buckley, CNN",The future of sustainable tourism may lie with all-inclusive resorts,All-inclusive resorts and package holidays are demonized as the ugly face of tourism. But travel experts say they have the potential to be the most sustainable of all vacation options. Find out how things could work better.,https://www.cnn.com/travel/article/all-inclusive-resorts-sustainable-travel/index.html,https://dynaimage.cdn.cnn.com/cnn/w_1200/http%3A%2F%2Fcdn.cnn.com%2Fcnnnext%2Fdam%2Fassets%2F191108132513-benidorm-2-super-tease.jpg,2019-11-09T08:34:04Z,"A beach heaving with bodies. Sunbeds racked up alongside the pool. High tower blocks of rooms, one packed on top of another. Tourists clustered round the buffet. All in a complex gated off from the local community.
A classic example of the kind of travel tha… [+16235 chars]",0,143.0,73.0,141.0,0.0
11,abc-news,ABC News,The Associated Press,2 skiers die in avalanche in Austrian Alps,"Authorities in southern Austria say two skiers have been killed in an avalanche in the Alps, the first of the season",https://abcnews.go.com/International/wireStory/skiers-die-avalanche-austrian-alps-66877583,null,2019-11-09T16:46:24Z,"Authorities in southern Austria say two skiers have been killed in an avalanche in the Alps, the first of the season.
Austrian broadcaster ORF reported that the men were skiing off marked tracks in the Ötztal region Saturday when they were caught in a snow s… [+181 chars]",0,0.0,0.0,3.0,0.0
45,bbc-news,BBC News,,France 10-20 England: Red Roses earn first win on French soil since 2012,England begin their autumn internationals with an impressive win over France - their first victory on French soil for seven years.,https://www.bbc.co.uk/sport/rugby-union/50359903,https://ichef.bbci.co.uk/onesport/cps/624/cpsprodpb/180F5/production/_109594589_gettyimages-1135550635.jpg,2019-11-09T15:08:44Z,"England have now won 10 of 11 games in 2019
<table><tr><th>Autumn internationals: France v England</th></tr>
<tr><td>France(3) 10</td></tr><tr><td>Try: Boudaud Con: Tremouliere Pen: Tremouliere </td></tr><tr><td>England (17) 20</td></tr><tr><td>Tries: Hunte… [+2286 chars]",0,393.0,10.0,52.0,0.0
24,the-new-york-times,The New York Times,Guy Trebay,"The Party Girl, Till the End","Nina Griscom, society fixture, ’80s “It” girl and tabloid regular, faces illness in fine fashion.",https://www.nytimes.com/2019/11/07/style/nina-griscom-new-york-society-ALS-requiem-for-a-fighter.html,https://static01.nyt.com/images/2019/11/07/fashion/07THSDRESSCOVER/07THSDRESSCOVER-facebookJumbo.jpg,2019-11-09T11:03:09Z,"Still, as Mr. Couturier said: When Blass or anyone dropped her, she didnt say one word against them. Never ever.
Ms. Griscom had something of an advantage over some women in her position. She had always worked. There was the modeling, and when, as they inevi… [+1282 chars]",0,392.0,209.0,93.0,0.0
76,abc-news,ABC News,The Associated Press,Virginia mother gets 20 years in starvation death of her son,The mother of a Virginia boy who died from severe starvation and neglect has been ordered to spend 20 years in prison,https://abcnews.go.com/US/wireStory/virginia-mother-20-years-starvation-death-son-66865933,null,2019-11-09T01:19:09Z,"The mother of a Virginia boy who died from severe starvation and neglect has been ordered to spend 20 years in prison.
The Richmond Times-Dispatch on Friday reported 38-year-old Amy FaJohn was sentenced to 40 years in prison, with half of that time suspended… [+643 chars]",0,2.0,0.0,3.0,0.0
31,cnn,CNN,"Analysis by Brandon Tensley, CNN",'I own it': Warren embraces her anger -- and the politics of the moment,"On Friday, Elizabeth Warren embraced the ethos of the moment: anger.",https://www.cnn.com/2019/11/09/politics/elizabeth-warren-joe-biden-anger/index.html,https://cdn.cnn.com/cnnnext/dam/assets/191105163003-03-elizabeth-warren-1101-super-tease.jpg,2019-11-09T13:35:00Z,,0,684.0,99.0,152.0,0.0
7,al-jazeera-english,Al Jazeera English,Akash Bisht,"As Hindus rejoice, Muslim reaction mixed over Ayodhya verdict",India's top court gives Hindus right to build temple on disputed site while promising Muslims plot of land elsewhere.,https://www.aljazeera.com/news/2019/11/hindus-rejoice-muslim-reaction-mixed-ayodhya-verdict-191109131954176.html,https://www.aljazeera.com/mritems/Images/2019/11/9/67cd9be8728c486bb8e98b517638a276_18.jpg,2019-11-09T15:16:04Z,"Ayodhya, Uttar Pradesh, India - There was heightened security in Ayodhya, a town in north India, ahead of the Supreme Court's verdict on a site claimed by both Muslims and Hindus.
Early on Saturday, the town was deserted as residents stayed inside their home… [+5214 chars]",0,5413.0,2180.0,353.0,0.0
49,newsweek,Newsweek,Melissa Lemieux,"O.J. Simpson Sues Las Vegas Casino After Staff Accused Him of Being Drunk, Disruptive","O.J. Simpson has sued a Las Vegas casino for defamation of character after it banned him from the premises for allegedly behaving in a drunken, disruptive manner.",https://www.newsweek.com/oj-simpson-sues-las-vegas-casino-after-staff-accused-him-being-drunk-disruptive-1470756,https://d.newsweek.com/en/full/1544028/oj-simpson.jpg,2019-11-09T01:55:14Z,"O.J. Simpson has sued a Las Vegas casino for defamation of character after it banned him from the premises for allegedly behaving in a drunken, disruptive manner, says The Manistee News-Advocate.
The suit was filed by Simpson's attorney Malcolm LaVergne agai… [+2277 chars]",0,45.0,10.0,7.0,0.0
42,the-irish-times,The Irish Times,"Sharon Arbuthnot, Máire Ní Mhaonaigh, Gregory Toner","Béarla, Punt, Fliuch: A history of Ireland in 10 little words",Our favourites from the Royal Irish Academy’s new book of 100 Irish words,https://www.irishtimes.com/culture/books/b%C3%A9arla-punt-fliuch-a-history-of-ireland-in-10-little-words-1.4069438,https://www.irishtimes.com/image-creator/?id=1.4074455&origw=1911,2019-11-09T06:00:00Z,"A cup is generally known as a cupán or a cupa in modern Irish, but, despite appearances, neither word is a particularly recent borrowing. Cupa is found as early as the 13th century, and probably comes from the Middle English cuppe, from which we also get the … [+15140 chars]",0,1124.0,138.0,459.0,0.0
27,cbs-news,CBS News,CBS News,Bloomberg doesn’t get warm welcome from other Dems,"Former New York City Mayor Michael Bloomberg is already revealing a willingness to break from the Democratic pack, as he takes a step to run for president. And would-be Democratic opponents believe Bloomberg should spend his billions some other way. Ed O'Keef…",https://www.cbsnews.com/video/bloomberg-doesnt-get-warm-welcome-from-other-dems/,https://cbsnews2.cbsistatic.com/hub/i/r/2019/11/09/b0368539-3d24-46d8-b483-c62ab979c092/thumbnail/1200x630/93385c156f168b47d7a748b4c5b975d9/1109-satmo-bloombergfiles-okeefe-1973765-640x360.jpg,2019-11-09T12:38:38Z,,0,97.0,78.0,7.0,0.0
64,bbc-news,BBC News,BBC News,Ayodhya verdict explained in one minute,The BBC's Vikas Pandey explains the historic Supreme Court verdict in the Ayodhya holy site dispute.,https://www.bbc.co.uk/news/av/world-asia-india-50360123/ayodhya-verdict-explained-in-one-minute,https://ichef.bbci.co.uk/news/1024/branded_news/E1E5/production/_109592875_p07th4jf.jpg,2019-11-09T11:26:50Z,,0,5.0,0.0,13.0,0.0
18,business-insider,Business Insider,Hillary Hoffower,"Meet the typical millennial millionaire in America, who has a real-estate portfolio worth $1.4 million, is married, and is more likely to live in California than any other state","There are 618,000 millennial millionaires in America, according to a new report by Coldwell Banker. The typical millennial millionaire has a net worth ranging from $1 to $2.49 million. They also view real estate as a key way to build wealth — the average mill…",https://www.businessinsider.com/typical-american-millennial-millionaire-net-worth-building-wealth-2019-11,https://image.businessinsider.com/5dc49d103afd377b4177f7e6?width=1200&format=jpeg,2019-11-09T15:24:00Z,,0,87.0,34.0,37.0,0.0
10,cnn,CNN,"Rene Marsh and Gregory Wallace, CNN",Testimony highlights Rick Perry's central role in Ukraine scandal as he prepares to exit,"The first step outside of formal diplomatic channels in President Donald Trump's pressure campaign on Ukraine was taken by Energy Secretary Rick Perry, according to impeachment testimony released this week.",https://www.cnn.com/2019/11/09/politics/rick-perry-ukraine-scandal-exit/index.html,https://cdn.cnn.com/cnnnext/dam/assets/191017162746-02-rick-perry-1007-super-tease.jpg,2019-11-09T16:22:34Z,,0,6.0,0.0,39.0,0.0
44,abc-news,ABC News,Mark Osborne,"Father, daughter charged with raping woman, leaving her to die in desert","Stanley Lawton, 54, and Shaniya Poche-Lawton, 22, are charged with kidnapping to commit another crime, attempted murder, forcible rape and first-degree ATM robbery.",https://abcnews.go.com/US/father-daughter-arrested-allegedly-kidnapping-woman-leaving-die/story?id=66872381,https://s.abcnews.com/images/US/hernandez-lasd-presser-ap-mo-20191109_hpMain_16x9_992.jpg,2019-11-09T09:18:30Z,"A father and daughter were arrested in Los Angeles County this week after they allegedly kidnapped a woman from North Las Vegas, robbed and raped her and left her to die in the California desert.
Stanley Alfred Lawton, 54, and Shaniya Nicole Poche-Lawton, 22… [+1793 chars]",0,633.0,145.0,164.0,0.0
47,newsweek,Newsweek,Aila Slisco,Fox News Contributor Says Criticizing Homophobic Positions is Bigotry Against Catholics,"Fox News contributor Marc Thiessen has claimed ""anti-Catholic bigotry"" is afoot, after a recent photo of Supreme Court Justices Brett Kavanaugh and Samuel Alito posing with a hate group leader sparked calls for the pair to recuse themselves in upcoming LGBT c…",https://www.newsweek.com/fox-news-contributor-says-criticizing-homophobic-positions-bigotry-against-catholics-1470760,https://d.newsweek.com/en/full/1544034/rainbow-wristband-cross.jpg,2019-11-09T03:17:02Z,"Fox News contributor Marc Thiessen has suggested that ""anti-Catholic bigotry"" is behind calls for two Supreme Court justices to recuse themselves from cases involving LGBT rights due to a photograph showing the pair posing with the leader of a homophobic hate… [+3238 chars]",0,171.0,143.0,28.0,0.0
55,reuters,Reuters,Reuters Editorial,AXA expects to book $3.1 billion gain from EQH exit,French insurer AXA said it expected to book net proceeds of $3.1 billion from the sale of a 29% stake in AXA Equitable Holdings (EQH) as it exits its U.S. life insurance business.,https://in.reuters.com/article/uk-axa-eqh-idINKBN1XJ08F,https://s2.reutersmedia.net/resources/r/?m=02&d=20191109&t=2&i=1450191793&w=1200&r=LYNXMPEFA80B3,2019-11-09T12:04:05Z,"PARIS (Reuters) - French insurer AXA (AXAF.PA) said it expected to book net proceeds of $3.1 billion from the sale of a 29% stake in AXA Equitable Holdings (EQH) (EQH.N) as it exits its U.S. life insurance business. 
AXA, the second-largest European insurer … [+822 chars]",0,0.0,0.0,0.0,0.0
76,bbc-news,BBC News,,"Scottish Gossip: Steven Gerrard, Neil Lennon, Rangers, Celtic, Hearts, Hibs","Hearts urged to find sporting director before a new manager, Rangers boss aware of interest in Ibrox midfielder...",https://www.bbc.co.uk/sport/football/50358753,https://ichef.bbci.co.uk/onesport/cps/624/cpsprodpb/5844/production/_102969522_fgsdgd.jpg,2019-11-09T09:05:16Z,"FOOTBALL GOSSIP
Caretaker boss Austin MacPhee insists Hearts can't afford to make the same mistake as Rangers and appoint their new manager before they identify a sporting director. (Sun)
Rangers manager Steven Gerrard refuses to put a price tag on Glen Kam… [+2178 chars]",0,21.0,21.0,3.0,0.0
13,business-insider,Business Insider,Liz Knueven,A Southern California couple who worked 'blue collar' jobs plans to retire comfortably thanks to 3 strategies they started years ago,"Corky and Patti Ewing of Southern California are retiring on a comfortable income, despite never earning more than a middle class income in Southern California. Their use of compound interest in retirement accounts, rental income and property ownership, and i…",https://www.businessinsider.com/middle-class-couple-retirement-advice-southern-california,https://image.businessinsider.com/5dc5edfa3afd3713d7221cb2?width=1200&format=jpeg,2019-11-09T16:15:00Z,"As self-described ""blue-collar workers"" in expensive southern California, Corky and Patti Ewing never thought they'd be able to really retire. 
""We're just pinching ourselves that we're even able to even think about retiring,"" Corky, a 62-year-old business o… [+3632 chars]",0,15.0,4.0,13.0,0.0
44,the-irish-times,The Irish Times,Shilpa Ganatra,Pete Townshend: ‘I woke up with a needle in my arm and Phil Lynott standing there’,"The Who guitarist on addiction, his new novel and why he’s still touring 40 years later",https://www.irishtimes.com/culture/music/pete-townshend-i-woke-up-with-a-needle-in-my-arm-and-phil-lynott-standing-there-1.4072072,https://www.irishtimes.com/image-creator/?id=1.4072062&origw=1440,2019-11-09T05:00:00Z,"Phil Lynott was a good friend, but he was a heroin addict when I knew him, Pete Townshend recalls. He reminded me a lot of Jimi Hendrix, who, in the flesh, had no light. But as soon as he started to play music, light would happen, like a shaman. Phil was like… [+10225 chars]",1,66.0,9.0,30.0,0.0
38,cnn,CNN,,Late-night host surprises college students with free tuition,"""Tonight Show"" host Jimmy Fallon surprised three University of Texas students by telling them Samsung would be paying for the remainder of their college tuition.",https://www.cnn.com/videos/business/2019/11/08/jimmy-fallon-college-tuition-surprise-dig-orig-jk.cnn,https://cdn.cnn.com/cnnnext/dam/assets/191108191415-tonight-show-fallon-students-tuition-super-tease.jpg,2019-11-09T11:35:22Z,Chat with us in Facebook Messenger. Find out what's happening in the world as it unfolds.,0,18.0,2.0,28.0,0.0
48,newsweek,Newsweek,Jeffery Martin,Donald Trump's Co-Author Suggests News Media Count His Truths Instead of Lies: 'It's an Easier Count',"Tony Schwartz, who wrote ""The Art of the Deal"" with Donald Trump suggests that keeping track of his truths instead of his lies would be an ""easier count.""",https://www.newsweek.com/donald-trumps-co-author-suggests-news-media-count-his-truths-instead-lies-its-easier-count-1470759,https://d.newsweek.com/en/full/1544031/president-donald-j-trump.jpg,2019-11-09T02:16:22Z,"Tony Schwartz, who co-wrote the book The Art of the Deal with Donald Trump before he became president, suggested today on MSNBC that news organizations begin counting how many times President Trump tells the truth instead of keeping track of all his lies, acc… [+2849 chars]",0,284.0,47.0,82.0,0.0
34,cnn,CNN,"Swati Gupta, CNN",Half a million people evacuated as cyclone approaches Bangladesh and eastern India,"Around 500,000 people have been evacuated from Bangladesh's coastal region, as the nation waits for Cyclone Bulbul to hit on Saturday evening, the country's disaster management minister said.",https://www.cnn.com/2019/11/09/asia/cyclone-bulbul-bangladesh-eastern-india-intl/index.html,https://cdn.cnn.com/cnnnext/dam/assets/191109121443-cyclone-bulbu-01-super-tease.jpg,2019-11-09T12:38:20Z,"New Delhi (CNN)About 500,000 people have been evacuated from Bangladesh's coastal region, as the nation waits for Cyclone Bulbul to hit on Saturday evening -- according to the country's disaster management minister.
The cyclone was more than 124 miles (200 k… [+849 chars]",0,388.0,55.0,169.0,0.0
19,newsweek,Newsweek,Jeanine Marie Russaw,John Legend Blasts Former U.N. Ambassador Nikki Haley for Comparing Impeachment to the Death Penalty,"""You're going to impeach a president for asking for a favor that didn't happen and—and giving money and it wasn't withheld?"" Haley told CBS News anchor Norah O'Donnell, in an interview airing this weekend.",https://www.newsweek.com/john-legend-blasts-nikki-haley-impeachment-death-penalty-1470795,https://d.newsweek.com/en/full/1544081/john-legend.jpg,2019-11-09T15:20:05Z,"Singer and songwriter John Legend is offering criticism of former U.S. ambassador to the United Nations Nikki Haley.
On Friday, the 10-time Grammy-winning artist took aim at Haley on Twitter after the former ambassador shared an article from The Hillin which… [+2731 chars]",0,677.0,77.0,73.0,0.0
2,the-new-york-times,The New York Times,Firoozeh Dumas,When the Best Deal Is What You Give Away,My father taught me that negotiation is not always about maximizing what you can get.,https://www.nytimes.com/2019/11/09/opinion/parenting-ethics.html,https://static01.nyt.com/images/2019/11/10/opinion/sunday/10dumas/10dumas-facebookJumbo.jpg,2019-11-09T19:30:04Z,"My fathers love for his vehicles, however, was not limited to appearances. On any evening, you would find my dad in the garage, like Jonah halfway in the whale, his torso gulped by the hood of the car. As soon as he heard me, he would emerge, always enthusias… [+1489 chars]",0,0.0,0.0,4.0,0.0
28,al-jazeera-english,Al Jazeera English,Al Jazeera,Zimbabwe bans South Africa livestock import over disease fears,Authorities say suspension follows discovery of foot and mouth disease in northern South Africa close to border.,https://www.aljazeera.com/news/2019/11/zimbabwe-bans-south-africa-livestock-import-disease-fears-191109063936860.html,https://www.aljazeera.com/mritems/Images/2019/11/9/1886aa88291f47f598ea34cfae551845_18.jpg,2019-11-09T07:44:09Z,"Zimbabwe has suspended imports of livestock and meat from South Africa for the second time this year after an outbreak of foot and mouth in the north of its neighbouring country.
In a statement on Friday, the agriculture ministry called the move ""a precautio… [+858 chars]",0,0.0,0.0,17.0,0.0
60,cnn,CNN,"Helen Regan, Swati Gupta and Manveena Suri, CNN",India's Supreme Court set to rule on holy site claimed by Hindus and Muslims,India's Supreme Court is set to deliver a ruling Saturday in a fierce dispute over a religious site that's claimed by both Hindus and Muslims.,https://www.cnn.com/2019/11/08/asia/ayodhya-dispute-india-ruling-intl-hnk/index.html,https://cdn.cnn.com/cnnnext/dam/assets/191109085437-ayodhya-security-super-tease.jpg,2019-11-09T03:43:33Z,,0,1754.0,838.0,364.0,0.0
46,bbc-news,BBC News,,2019/11/09 15:01 GMT,The latest five minute news bulletin from BBC World Service.,https://www.bbc.co.uk/programmes/w172wy0nd4880j6,https://ichef.bbci.co.uk/images/ic/1200x675/p060dh18.jpg,2019-11-09T15:04:00Z,The latest five minute news bulletin from BBC World Service.,0,0.0,0.0,0.0,0.0
7,bbc-news,BBC News,,Southampton 1-2 Everton: Ralph Hasenhuttl says his side ‘are not good enough' after home defeat,"Southampton manager Ralph Hasenhuttl says his side ""are not good enough"" after their 2-1 loss at home to Everton.",https://www.bbc.co.uk/sport/av/football/50362886,https://m.files.bbci.co.uk/modules/bbc-morph-sport-page/3.3.2/images/bbc-sport-logo.png,2019-11-09T18:38:08Z,"Southampton manager Ralph Hasenhuttl says his side are not good enough after their 2-1 loss at home to Everton. 
MATCH REPORT: Southampton 1-2 Everton
Watch highlights of Southampton v Everton on Match of the Day this Saturday at 23:00 GMT on BBC One and BB… [+9 chars]",0,9.0,2.0,5.0,0.0
61,bbc-news,BBC News,https://www.facebook.com/bbcnews,Two cases of deadly diphtheria detected in Lothian area,NHS Lothian has confirmed two related cases of the disease and say infection protocols are in place.,https://www.bbc.co.uk/news/uk-scotland-edinburgh-east-fife-50358872,https://ichef.bbci.co.uk/news/1024/branded_news/14383/production/_109591828_gettyimages-842486542.jpg,2019-11-09T12:00:43Z,"Image copyrightGetty ImagesImage caption
 Diphtheria vaccination programmes protect most people in the UK
Two people are being treated in Scotland for the potentially deadly diphtheria infection.
NHS Lothian has confirmed the two cases are related and both… [+1409 chars]",0,3434.0,1172.0,1264.0,0.0
46,business-insider,Business Insider,Adam Payne,The 'Remain alliance' could accidentally help Boris Johnson win a majority and force through Brexit,"A plan to help anti-Brexit candidates win seats in the UK general election could inadvertently have the opposite effect. The Liberal Democrats, Green Party and Plaid Cymru have agreed to step aside for each other in 60 seats across England and Wales. However,…",https://www.businessinsider.com/anti-brexit-campaigners-fear-remain-pact-helps-boris-johnson-win-2019-11,https://image.businessinsider.com/5dc5862c3afd376214212272?width=1200&format=jpeg,2019-11-09T08:45:00Z,"Anti-Brexit opposition parties announced a plan this week to stand aside for each other in 60 seats across England and Wales at the upcoming UK general election. 
The electoral pact, brokered by the group Unite to Remain, is designed to help the maximum numb… [+5581 chars]",0,64.0,48.0,32.0,0.0
