,source_id,source_name,author,title,description,url,url_to_image,published_at,content,top_article,engagement_reaction_count,engagement_comment_count,engagement_share_count,engagement_comment_plugin_count
66,cnn,CNN,"Sandra Gonzalez, CNN",Congressional Hispanic Caucus members get taste of 'Vida' in Hollywood,"The cast of Starz dramedy ""Vida"" knows what life is like for Latinx creatives in Hollywood.",https://www.cnn.com/2019/11/08/entertainment/vida-starz/index.html,https://cdn.cnn.com/cnnnext/dam/assets/180503102734-vida-starz-super-tease.jpeg,2019-11-09T02:41:08Z,"When it comes to &amp; , Latinos are mis- &amp; underrepresented.
That's why we NEED shows like @VIDA_STARZ to break down stereotypes &amp; offer a genuine look into the Latino experience.
Thank you to the Vida cast &amp; crew for sharing your experiences w… [+111 chars]",0,4.0,0.0,19.0,0.0
72,cnn,CNN,Daniel Dale,Trump called Gordon Sondland a 'great American.' Now he says 'I hardly know the gentleman.',President Donald Trump has a history of distancing himself from associates who have found themselves in legal trouble or turned on him in some way.,https://www.cnn.com/2019/11/08/politics/fact-check-trump-sondland-hardly-know-gentleman-relationship/index.html,https://cdn.cnn.com/cnnnext/dam/assets/191108140146-02-trump-sondland-file-super-tease.jpg,2019-11-09T01:09:51Z,,0,1392.0,400.0,605.0,0.0
16,abc-news,ABC News,Stacy Chen,Forever 21 employees organize in midst of restructuring,"Get breaking national and world news, broadcast video coverage, and exclusive interviews. Find the top news online at ABC news.",https://abcnews.go.com/Business/forever-21-employees-organize-fight-workers-rights-bankruptcy/story?id=66862551,https://s.abcnews.com/images/Business/forever21-gty-aa-191108_hpMain_16x9_992.jpg,2019-11-09T16:23:32Z,"Since Forever 21's bankruptcy announcement -- where up to 178 brick and mortar locations across the country were expected to close -- hundreds of former and current employees are taking matters into their own hands to protect themselves.
They are seeking hel… [+4660 chars]",0,50.0,1.0,26.0,0.0
0,abc-news,ABC News,Lesley Messer,Vanna White hosts 'Wheel of Fortune' as Pat Sajak recovers from 'emergency surgery',"""Wheel of Fortune"" host Pat Sajak is recovering from ""emergency surgery.""",https://abcnews.go.com/GMA/Culture/vanna-white-hosts-wheel-fortune-pat-sajak-recovers/story?id=66868320,https://s.abcnews.com/images/GMA/pat-sajak-file-gty-jef-191108_hpMain_2_16x9_992.jpg,2019-11-09T03:55:00Z,"""Wheel of Fortune"" host Pat Sajak is recovering from emergency surgery to correct a blocked intestine, according to a post from the game show's Twitter account.
Taping of the show was suspended Thursday, and on Friday, Vanna White stepped in for Sajak as he … [+540 chars]",1,785.0,119.0,81.0,0.0
45,the-irish-times,The Irish Times,Rob Doyle,Reflections: or Sentences and Moral Maxims by La Rochefoucauld (1678): Let’s get cynical,We ought to go on a corporate retreat to help us reconnect with our buried cynicism,https://www.irishtimes.com/culture/books/reflections-or-sentences-and-moral-maxims-by-la-rochefoucauld-1678-let-s-get-cynical-1.4072046,https://www.irishtimes.com/image-creator/?id=1.4072045&origw=1440,2019-11-09T06:00:00Z,"Until not so long ago, cynicism was the thing. It wasnt just Generation X: much modern literature favoured a sceptical, mocking outlook that probed righteousness for ulterior motives. What we might call the Justin Trudeauification of networked life in the 201… [+1764 chars]",0,0.0,0.0,1.0,0.0
2,cnn,CNN,Theresa Waldrop,'Good Times' is the next retro sitcom to get the live treatment on ABC,"ABC is bringing back its popular ""Live in Front of a Studio Audience"" variety special for the holidays, this time including episodes from the 1970s sitcom ""Good Times,"" as well as more from ""All in the Family,"" the network said.",https://www.cnn.com/2019/11/09/us/good-times-live-in-front-of-a-studio-audience-abc-trnd/index.html,https://cdn.cnn.com/cnnnext/dam/assets/190522183028-norman-lear-and-jimmy-kimmel-super-tease.jpg,2019-11-09T19:21:30Z,"(CNN)ABC is bringing back its popular ""Live in Front of a Studio Audience"" variety special for the holidays, this time including episodes from the 1970s sitcom ""Good Times,"" as well as more from ""All in the Family,"" the network said.
The specials remake clas… [+1037 chars]",0,0.0,0.0,9.0,0.0
6,bbc-news,BBC News,,Newcastle United 2-1 Bournemouth: Eddie Howe says Newcastle defeat 'really hurts',Bournemouth manager Eddie Howe says his side's defeat to Newcastle will really hurt after they were beaten 2-1 at St James' Park.,https://www.bbc.co.uk/sport/av/football/50362659,https://m.files.bbci.co.uk/modules/bbc-morph-sport-page/3.3.2/images/bbc-sport-logo.png,2019-11-09T18:40:38Z,"Bournemouth manager Eddie Howe says his side's defeat to Newcastle will really hurt after they were beaten 2-1 at St James' Park.
MATCH REPORT: Newcastle 2-1 Bournemouth
Watch highlights on Match of the Day, Saturday 9th November at 22:30 GMT on BBC One and… [+32 chars]",0,0.0,0.0,6.0,0.0
15,cnn,CNN,"Mohammed Tawfeeq, CNN","Iraq protests death toll rises to 300 with nearly 15,000 injured","At least 301 people have been killed and nearly 15,000 have been injured in Iraq since the start of anti-government protests in October, the Independent High Commission for Human Rights of Iraq (IHCHR) said in a statement Saturday.",https://www.cnn.com/2019/11/09/middleeast/iraq-protest-death-toll-intl/index.html,https://cdn.cnn.com/cnnnext/dam/assets/191109145259-iraq-protests-02-super-tease.jpg,2019-11-09T16:00:02Z,"Baghdad (CNN)At least 301 people have been killed and nearly 15,000 have been injured in Iraq since the start of anti-government protests in October, the Independent High Commission for Human Rights of Iraq (IHCHR) said in a statement Saturday.
The higher de… [+745 chars]",0,330.0,35.0,290.0,0.0
8,al-jazeera-english,Al Jazeera English,Al Jazeera,"On Berlin Wall anniversary, Merkel urges Europe to defend freedom",German chancellor warns against divisions three decades after historic event that led to reunification.,https://www.aljazeera.com/news/2019/11/berlin-wall-anniversary-merkel-urges-europe-defend-freedom-191109132550762.html,https://www.aljazeera.com/mritems/Images/2019/11/9/37a2aaeff56b4549a0e3920ce0b694bd_18.jpg,2019-11-09T14:11:27Z,"Chancellor Angela Merkel on Saturday urged Europe to defend democracy and freedom as Germany marked 30 years since the fall of the Berlin Wall, warning that such gains must not be taken for granted.
At a solemn ceremony in a church standing on the former ""de… [+3031 chars]",0,22.0,4.0,34.0,0.0
20,the-new-york-times,The New York Times,Kaly Soto,5 Impeachment Developments You Need to Know From This Week,The impeachment inquiry entered a public phase. President Trump and his allies continued to attack witnesses in the inquiry. And more.,https://www.nytimes.com/2019/11/09/briefing/5-impeachment-developments-you-need-to-know-from-this-week.html,https://static01.nyt.com/images/2019/11/01/us/politics/09schiff-weekend/00dc-schiff1-facebookJumbo.jpg,2019-11-09T12:27:01Z,"After weeks of closed-door depositions, public hearings into whether President Trump pressured Ukraine to investigate a rival for political gain are scheduled to begin on Wednesday. William B. Taylor Jr., the top American envoy in Ukraine, and George P. Kent,… [+479 chars]",0,32.0,6.0,100.0,0.0
13,bbc-news,BBC News,,2019/11/09 18:00 GMT,The latest five minute news bulletin from BBC World Service.,https://www.bbc.co.uk/programmes/w172wy0nd488crl,https://ichef.bbci.co.uk/images/ic/1200x675/p060dh18.jpg,2019-11-09T18:06:00Z,The latest five minute news bulletin from BBC World Service.,0,0.0,0.0,0.0,0.0
47,reuters,Reuters,Reuters Editorial,"Iraq oil production and exports stable, extraction healthy - minister","Iraq's oil production and export rates remain stable, Oil Minister Thamer Ghadhban said on Saturday, as the country remained gripped by widespread anti-government protests.",https://in.reuters.com/article/uk-iraq-oil-idINKBN1XJ09U,https://s2.reutersmedia.net/resources/r/?m=02&d=20191109&t=2&i=1450213150&w=1200&r=LYNXMPEFA80DI,2019-11-09T13:28:05Z,"BAGHDAD (Reuters) - Iraq’s oil production and export rates remain stable, Oil Minister Thamer Ghadhban said on Saturday, as the country remained gripped by widespread anti-government protests. 
“Ghadhban pointed to the stability of production and export rate… [+273 chars]",0,0.0,0.0,0.0,0.0
71,reuters,Reuters,Reuters Editorial,France's EDF expects six new nuclear reactors to cost 46 billion euros: Le Monde,"French power utility EDF estimates it would cost at least 46 billion euros ($51 billion) to build six of its latest generation EPR nuclear reactors if the government decides to build them, French newspaper Le Monde reported on Saturday.'",https://www.reuters.com/article/us-edf-nuclear-epr-idUSKBN1XJ074,https://s4.reutersmedia.net/resources/r/?m=02&d=20191109&t=2&i=1450168689&w=1200&r=LYNXMPEFA808Y,2019-11-09T10:33:06Z,"PARIS (Reuters) - French power utility EDF estimates it would cost at least 46 billion euros ($51 billion) to build six of its latest generation EPR nuclear reactors if the government decides to build them, French newspaper Le Monde reported on Saturday. 
Th… [+934 chars]",0,35.0,22.0,7.0,0.0
59,the-wall-street-journal,The Wall Street Journal,Avantika Chilkoti,Aramco Promises Bumper Dividends but Investors Dwell on Governance and Valuation,The state oil giant has initially pledged an annual dividend of $75 billion for the first five years,https://www.wsj.com/articles/aramco-promises-bumper-dividends-but-investors-dwell-on-governance-and-valuation-11573318089?mod=hp_lead_pos2,https://images.wsj.net/im-125499/social,2019-11-09T16:48:00Z,"As Saudi Aramco gears up for what could be the worlds largest ever share sale, the company is trying to draw global investors with the promise of hefty dividends. But some investors are dwelling instead on what they perceive to be weak governance and a potent… [+4635 chars]",1,0.0,0.0,0.0,0.0
1,bbc-news,BBC News,https://www.facebook.com/bbcnews,French student sets himself on fire over financial problems,The 22-year-old posted on Facebook that he was having financial difficulties.,https://www.bbc.co.uk/news/world-europe-50361886,https://ichef.bbci.co.uk/news/1024/branded_news/92C1/production/_109596573_mediaitem109595342.jpg,2019-11-09T19:40:55Z,"Image copyrightGetty ImagesImage caption
 The man reportedly suffered 90% burns
A 22-year-old French student is in a critical condition after setting himself on fire. 
The man posted on Facebook about his financial difficulties just hours before self-immol… [+1166 chars]",0,1.0,2.0,44.0,0.0
60,reuters,Reuters,Reuters Editorial,Iraqi PM calls for protests to allow a return to 'normal life',"Iraq's Prime Minister Abdul Mahdi said on Saturday that although protests were important in bringing about reform, life in the country must be allowed to return to normal.",https://af.reuters.com/article/worldNews/idAFKBN1XJ083,https://s4.reutersmedia.net/resources/r/?m=02&d=20191109&t=2&i=1450185358&w=1200&r=LYNXMPEFA809X,2019-11-09T11:39:53Z,"BAGHDAD (Reuters) - Iraq’s Prime Minister Abdul Mahdi said on Saturday that although protests were important in bringing about reform, life in the country must be allowed to return to normal. 
“The protests have helped and will help pressure political groups… [+375 chars]",0,0.0,0.0,0.0,0.0
6,cnn,CNN,"Shannon Liao, CNN Business",Colleges are helping students start careers in esports,"Team SoloMid, partly known for its League of Legends competitive play, will be recruiting at UC Irvine and Santa Barbara for its summer 2020 internships and the potential for full-time positions. TSM is also looking to partner with Stanford and UCLA.",https://www.cnn.com/2019/11/09/tech/tsm-esports-careers-college/index.html,https://cdn.cnn.com/cnnnext/dam/assets/191107112713-02-uc-irvine-college-esports-super-tease.jpg,2019-11-09T17:50:40Z,"New York (CNN Business)Colleges have long helped students get jobs in finance, education and other industries. But now a handful of US-based universities are playing a role in launching careers in the competitive video gaming world.
Schools such as Universit… [+5322 chars]",0,8.0,0.0,27.0,0.0
21,cnn,CNN,"Phil Mattingly, CNN",House Republicans ask for Hunter Biden and whistleblower to testify in impeachment probe,House Republicans on Saturday submitted their list of witnesses they'd like to testify as part of the chamber's impeachment inquiry into President Donald Trump and Ukraine.,https://www.cnn.com/2019/11/09/politics/house-republicans-impeachment-witness-requests/index.html,https://cdn.cnn.com/cnnnext/dam/assets/191031123426-02-impeachment-gop-response-super-tease.jpg,2019-11-09T15:22:09Z,,0,6359.0,6405.0,706.0,0.0
63,cnn,CNN,"Nicole Chavez, CNN",Her boyfriend admitted child abuse but didn't go to prison. She got 15 years for not reporting him,Tondalao Hall was arrested after her boyfriend left her baby girl with broken ribs. She didn't hurt the child but still served 15 years over the abuse.,https://www.cnn.com/2019/11/08/us/tondalao-hall-sentence-commuted-trnd/index.html,https://cdn.cnn.com/cnnnext/dam/assets/191108170834-tondalao-hall-1108-super-tease.jpg,2019-11-09T02:51:13Z,"(CNN)Tondalao Hall was arrested after her boyfriend left her baby girl with broken ribs. She didn't hurt the child but still served 15 years over the abuse. 
Hall, 35, was released Friday from the Mabel Bassett Correctional Center in McLoud, Oklahoma. She te… [+2771 chars]",0,309.0,107.0,342.0,0.0
52,bbc-news,BBC News,,2019/11/09 14:00 GMT,The latest five minute news bulletin from BBC World Service.,https://www.bbc.co.uk/programmes/w172wy0nd487ws2,https://ichef.bbci.co.uk/images/ic/1200x675/p060dh18.jpg,2019-11-09T14:06:00Z,The latest five minute news bulletin from BBC World Service.,0,0.0,0.0,0.0,0.0
23,al-jazeera-english,Al Jazeera English,Al Jazeera,Indian Sikhs begin historic pilgrimage to Pakistan,At least 700 pilgrims are expected to cross to one of Sikh religion's holiest sites through special corridor.,https://www.aljazeera.com/news/2019/11/indian-sikhs-historic-pilgrimage-pakistan-191109074815589.html,https://www.aljazeera.com/mritems/Images/2019/11/9/fe53cc18f6cf4b99a863bd173f82f60b_18.jpg,2019-11-09T09:04:08Z,"Hundreds of Indian Sikhs have begun a historic pilgrimage to Pakistan, crossing to one of their religion's holiest sites under a landmark deal between the two countries.
At least 700 pilgrims are expected to pass through the corridor on Saturday, with more t… [+3685 chars]",0,4565.0,972.0,343.0,0.0
65,bbc-news,BBC News,,2019/11/09 11:00 GMT,The latest five minute news bulletin from BBC World Service.,https://www.bbc.co.uk/programmes/w172wy0nd487jjp,https://ichef.bbci.co.uk/images/ic/1200x675/p060dh18.jpg,2019-11-09T11:06:00Z,The latest five minute news bulletin from BBC World Service.,0,0.0,0.0,0.0,0.0
3,business-insider,Business Insider,Graham Rapier,I've always thought travel insurance was a scam — but it saved me $124 my first time using it,"I can't even begin to count the number of times I've declined travel insurance when booking plane tickets. But when it came to Amtrak, horror stories of delays that I couldn't shake from my head convinced me it might be worth the investment for my cross-count…",https://www.businessinsider.com/travel-insurance-not-a-scam-after-all-2019-11,https://image.businessinsider.com/5dc5bff83afd3749f5603b6c?width=1200&format=jpeg,2019-11-09T18:08:00Z,"As I booked a cross-country Amtrak journey this fall in pursuit of stories for Business Insider, there was a cacophony of horror stories I couldn't get out of my head.
Beyond anecdotal tales of massive delays, like the 183 passengers who were stuck on a trai… [+472 chars]",0,0.0,0.0,4.0,0.0
4,abc-news,ABC News,The Associated Press,Man faces sexual assault charge after incident on a plane,A Utah man faces sexual assault charges after a woman sitting next to him on an airline flight says he groped her,https://abcnews.go.com/Business/wireStory/man-faces-sexual-assault-charge-incident-plane-66878506,null,2019-11-09T18:54:54Z,"A Utah man accused of groping another passenger on a Salt Lake City-bound American Airlines flight that diverted to Tulsa for his arrest has been charged with abusive sexual contact.
The man, identified in court records as James Clayton Cholewinski-Boy, 32, … [+1188 chars]",1,0.0,0.0,5.0,0.0
14,newsweek,Newsweek,Janice Williams,How to Watch Logan Paul and KSI Fight in Second Boxing Match Event Live Stream,"Unlike the pair's first match in 2018, viewers won't be able to live stream the new fight on YouTube.",https://www.newsweek.com/logan-paul-ksi-boxing-fight-1470807,https://d.newsweek.com/en/full/1544080/how-watch-logan-paul-ksi-fight.jpg,2019-11-09T16:13:17Z,"YouTube stars Logan Paul and KSI will go head-to-head in a boxing match in Los Angeles on Saturday.
The fight will mark their second time together in the boxing ring following their amateur match at Manchester Arena in England in 2018. That fight raked in mi… [+3163 chars]",0,0.0,0.0,0.0,0.0
51,the-new-york-times,The New York Times,,Trump to Ask U.S. Supreme Court to Review Tax Returns Decision - The New York Times,"U.S. President Donald Trump plans to ask the U.S. Supreme Court to overturn a ruling requiring his accounting firm to turn over eight years of his tax returns to New York prosecutors, setting the stage for a possible decision before the 2020 election.",https://www.nytimes.com/reuters/2019/11/08/us/08reuters-usa-trump-taxes.html,https://static01.nyt.com/newsgraphics/images/icons/defaultPromoCrop.png,2019-11-09T01:40:00Z,"Monday's ruling by the 2nd U.S. Circuit Court of Appeals authorized Vance's office to enforce a subpoena to obtain Trump's tax returns from the accounting firm Mazars LLP.
Vance, a Democrat, sought the returns as part of a criminal probe into Trump and his f… [+584 chars]",0,3.0,1.0,3.0,0.0
41,cbs-news,CBS News,AP,"Betsy DeVos cancels debt for 1,500 students after facing lawsuit","Virginia Representative Bobby Scott says the decision still falls ""well short"" of providing necessary relief",https://www.cbsnews.com/news/betsy-devos-education-cancels-student-loan-debt-for-1500-students-amid-lawsuit/,https://cbsnews3.cbsistatic.com/hub/i/r/2018/06/06/8620be3b-65e2-400c-ace9-691b984c0da2/thumbnail/1200x630g2/ceba4a9c013efde48393cf12ca334403/2018-05-22t154135z-1528113300-hp1ee5m17la2f-rtrmadp-3-usa-congress-education.jpg,2019-11-09T01:45:34Z,"Facing a federal lawsuit and mounting criticism, Education Secretary Betsy DeVos on Friday said she will forgive loans for more than 1,500 borrowers who attended a pair of for-profit colleges that shut down last year. 
Students who attended the Art Institute… [+5097 chars]",0,1423.0,594.0,459.0,0.0
20,reuters,Reuters,Reuters Editorial,"Lebanese banking association head says depositors' money is safe, no need for panic","Lebanese depositors' money is safe in the banks and there is no need for panic, Salim Sfeir, the head of the Association of Banks in Lebanon, said in a press conference on Saturday.",https://af.reuters.com/article/worldNews/idAFKBN1XJ0DL,https://s4.reutersmedia.net/resources/r/?m=02&d=20191109&t=2&i=1450263308&w=1200&r=LYNXMPEFA80H9,2019-11-09T16:56:11Z,"BEIRUT (Reuters) - Lebanese depositors’ money is safe in the banks and there is no need for panic, Salim Sfeir, the head of the Association of Banks in Lebanon, said in a press conference on Saturday. 
Funds for medicine, fuel and wheat imports were also sec… [+347 chars]",0,0.0,0.0,0.0,0.0
10,business-insider,Business Insider,INSIDER,Donald Trump wants spinoff of 'The Apprentice' focused on politics - Business Insider,"Donald Trump has reportedly had conversations with television producer Mark Burnett about a spinoff of ""The Apprentice,"" The Daily Beast reported.",http://www.businessinsider.com/donald-trump-the-apprentice-white-house-2019-11,https://image.businessinsider.com/5dc6dab6695b5843c8492346?width=1200&format=jpeg,2019-11-09T15:25:54Z,"Donald Trump had a tough choice to make back in 2015: To pursue a presidential run, he needed to surrender his starring role in the popular reality television show, ""The Apprentice.""
The decision to step down as the show's host left him ""visibly upset,"" Sam … [+2189 chars]",1,0.0,0.0,0.0,0.0
69,cnn,CNN,Staff,"The best gifts for kids at every age (yes, even teens!)","It isn't easy finding the best gifts for kids. To help with your holiday shopping, we've curated the cute, the fun and the cool. Among these ideas from Melissa & Doug, LOL Surprise, Hatchimals and more will be one (or 10!) that are a perfect match.",https://www.cnn.com/2019/11/08/cnn-underscored/best-gifts-for-kids/index.html,https://cdn.cnn.com/cnnnext/dam/assets/191108211807-best-gifts-for-kids-lead-super-tease.jpg,2019-11-09T02:24:42Z,"The children in our lives make the holidays magical. But sussing out what, exactly, to gift a baby who's barely aware of what's going on, or an energetic toddler? That feels slightly less magical. And it seems like the older they get, the harder it is to wow … [+11857 chars]",0,1.0,0.0,11.0,0.0
28,abc-news,ABC News,Daniel Manzo,"Cold blast to bring single-digit wind chills for Midwest, Northeast",A significant blast of cold air by November standards is dominating the eastern half of the country.,https://abcnews.go.com/US/cold-blast-bring-single-digit-wind-chills-midwest/story?id=66873896,https://s.abcnews.com/images/US/south-dakota-snow-mo_hpMain_20191109-071025_16x9_992.jpg,2019-11-09T12:51:33Z,"A significant blast of cold air by November standards is dominating the eastern half of the country on Saturday morning -- but it is only a tease of the arctic blast of air coming next week.
Interested in Weather?
Add Weather as an interest to stay up to da… [+2683 chars]",0,435.0,145.0,150.0,0.0
40,cbs-news,CBS News,AP,"""Wheel of Fortune"" host Pat Sajak undergoes emergency surgery",His co-host Vanna White will be taking over while he recovers,https://www.cbsnews.com/news/pat-sajak-surgery-blocked-intestine-wheel-of-fortune-recovering-from-emergency-surgery/,https://cbsnews1.cbsistatic.com/hub/i/r/2019/11/09/92cdc046-7330-420a-b72a-a553737f5674/thumbnail/1200x630/ea7249ff009c06255b6ff01b361c019f/gettyimages-944070690.jpg,2019-11-09T01:50:09Z,"""Wheel of Fortune"" host Pat Sajak is recovering Friday from emergency surgery to fix a blocked intestine, the show said in a statement. The show paused taping for a day on Thursday, and resumed Friday with co-host Vanna White at the helm. 
Thursday's taping … [+955 chars]",0,676.0,122.0,126.0,0.0
69,reuters,Reuters,Reuters Editorial,"Ukraine, separatists begin planned troop withdrawal in eastern region: witness","Ukrainian government forces and Russian-backed rebels began a planned withdrawal of troops and weaponry from a village in the eastern Donbass region on Saturday, a Reuters witness at the scene said.",https://ca.reuters.com/article/topNews/idCAKBN1XJ07M,https://s3.reutersmedia.net/resources/r/?m=02&d=20191109&t=2&i=1450174063&w=1200&r=LYNXMPEFA8095,2019-11-09T10:53:40Z,"PETRIVSKE, Ukraine (Reuters) - Ukrainian government forces and Russian-backed rebels began a planned withdrawal of troops and weaponry from a village in the eastern Donbass region on Saturday, a Reuters witness at the scene said. 
The troop pullback in the v… [+664 chars]",0,0.0,0.0,0.0,0.0
77,bbc-news,BBC News,BBC Sport,KSI v Logan Paul 2: 'It doesn't get much bigger than this!' - YouTubers build-up to KSI v Logan Paul 2 - BBC Sport,"Watch YouTubers Joe Weller, Chunkz and Sidemen preview KSI v Logan Paul 2 before their showdown in Los Angeles on Sunday morning.",http://www.bbc.co.uk/sport/av/boxing/50346111,https://m.files.bbci.co.uk/modules/bbc-morph-sport-page/3.3.2/images/bbc-sport-logo.png,2019-11-09T12:38:12.873403Z,,1,0.0,0.0,0.0,0.0
47,bbc-news,BBC News,BBC News,England flooding: A tour of a flooded house in Fishlake,This home in Fishlake has been left submerged after persistent rain which caused floods across Yorkshire and the Midlands.,https://www.bbc.co.uk/news/av/uk-50361354/england-flooding-a-tour-of-a-flooded-house-in-fishlake,https://ichef.bbci.co.uk/news/1024/branded_news/E3ED/production/_109594385_p07thmq9.jpg,2019-11-09T14:53:58Z,,0,115.0,54.0,85.0,0.0
39,reuters,Reuters,Hadeel Al Sayegh,Saudi Aramco targets sale of 0.5% of oil firm to retail investors in IPO: sources,"Saudi Aramco is looking to sell up to 0.5% of the state oil giant to retail investors in its planned initial public offering (IPO), three sources familiar with the matter told Reuters.",https://uk.reuters.com/article/us-saudi-aramco-ipo-retail-idUKKBN1XJ0AW,https://s4.reutersmedia.net/resources/r/?m=02&d=20191109&t=2&i=1450231709&w=1200&r=LYNXMPEFA80EW,2019-11-09T14:48:01Z,"DUBAI (Reuters) - Saudi Aramco is looking to sell up to 0.5% of the state oil giant to retail investors in its planned initial public offering (IPO), three sources familiar with the matter told Reuters. 
The Saudi oil group has not yet revealed the size of i… [+1394 chars]",0,0.0,0.0,0.0,0.0
