,source_id,source_name,author,title,description,url,url_to_image,published_at,content,top_article,engagement_reaction_count,engagement_comment_count,engagement_share_count,engagement_comment_plugin_count
5,the-irish-times,The Irish Times,Freya McClements,‘Fear factor’ returns to Border after attacks on Quinn executives,Staff ‘sickened’ by assault of Kevin Lunney but some afraid or unwilling speak out,https://www.irishtimes.com/news/ireland/irish-news/fear-factor-returns-to-border-after-attacks-on-quinn-executives-1.4069634,https://www.irishtimes.com/image-creator/?id=1.4069629&origw=1440,2019-11-01T17:43:55Z,"Along the Fermanagh-Cavan border, the Quinn logo is everywhere. It is there on the distinctive green lorries, on the signs advertising Quinn products and on the businesses themselves, strung out along the Ballyconnell Road, which links the Cavan town of the s… [+3819 chars]",0,0.0,0.0,0.0,0.0
63,cnn,CNN,"Julia Hollingsworth and Manveena Suri, CNN",5 million children to get face masks as New Delhi battles heavy pollution,Five million New Delhi children will be given face masks by the government as the city battles heavy smog so toxic that it threatens to force schools to shut.,https://www.cnn.com/2019/11/01/asia/delhi-pollution-schools-intl-hnk/index.html,https://cdn.cnn.com/cnnnext/dam/assets/191101165531-delhi-smog-super-tease.jpg,2019-11-01T13:05:04Z,"Delhi has turned into a gas chamber due to smoke from crop burning in neighbouring states
It is very imp that we protect ourselves from this toxic air. Through pvt &amp; govt schools, we have started distributing 50 lakh masks today
I urge all Delhiites to … [+104 chars]",0,822.0,154.0,252.0,0.0
53,reuters,Reuters,Reuters Editorial,China may impose $3.58 billion in annual trade sanctions on U.S.: WTO panel,"A World Trade Organization (WTO) panel said on Friday that China could slap compensatory sanctions on U.S. imports worth $3.579 billion annually for the U.S. failure to remove anti-dumping duties, a figure that was roughly half what China had sought.",https://www.reuters.com/article/us-china-trade-us-wto-idUSKBN1XB4K0,https://s3.reutersmedia.net/resources/r/?m=02&d=20191101&t=2&i=1447355525&w=1200&r=LYNXMPEFA034O,2019-11-01T15:40:41Z,"ZURICH (Reuters) - A World Trade Organization (WTO) panel said on Friday that China could slap compensatory sanctions on U.S. imports worth $3.579 billion annually for the U.S. failure to remove anti-dumping duties, a figure that was roughly half what China h… [+592 chars]",0,8.0,1.0,811.0,0.0
59,the-irish-times,The Irish Times,Catie Edmondson,Who are the Democrats who broke ranks on impeachment?,Two conservative lawmakers on Thursday refused to endorse inquiry into Trump,https://www.irishtimes.com/news/world/us/who-are-the-democrats-who-broke-ranks-on-impeachment-1.4069144,https://www.irishtimes.com/image-creator/?id=1.4069143&origw=1440,2019-11-01T10:05:46Z,"Before the House of Representatives voted on Thursday to endorse the Democratic-led impeachment inquiry into US president Donald Trump, two of the most conservative lawmakers in the caucus hazarded a guess as to whether some colleagues might join them in oppo… [+3318 chars]",0,0.0,0.0,1.0,0.0
79,cbs-news,CBS News,CBS News,"Christine Ebersole, Patti LuPone on ""War Paint"" inspirations","In this web extra, the Tony-nominated stars of the Broadway musical ""War Paint,"" Christine Ebersole and Patti LuPone, talk with correspondent Richard Schlesinger about their real-life characters, cosmetic icons Elizabeth Arden and Helena Rubinstein, and about…",https://www.cbsnews.com/video/christine-ebersole-patti-lupone-on-war-paint-inspirations/,https://cbsnews3.cbsistatic.com/hub/i/r/2019/11/01/ac9990df-8b0a-4f44-8058-a2aef2492b98/thumbnail/1200x630/9847ad34e9eee0aeab604d3ffbf32f04/sunmo-webextra-warpaint-1315178-640x360.jpg,2019-11-01T11:55:24Z,,0,0.0,0.0,0.0,0.0
49,newsweek,Newsweek,Jason Murdock,Video Shows Bear Stealing Halloween Candy After Breaking Into Michigan Couple's Car,"""I run to shut the front door in a panic. The momma bear opens our car, steals a box of full size candy bars,"" Brittany Magsig wrote on Facebook, describing the encounter.",https://www.newsweek.com/smoky-mountains-bear-open-car-door-steals-candy-brittany-magsig-facebook-video-1469166,https://d.newsweek.com/en/full/1541892/mama-black-bear-cubs.jpg,2019-11-01T12:57:55Z,"A Michigan couple had an unexpected visit from a mama bear and her cubs this Halloween when the animals broke into their car to steal multiple bars of candy.
Brittany Magsig and her husband Ben, of East Lansing, shared video of the incident on social media, … [+3832 chars]",0,1.0,0.0,3.0,0.0
64,abc-news,ABC News,The Associated Press,"2 men killed at Utah Halloween party, authorities say","Get breaking national and world news, broadcast video coverage, and exclusive interviews. Find the top news online at ABC news.",https://abcnews.go.com/US/wireStory/men-killed-utah-halloween-party-authorities-66687667,,2019-11-01T14:06:32Z,"Authorities say two men have been killed at a Halloween party and that officials are calling the killings a double homicide.
The Duchesne (do-SHANE') County Sheriff's Office said deputies called to a home near the town of Roosevelt early Friday found the two… [+510 chars]",0,0.0,0.0,0.0,0.0
7,al-jazeera-english,Al Jazeera English,Asad Hashim,Pakistan opposition protesters pressure PM Imran Khan to resign,"Prime minister vows to not step down, as thousands continue anti-government sit-in protest in Islamabad.",http://www.aljazeera.com/news/2019/11/pakistan-opposition-protesters-pressure-pm-imran-khan-resign-191101133020989.html,https://www.aljazeera.com/mritems/Images/2019/11/1/f9045eab630546d9886a09699c75d16e_18.jpg,2019-11-01T15:39:00Z,"Islamabad, Pakistan -Pakistani opposition leaders have renewed their demands for Prime Minister Imran Khan to step down, terming his government illegitimate and incompetent, as thousands gathered at an anti-government protest in the capital Islamabad.
Addres… [+3284 chars]",1,0.0,0.0,0.0,0.0
53,reuters,Reuters,Laila Kearney,Shippers seek alternatives for oil as crews work toward plugging Keystone leak,"Cleanup crews in Walsh County, North Dakota, are working toward plugging the Keystone pipeline after a more than 9,000-barrel oil leak this week, a state official said Friday, while crude shippers are searching for alternative means of transport.",http://feeds.reuters.com/~r/reuters/topNews/~3/knihmLGMuLY/shippers-seek-alternatives-for-oil-as-crews-work-toward-plugging-keystone-leak-idUSKBN1XB4GH,https://s4.reutersmedia.net/resources/r/?m=02&d=20191101&t=2&i=1447392874&w=1200&r=LYNXMPEFA038R,2019-11-01T18:06:09Z,"NEW YORK/WINNIPEG (Reuters) - Cleanup crews in Walsh County, North Dakota, are working toward plugging the Keystone pipeline after a more than 9,000-barrel oil leak this week, a state official said Friday, while crude shippers are searching for alternative me… [+2160 chars]",1,4.0,2.0,796.0,0.0
32,reuters,Reuters,Reuters Editorial,World Series champion Nationals to visit Trump at White House,The Washington Nationals have accepted an invitation to visit U.S. President Donald Trump at the White House on Monday to celebrate the franchise's first World Series triumph.,https://ca.reuters.com/article/sportsNews/idCAKBN1XB4NK-OCASP,https://s3.reutersmedia.net/resources/r/?m=02&d=20191101&t=2&i=1447368872&w=1200&r=LYNXMPEFA0375-OCASP,2019-11-01T16:25:30Z,"(Reuters) - The Washington Nationals have accepted an invitation to visit U.S. President Donald Trump at the White House on Monday to celebrate the franchise’s first World Series triumph. 
The Nationals, who began playing in the U.S. capital in 2005 when the… [+1150 chars]",0,0.0,0.0,0.0,0.0
19,the-irish-times,The Irish Times,"Patrick McGee, Alex Barker, Anna Nicolaou",Apple enters video streaming wars with launch of TV+ service,Maker of iPhone is going head-to-head with Netflix and Amazon Prime with its new video streaming subscription service,https://www.irishtimes.com/business/media-and-marketing/apple-enters-video-streaming-wars-with-launch-of-tv-service-1.4069312,https://www.irishtimes.com/image-creator/?id=1.4069311&origw=1440,2019-11-01T16:00:24Z,"The reviews came in swift and harsh. Dull, dreary and dubiously written, declared USA Today. A disappointing creation, said Entertainment Weekly.
The show the press was scolding was Succession the HBO hit that was once critically derided but is now among the… [+8850 chars]",0,0.0,0.0,1.0,0.0
3,cnn,CNN,"Bob Crowley, CNN","Saoirse Kennedy Hill, granddaughter of Robert F. Kennedy, died of accidental overdose, death certificate says","A granddaughter of Robert F. Kennedy died of an accidental overdose, according to her death certificate filed Friday in Massachusetts.",https://www.cnn.com/2019/11/01/politics/saoirse-kennedy-hill-granddaughter-robert-kennedy-death-certificate/index.html,https://cdn.cnn.com/cnnnext/dam/assets/190803112347-09-saoirse-kennedy-hill-super-tease.jpg,2019-11-01T17:28:38Z,"(CNN)A granddaughter of Robert F. Kennedy died of an accidental overdose, according to her death certificate filed Friday in Massachusetts. 
Saoirse Kennedy Hill, 22, was the daughter of Courtney Kennedy Hill, one of the 11 children of the late presidential … [+1496 chars]",0,7.0,17.0,43.0,0.0
65,bbc-news,BBC News,,Scottish Rugby: Scotland to face Japan after World Cup exit,Scottish Rugby has secured two Tests against Japan as they await the result of a World Rugby misconduct charge.,https://www.bbc.co.uk/sport/rugby-union/50262731,https://ichef.bbci.co.uk/onesport/cps/624/cpsprodpb/1104D/production/_109490796_gettyimages-1175837865.jpg,2019-11-01T13:41:33Z,"The SRU are awaiting the result of a misconduct charge relating to Mark Dodson's comments
Scottish Rugby have secured two Tests against Japan as they await the result of a World Rugby misconduct charge.
Gregor Townsend's men will host Japan at Murrayfield i… [+1573 chars]",0,82.0,17.0,8.0,0.0
54,the-new-york-times,The New York Times,John McMurtrie,Keeping the Story of D-Day Alive,"Alan Gratz’s “Allies” introduces a new generation to the heroism — and fears, and doubts — of the young soldiers who fought in World War II.",https://www.nytimes.com/2019/11/01/books/review/allies-alan-gratz.html,https://static01.nyt.com/images/2019/11/10/books/review/10-BKS-MCMURTRIE/10-BKS-MCMURTRIE-facebookJumbo.jpg,2019-11-01T11:06:09Z,"Leaders from around the world gathered in Normandy on June 6 to commemorate the 75th anniversary of D-Day, the largest military invasion in history. Dozens of World War II veterans who had taken part in the five beach landings were there, too. Before long, no… [+1682 chars]",0,2.0,1.0,6.0,0.0
2,cbs-news,CBS News,Leigh Scheps,"Kristin Chenoweth talks ""Wicked"" and her new Broadway show",The Emmy and Tony Award winner says there's a lot we don't know about her life – and she plans to set it to music,https://www.cbsnews.com/news/kristin-chenoweth-wicked-for-the-girls-on-broadway-interview/,https://cbsnews1.cbsistatic.com/hub/i/r/2019/11/01/7ef75391-a50b-46b0-bf0a-308fb905a565/thumbnail/1200x630/b24702f8481b0fb0863b117f7c975058/chenoweth.jpg,2019-11-01T17:43:57Z,"It's past 5 o'clock in the evening when Kristin Chenoweth placed an order for a turkey sandwich with lettuce, tomato, cheese and a side of potato chips for dinner. She just finished a 20-minute private concert in front of about two dozen members of the press … [+6376 chars]",1,0.0,0.0,3.0,0.0
29,the-new-york-times,The New York Times,Peter Kuper,Up River,On Joseph Conrad’s ‘Heart of Darkness’,https://www.nytimes.com/2019/11/01/books/review/Heart-of-Darkness-Kuper.html,https://static01.nyt.com/images/2019/11/01/books/review/oakImage-1572616394760/oakImage-1572616394760-facebookJumbo.jpg,2019-11-01T14:25:23Z,"Peter Kuper is an alternative comics artist and illustrator whose recent book, Kafkaesque, interpreted 14 of Franz Kafkas stories.Follow New York Times Books on Facebook, Twitter and Instagram, sign up for our newsletter or our literary calendar. And listen t… [+31 chars]",0,0.0,0.0,3.0,0.0
3,bbc-news,BBC News,https://www.facebook.com/bbcnews,"Disney boss Bob Iger talks Star Wars, Marvel and Martin Scorsese",Bob Iger says we will see more Marvel and less Star Wars in the coming years.,https://www.bbc.co.uk/news/entertainment-arts-50263749,https://ichef.bbci.co.uk/news/1024/branded_news/180F5/production/_109494589_gettyimages-1138898948.jpg,2019-11-01T17:57:51Z,"Image copyrightGetty ImagesImage caption
 ""I don't think he's ever seen a Marvel film"" - Bob Iger hits back at Martin Scorsese
He's arguably the most powerful man in Hollywood - the boss of The Avengers, The Lion King, Star Wars and Toy Story, not to mentio… [+5731 chars]",0,0.0,1.0,16.0,0.0
55,cnn,CNN,"Matias Grez and Christina Macfarlane, CNN","Rugby World Cup final win would mean so much to South Africa, says coach Rassie Erasmus","Wearing a No. 6 Springboks shirt, South Africa's new democratically-elected president Nelson Mandela handed over the Web Ellis Cup to captain Francois Pienaar.",https://edition.cnn.com/2019/11/01/sport/south-africa-england-rugby-world-cup-final-siya-kolisi-spt-intl/index.html,https://cdn.cnn.com/cnnnext/dam/assets/191101105929-kolisi-erasmus-super-tease.jpg,2019-11-01T13:27:51Z,,0,0.0,0.0,17.0,0.0
41,abc-news,ABC News,The Associated Press,The Latest: Police: Gang member target of Halloween shooting,Chicago police say they believe a gang member was the intended target in a West Side shooting that left a 7-year-old girl who was trick-or-treating critically injured,https://abcnews.go.com/US/wireStory/latest-police-gang-member-target-halloween-shooting-66688858,,2019-11-01T15:01:28Z,"The Latest on the shooting of a 7-year-old girl while she was trick-or-treating in Chicago (all times local):
10 a.m.
Chicago police say they believe a gang member was the intended target in a shooting that left a 7-year-old girl who was trick-or-treating c… [+1430 chars]",0,0.0,0.0,0.0,0.0
27,cnn,CNN,,How Facebook responded to reported online bullying,"CNN's Elizabeth Cohen shares findings from a six-month investigation into bullying and harassment faced by parents, doctors and others who advocate for vaccination on Facebook.",https://www.cnn.com/videos/health/2019/11/01/cnn-investigates-facebook-harassment-aisha-odom-cohen-newday-vpx.cnn,https://cdn.cnn.com/cnnnext/dam/assets/191029122851-aisha-odom-portrait-super-tease.jpg,2019-11-01T15:45:17Z,Chat with us in Facebook Messenger. Find out what's happening in the world as it unfolds.,0,2.0,0.0,17.0,0.0
28,the-new-york-times,The New York Times,Sam Sifton,What to Cook This Weekend,"Bake your apples, prep for Thanksgiving, or make Dorie Greenspan’s latest recipe for Lisbon chocolate cake.",https://www.nytimes.com/2019/11/01/dining/what-to-cook-this-weekend.html,https://static01.nyt.com/images/2019/11/03/magazine/03mag-eat-copy/03mag-eat-facebookJumbo-v2.jpg,2019-11-01T14:30:00Z,"Good morning. Its high agritainment season in the state of New York, roadside farms crowded with parking, with u-pick pumpkin harvesters, apple-pickers, corn mazers, kids crammed in lil red wagons, waving squash. Pull in a nice haul of Pink Ladies or Gold Rus… [+1443 chars]",0,0.0,0.0,1.0,0.0
79,bbc-news,BBC News,BBC News,New wildfires sparked in southern California,Parts of the Los Angeles area are scorched as thousands of people are forced from their homes.,http://www.bbc.co.uk/news/world-us-canada-50265337,https://ichef.bbci.co.uk/news/1024/branded_news/15021/production/_109494068_gettyimages-1179221580.jpg,2019-11-01T16:51:57Z,"Image copyrightGetty Images
More fires have broken out in southern California, setting thousands of acres ablaze, amid a state-wide emergency. 
For the past two weeks, extreme weather conditions, including hurricane-force gusts, have sparked fires and force… [+2127 chars]",1,0.0,0.0,0.0,0.0
30,the-irish-times,The Irish Times,,Sunday Business Post owner confirms deal for Irish Tatler,Portfolio of magazine titles also includes Food & Wine and Auto Ireland,https://www.irishtimes.com/business/media-and-marketing/sunday-business-post-owner-confirms-deal-for-irish-tatler-1.4069344,https://www.irishtimes.com/polopoly_fs/1.4069343.1572630737!/image/image.jpg,2019-11-01T14:13:38Z,"Business Post Media Group (BPMG), the publisher of the Sunday Business Post newspaper, has closed a deal to buy a portfolio of magazine titles including Irish Tatler, Food &amp; Wine and Auto Ireland, from US-Irish investors in an all-share transaction.
Iris… [+303 chars]",0,0.0,0.0,0.0,0.0
11,the-new-york-times,The New York Times,Christian L. Wright,5 Rural Retreats Worthy of a Detour,"Far from neighbors and close to nature, these standout resorts prove that seclusion can take many different forms.",https://www.nytimes.com/2019/11/01/travel/hotels-rural-retreats.html,https://static01.nyt.com/images/2019/11/02/travel/02checkin-rural-puro-02/02checkin-rural-puro-02-facebookJumbo.jpg,2019-11-01T17:10:50Z,"Theres a town in Virginia called Rural Retreat, just off the old Lee Highway in Wythe County. The population: 1,500, give or take.
As a concept, getting away from it all has broader appeal.
This fall, Canyon Ranch a pioneer in wellness long before it was a … [+622 chars]",0,0.0,0.0,12.0,0.0
70,newsweek,Newsweek,James Walker,Tomi Lahren Ridiculed Over Alexandria Ocasio-Cortez Halloween Costume: 'I Know This is a Costume Because Tomi Would Never Read Philosophy',"The Fox Nation host shared a picture of herself wearing large glasses, a blazer and dark brown wig while holding a copy of ""The Communist Manifesto"" by Karl Marx.",https://www.newsweek.com/tomi-lahren-ridiculed-aoc-costume-halloween-1469126,https://d.newsweek.com/en/full/1516602/tomi-lahren-kamala-harris.jpg,2019-11-01T09:53:23Z,"Conservative pundit Tomi Lahren has been mocked after revealing she dressed up as left-wing congresswoman Alexandria Ocasio-Cortez for Halloween.
The Fox Nation host shared a wide-eyed picture of herself wearing large glasses, a blazer and a dark brown wig w… [+3156 chars]",0,2.0,4.0,6.0,0.0
16,al-jazeera-english,Al Jazeera English,,Should Donald Trump be impeached?,"We discuss impeachment with a close friend of Donald Trump's, and debate the future of ISIL without al-Baghdadi.",https://www.aljazeera.com/programmes/upfront/2019/11/donald-trump-impeached-191101084624533.html,,2019-11-01T12:15:57Z,,0,2.0,2.0,17.0,0.0
12,bbc-news,BBC News,https://www.facebook.com/bbcnews,General Election 2019: First head-to-head debate on 19 November,Boris Johnson and Jeremy Corbyn will face off on the ITV special.,https://www.bbc.co.uk/news/election-2019-50268753,https://ichef.bbci.co.uk/news/1024/branded_news/13023/production/_109495877_borisandcorbs.jpg,2019-11-01T17:16:02Z,"Image copyrightPA MediaImage caption
 Boris Johnson and Jeremy Corbyn are among the candidates competing to be prime minister
The first head-to-head election debate between Boris Johnson and Jeremy Corbyn will take place on 19 November. 
The programme will… [+591 chars]",0,252.0,138.0,120.0,0.0
58,newsweek,Newsweek,Tufayel Ahmed,Openload and Streamango Streaming Video Sites Shut Down in Hollywood Piracy Crackdown,"The prolific sites were known to host pirated movies and TV shows including ""Game of Thrones.""",https://www.newsweek.com/openload-shut-down-streamango-pirate-video-streaming-1469157,https://d.newsweek.com/en/full/1541873/openload.png,2019-11-01T11:26:15Z,"Two of the internet's most prolific video streaming sites popular among pirates, Openload and Streamango, have been shut down in a crackdown on piracy of Hollywood movies and television shows.
The streaming sites were used to host illegal versions of popular… [+2862 chars]",0,8.0,8.0,3.0,0.0
43,business-insider,Business Insider,Dominique McIntee,"The 10 best books you'll want to read this November, according to Amazon's editors","Each month, Amazon's book editors select a number of new titles to join the Best Book of the Month section. This November, the list features a variety of great reads, including ""NVK"" by Temple Drake, ""The Great Pretender"" by Susannah Cahalan, and other imagin…",https://www.businessinsider.com/amazon-best-books-november-2019,https://image.businessinsider.com/5db98c0cdee01946133746f5?width=1200&format=jpeg,2019-11-01T15:45:00Z,"Alyssa Powell/Business Insider
Winter's arrival is looming, but it's not all grey and dismal. While low temperatures bring gloom for many, there's something about frosty air that makes reading all-the-more cozy. As a chronically freezing person, I live to en… [+657 chars]",0,9.0,2.0,12.0,0.0
37,the-irish-times,The Irish Times,Barry Roche,Woman remanded further on bail over murder of girl (2) in Cork,Karen Harrington charged with the murder of Santina Cawley in July,https://www.irishtimes.com/news/crime-and-law/courts/district-court/woman-remanded-further-on-bail-over-murder-of-girl-2-in-cork-1.4069309,https://www.irishtimes.com/image-creator/?id=1.4069308&origw=620,2019-11-01T13:13:52Z,"A 35-year-old woman has been further remanded on bail charged with murdering a two-year-old child in Cork as gardaí confirmed they had forwarded a full file on the case to the Director of Public Prosecutions (DPP) on Thursday.
Karen Harrington of Elderwood P… [+1446 chars]",0,0.0,0.0,0.0,0.0
4,cnn,CNN,Banu Ibrahim,All 23andMe ancestry kits are on sale right now,"23andMe, who is slashing the price of all three of its signature DNA kits. The 23andMe Ancestry and Traits Service ($79, originally $99; 23andme.com and amazon.com), Health and Ancestry Service ($99, originally $199; 23andme.com and amazon.com) and the VIP He…",https://www.cnn.com/2019/11/01/cnn-underscored/23andme-dna-kit-sale/index.html,https://cdn.cnn.com/cnnnext/dam/assets/191101123540-underscored-23andme-lead-super-tease.jpg,2019-11-01T17:26:39Z,"We're already in the thick of major holiday sales, and one of the best markdowns we've seen so far is from 23andMe, which has cut prices on all three of its signature DNA kits. 
23andMe is arguably the biggest name in the DNA kit space. Its Ancestry service … [+2114 chars]",0,0.0,0.0,7.0,0.0
57,the-irish-times,The Irish Times,"Colm Keena, Sorcha Pollak",Cyclist dies after being in collision with cement truck in Dublin,Eight cyclists have died on Irish roads so far this year,https://www.irishtimes.com/news/crime-and-law/cyclist-dies-after-being-in-collision-with-cement-truck-in-dublin-1.4069178,https://www.irishtimes.com/image-creator/?id=1.4069191&origw=1440,2019-11-01T10:43:52Z,"A cyclist has died in a road traffic collision at a junction to the rear of Dublins St Jamess Hospital.
Gardaí confirmed a cement mixer was turning left off the South Circular Road at the junction with Brookfield Road when it was involved in a collision with… [+2741 chars]",0,4.0,0.0,15.0,0.0
26,the-new-york-times,The New York Times,Tracey Tully and Nate Schweber,Owe Lunch Money? Don’t Plan on Going to Prom,A New Jersey district will allow principals to block students from participating in some school activities if they have large unpaid lunch bills.,https://www.nytimes.com/2019/11/01/nyregion/cherry-hill-lunch-elizabeth-warren.html,https://static01.nyt.com/images/2019/10/31/nyregion/00njlunch/00njlunch-facebookJumbo.jpg,2019-11-01T15:08:52Z,"Her Twitter post drew a range of responses. This is not what a 1st world country looks like. How savage, one person wrote. 
Another challenged Ms. Warren from the right, writing that they had filled up their cars gas tank that day and no Democrat offered to … [+1116 chars]",0,4109.0,1184.0,483.0,0.0
64,business-insider,Business Insider,Tanza Loudenback,A free 30-minute exercise could make a surprising difference in how much you save for retirement,"Simply spending time thinking about your ideal retirement can lead to better savings habits, according to a survey of working Americans from Lincoln Financial Group. Those who had already envisioned their ideal retirement were over two times more likely to sa…",https://www.businessinsider.com/envisioning-ideal-retirement-could-help-save-more-money,https://image.businessinsider.com/5dbb522ee0ee7e60ce7e0f64?width=1200&format=jpeg,2019-11-01T14:29:16Z,"Do you ever visualize how your retirement will look? Where you'll live, what you'll do most days, whether you'll travel, or volunteer, or go all in on your hobby.
According to new research from Lincoln Financial Group, whether or not you mentally plan out yo… [+2132 chars]",0,9.0,0.0,1529.0,0.0
47,the-irish-times,The Irish Times,Stephen Collins,Subscriber Only: Stephen Collins: Stop the dangerous guff about a united Ireland,It is essential the Government is clear in rejecting Sinn Féin’s Border poll demand,https://www.irishtimes.com/							/opinion/stephen-collins-stop-the-dangerous-guff-about-a-united-ireland-1.4068320	,https://www.irishtimes.com/image-creator/?id=1.4068315&origw=1440,2019-11-01T06:00:00Z,"The incessant chatter among politicians and commentators in the Republic about the prospect of a united Ireland in the wake of Brexit is guff, but it is deeply dangerous guff which has the capacity to destabilise the already fragile political settlement in th… [+234 chars]",1,,,,
79,the-new-york-times,The New York Times,Annie Correal,The Secret Shop of Forgotten New York Treasures,How a meticulously crammed sewing-machine repair store became an accidental museum.,https://www.nytimes.com/2019/11/01/nyregion/garment-district-antique-collector.html,https://static01.nyt.com/images/2019/11/01/nyregion/01garment1/01garment1-facebookJumbo.jpg,2019-11-01T09:00:23Z,"Hecht looks small from the street. The storefront is narrow, and its yellow sign, faded by time and pigeon slurry, is easy to miss amid a busy pizzeria, the Consulate General of Guyana and an upscale trattoria.
Inside, though, the shop stretches the length o… [+1110 chars]",0,13.0,4.0,23.0,0.0
