,source_id,source_name,author,title,description,url,url_to_image,published_at,content,top_article,engagement_reaction_count,engagement_comment_count,engagement_share_count,engagement_comment_plugin_count
39,the-irish-times,The Irish Times,Jess Murphy,Cauliflower and chickpea curry,"1. Place a large saucepan on a medium heat. 2. Add a small bit of oil and the coriander seeds to the pan. Once fragrant add the onions and ginger. Sweat down for eight-10 minutes, until the onions have softened. 3. Add the spices (cumin, turmeric and curry po…",https://www.irishtimes.com/life-and-style/food-and-drink/recipes/cauliflower-and-chickpea-curry-1.4037608,https://www.irishtimes.com/image-creator/?id=1.4037606&origw=1440,2019-10-12T05:00:00Z,"Ingredients
<ul><li>Olive oil</li><li>1tsp coriander seeds</li><li>1 medium white onion, chopped</li><li>Half a thumb of ginger, finely chopped</li><li>2tsp cumin</li><li>2tsp turmeric</li><li>2tsp curry powder</li><li>1 head of cauliflower, cut into florets… [+1015 chars]",0,0.0,0.0,0.0,0.0
9,newsweek,Newsweek,Asher Stockler,Folsom Prison Inmate Pleads Guilty to Directing Sex and Drug Trafficking Ring From Prison Cell,"Largely operating in Tidewater, Virginia, the trafficking ring involved 10 adult women and two underage girls.",https://www.newsweek.com/foster-gaines-folsom-prison-sex-drugs-trafficking-1464814,https://d.newsweek.com/en/full/1535615/folsom-state-prison.jpg,2019-10-12T14:55:57Z,"A Folsom State Prison inmate has pleaded guilty to operating a drug and sex trafficking ring from his prison cell in Represa, California, where he was already serving an eight-year sentence for directing the prostitution of another woman.
The defendant, Fost… [+3112 chars]",0,0.0,0.0,0.0,0.0
40,cbs-news,CBS News,CBS News,Kevin McAleenan resigns as homeland security secretary,Kevin McAleenan on Friday resigned from his post at the helm of the Department of Homeland Security. President Trump announced the resignation on Twitter.,https://www.cbsnews.com/video/kevin-mcaleenan-trumps-homeland-security-secretary-resigns/,https://cbsnews1.cbsistatic.com/hub/i/r/2019/10/12/1c6f2516-f3ff-4692-96d0-9025ff9cab2c/thumbnail/1200x630/ea44d2a33f9e4fcab83759bd061e7619/cbsn-fusion-kevin-mcaleenan-trumps-homeland-security-secretary-resigns-thumbnail-369966-640x360.jpg,2019-10-12T00:14:32Z,,0,0.0,0.0,4.0,0.0
25,cnn,CNN,"Barbara Starr and Ryan Browne, CNN",Exclusive: Military leader of Syrian Kurds tells US 'you are leaving us to be slaughtered',"The commander of the Kurdish-led Syrian Democratic Forces told a senior US diplomat, ""You are leaving us to be slaughtered,"" demanding to know whether the US is going to do anything to protect Syrian Kurds as Turkey continues its military operation targeting …",http://us.cnn.com/2019/10/12/politics/syrian-kurds-us-turkey-military-operation/index.html,https://cdn.cnn.com/cnnnext/dam/assets/191011170645-05-trump-1011-super-tease.jpg,2019-10-12T15:08:52Z,"(CNN)The commander of the Kurdish-led Syrian Democratic Forces told a senior US diplomat, ""You are leaving us to be slaughtered,"" demanding to know whether the US is going to do anything to protect Syrian Kurds as Turkey continues its military operation targe… [+5290 chars]",1,0.0,0.0,0.0,0.0
4,cbs-news,CBS News,CBS/AP,Turkish forces capture key border town as troops push further into Syria,It marks their most significant gain since the assault started,https://www.cbsnews.com/news/turkey-syria-assault-forces-capture-key-border-town-as-troops-push-further-into-syria-today-2019-10-12/,https://cbsnews2.cbsistatic.com/hub/i/r/2019/10/12/5fd24c03-80ce-467f-afe9-c7add4e5697e/thumbnail/1200x630/e7f7477443b812760b28464135003558/turkey3.jpg,2019-10-12T16:05:14Z,"Ceylandpinar, Turkey — Turkey's military said it captured a key Syrian border town under heavy bombardment Saturday as its offensive against Kurdish fighters pressed into its fourth day. Turkish troops entered central Ras al-Ayn, according to Turkey's Defense… [+2772 chars]",0,925.0,504.0,146.0,0.0
22,cnn,CNN,"Victoria Cavaliere, CNN Business",Boeing's board strips CEO of chairman role,Boeing CEO Dennis Muilenburg has been stripped of his role as chairman as the company struggles to get its grounded 737 Max jets cleared to fly again.,https://www.cnn.com/2019/10/12/business/boeing-ceo-chairman-role-muilenburg/index.html,https://cdn.cnn.com/cnnnext/dam/assets/190710112530-boeing-737-grounded-super-tease.jpg,2019-10-12T13:16:09Z,,0,511.0,245.0,157.0,0.0
2,cnn,CNN,"Daniel Gallan and Amanda Davies, CNN","Max Verstappen, backed by Orange Army, targets 2020 F1 glory","At just 22, Max Verstappen has already reached some notable milestones. In 2015 he became the youngest driver to compete in a Formula 1 race. A year later he crossed the finish line in Spain as the youngest winner of an F1 race.",https://edition.cnn.com/2019/10/12/sport/max-verstappen-formula-1-spt-intl/index.html,https://cdn.cnn.com/cnnnext/dam/assets/191012170911-max-verstappen-f1-3-super-tease.jpg,2019-10-12T17:37:35Z,,0,0.0,0.0,55.0,0.0
61,abc-news,ABC News,Becky Perlow,This is a food truck that will have tongues and tails wagging. Duck neck and chicken hearts on the menu,"While most Seattle residents are fast asleep under their 800-thread count comforters during the wee hours of Saturday morning, Dawn Ford is crawling out of bed.By 3:30 a.m., Dawn has showered, brushed her teach, thrown her reddish-brown hair into a messy",https://abcnews.go.com/US/food-truck-tongues-tails-wagging-duck-neck-chicken/story?id=66116754,https://s.abcnews.com/images/US/dog-food-truck-14-ht-jef-191010_hpMain_16x9_992.jpg,2019-10-12T09:23:37Z,"While most Seattle residents are fast asleep under their 800-thread count comforters during the wee hours of Saturday morning, Dawn Ford is crawling out of bed.
By 3:30 a.m., Dawn has showered, brushed her teach, thrown her reddish-brown hair into a messy bu… [+9002 chars]",0,1752.0,209.0,302.0,0.0
74,bbc-news,BBC News,https://www.facebook.com/bbcnews,Witchfinder General Matthew Hopkins: Play 'heals' wounds in Essex,The play Sisterhood is visiting sites where an infamous 16th Century torturer plied his trade.,https://www.bbc.co.uk/news/uk-england-essex-49931945,https://ichef.bbci.co.uk/news/1024/branded_news/5014/production/_109100502_sisterhoodbyjoliebooth7856photopaulafash.jpg,2019-10-12T08:20:33Z,"Image copyrightPaula FashImage caption
 Many women were held at Colchester Castle before being tried and executed in Chelmsford during the English Civil War period (1642-51), said Philip Cunningham
A woman is attempting to ""heal the wounds"" caused by the in… [+2862 chars]",0,130.0,16.0,32.0,0.0
2,business-insider,Business Insider,Alex Morrell,"Trump said he made the 'biggest deal ever' with China for farmers, but a written resolution to the trade war is still a long way off","President Donald Trump tweeted on Saturday that an initial trade agreement with China was the ""greatest and biggest deal ever,"" citing wins for US farmers and billions in Boeing plane sales. The US and China reached an agreement Friday in which Trump suspende…",https://www.businessinsider.com/trump-claims-trade-win-china-but-deal-still-far-off-2019-10,https://image.businessinsider.com/5da1e35d4af9090649125292?width=1200&format=jpeg,2019-10-12T16:59:59Z,"President Donald Trump on Saturday took to Twitter to tout victory in an initial trade agreement the US and China reached the day before, calling it the ""greatest and biggest deal ever made for our Great Patriot Farmers in the history of our Country.""
But bo… [+3819 chars]",0,103.0,104.0,22.0,0.0
34,business-insider,Business Insider,Patrick Coffee,"Esports, Comic-Con, and momfluencers: How the US Army is revamping its multi-billion-dollar marketing plan","The US Army has struggled to recruit new soldiers and prove the value of its $400 million annual advertising budget in recent years. Its new marketing leaders told Business Insider they would shift toward digital, data-driven marketing and away from linear TV…",https://www.businessinsider.com/us-army-marketing-esports-comiccon-momfluencers-2019-10,https://image.businessinsider.com/5da0da30cc4a0a1b407f2243?width=1200&format=jpeg,2019-10-12T11:00:00Z,"The US Army isn't just any advertiser.
While membership in the military has dropped significantly since the 1970s, the largest wing of the American armed forces spends around $400 million dollars annually on marketing to recruit and retain soldiers, accordin… [+2362 chars]",0,22.0,8.0,27.0,0.0
36,cbs-news,CBS News,Li Cohen,New York first state requiring menstrual product ingredient lists,Governor Andrew Cuomo signed the bill the same day as the United Nation's International Day of the Girl,https://www.cbsnews.com/news/menstrual-cycle-new-york-becomes-first-state-requiring-menstrual-product-ingredient-lists/,https://cbsnews3.cbsistatic.com/hub/i/r/2019/10/12/7e2f0346-a6f0-49d2-8744-691f5cb68ffc/thumbnail/1200x630/b02e78d692776ddcc39c9e4ebe853fec/gettyimages-1078781836.jpg,2019-10-12T01:01:12Z,New York Governor Andrew Cuomo signed a law Friday helping women navigate menstrual products on the same day as the United Nation's International Day of the Girl. The legislation will make New York the first state in the country to require companies to print … [+2313 chars],0,1856.0,579.0,195.0,0.0
18,newsweek,Newsweek,Aristos Georgiou,High School Teen Who Exposed Racist Group Chat That Discussed Killing Black Babies Was 'Hurt' By School's Response,"In order to gain access the group, the teen changed her avatar to a white face. She said she had believed the school would take the right actions but thought it had not.",https://www.newsweek.com/high-school-teen-racist-group-chat-white-students-killing-black-babies-slavery-1464800,https://d.newsweek.com/en/full/1535594/smartphones.jpg,2019-10-12T12:15:31Z,"A North Carolina high school freshman exposed a group chat involving several white students who exchanged racist remarks and disturbing comments discussing violence against black people, according to reports.
Fourteen-year-old Cenayia Edwardswho is a black s… [+3753 chars]",0,164.0,39.0,64.0,0.0
26,the-new-york-times,The New York Times,Tobias Grey,"Tinker, Tailor, Writer, Spy","John le Carré takes aim at Brexit and Boris Johnson in his new novel, “Agent Running in the Field.”",https://www.nytimes.com/2019/10/12/books/john-le-carre-agent-running-in-the-field.html,https://static01.nyt.com/images/2019/10/12/books/12Lecarre1/12Lecarre1-facebookJumbo.jpg,2019-10-12T09:00:14Z,"When John le Carré was running agents for the British secret intelligence service MI6 in the early 1960s, there were certain qualities he looked for in a candidate. Gregariousness, cocktail party charm, the ability to hold ones drink all of that mattered, of … [+1312 chars]",1,188.0,57.0,267.0,0.0
38,cbs-news,CBS News,Sharyn Alfonsi,Kevin McAleenan in April on the southern border,"Almost six months ago, ""60 Minutes"" traveled to the U.S.-Mexico border to see the situation and asked McAleenan how he planned to deal with the largest wave of illegal crossings of families there in a decade",https://www.cbsnews.com/news/from-april-how-kevin-mcaleenan-then-acting-dhs-secretary-planned-to-handle-the-southern-border-2019-10-11/,https://cbsnews2.cbsistatic.com/hub/i/r/2019/10/12/2649e0be-4b13-467e-8d5f-0240c464696e/thumbnail/1200x630/fb430d35d8c5c5a971eadf44d484bc53/ot-ontheborderg.jpg,2019-10-12T00:20:17Z,"Acting Secretary of Homeland Security Kevin McAleenan, the official responsible for implementing the Trump Administration's immigration policies at the southern border, resigned Friday. In April, early into his tenure, he told correspondent Sharyn Alfonsi tha… [+15141 chars]",0,165.0,59.0,36.0,0.0
22,cnn,CNN,,Hear Donald Trump say 'I don't know' if Rudy Giuliani is still his personal attorney - CNN Video,CNN's Don Lemon examines President Donald Trump's answer when asked by reporters if Rudy Giuliani is still his personal attorney.,http://us.cnn.com/videos/politics/2019/10/12/rudy-giuliani-trump-attorney-question-lemon-ctn-vpx.cnn,https://cdn.cnn.com/cnnnext/dam/assets/191011224350-trump-super-tease.jpg,2019-10-12T17:08:39.3417253Z,Chat with us in Facebook Messenger. Find out what's happening in the world as it unfolds.,1,0.0,0.0,0.0,0.0
12,business-insider,Business Insider,Kat Tenbarge,Gamers say they earn more money on Facebook than on Twitch and YouTube - Business Insider,"Video game streaming is a hugely profitable industry, and Facebook Gaming is jumping in. Its partnered gamers say they're reaping the benefits, too.",http://www.businessinsider.com/gamers-earn-more-money-facebook-gaming-twitch-youtube-mixer-streaming-2019-10,https://image.businessinsider.com/5d97996672fd82156a2b3ddc?width=1200&format=jpeg,2019-10-12T15:24:40Z,"As an industry, video games generated $120 billion last year. If the gaming industry was a country, it would rank within the top 100 GDPs in the world.
And not only does that industry involve people buying video games to play themselves, but there's also a r… [+12654 chars]",1,146.0,11.0,33.0,0.0
77,abc-news,ABC News,The Associated Press,Opera star Jessye Norman's funeral set for Georgia hometown,"World-famous performers, civil rights leaders and others gathering for the funeral of international opera star Jessye Norman in her Georgia hometown",https://abcnews.go.com/Entertainment/wireStory/opera-star-jessye-normans-funeral-set-georgia-hometown-66226557,https://s.abcnews.com/images/Entertainment/WireAP_49e050a4979a4f9fb5fb99a0b0d71ef0_16x9_992.jpg,2019-10-12T05:14:01Z,"World-famous performers, civil rights leaders and people who know her good works are gathering in international opera star Jessye Norman's Georgia hometown for her funeral.
Norman will be laid to rest Saturday afternoon at the William B. Bell Auditorium in A… [+554 chars]",0,0.0,0.0,1.0,0.0
13,al-jazeera-english,Al Jazeera English,,"A tale of two brothers: Poland, politics, and the press","The populist Law and Justice party is hoping for re-election, and this public broadcaster may help it secure victory.",https://www.aljazeera.com/programmes/listeningpost/2019/10/tale-brothers-poland-politics-press-191012093939791.html,,2019-10-12T10:06:04Z,,0,0.0,0.0,3.0,0.0
16,business-insider,Business Insider,Patrick Coffee,US Army is using esports and momfluencers to revamp its marketing - Business Insider,"Struggling to recruit from Gen Z, the Army plans to move its massive ad budget from TV to digital and focus on tech jobs over combat.",http://www.businessinsider.com/us-army-marketing-esports-comiccon-momfluencers-2019-10,https://image.businessinsider.com/5da0da30cc4a0a1b407f2243?width=1200&format=jpeg,2019-10-12T11:00:00Z,"The US Army isn't just any advertiser.
While membership in the military has dropped significantly since the 1970s, the largest wing of the American armed forces spends around $400 million dollars annually on marketing to recruit and retain soldiers, accordin… [+2362 chars]",1,0.0,0.0,0.0,0.0
12,cnn,CNN,"Ravi Ubha, CNN",Coco Gauff becomes youngest tennis finalist in 15 years,"Coco Gauff, a ""lucky loser,"" became the youngest tennis finalist since 2004 when the 15-year-old American beat Andrea Petkovic at a tournament in Linz, Austria. It has been a week of firsts for Gauff in Austria.",https://edition.cnn.com/2019/10/12/tennis/coco-gauff-tennis-first-final-intl-spt/index.html,https://cdn.cnn.com/cnnnext/dam/assets/191012154432-gauff-super-tease.jpg,2019-10-12T15:36:58Z,"(CNN)Under normal circumstances, Coco Gauff wouldn't have made the main draw at this week's tournament in Linz, Austria. 
But after getting a bit of luck, the 15-year-old has taken full advantage to become the WTA's youngest tennis finalist since Nicole Vaid… [+602 chars]",0,16.0,0.0,138.0,0.0
72,espn,ESPN,,Redskins place TE Reed (concussion) on IR,"Redskins TE Jordan Reed, who has not played since suffering a concussion during the third preseason game on Aug. 22, has been placed on injured reserve.",http://espn.go.com/nfl/story/_/id/27828361/redskins-place-te-jordan-reed-injured-reserve,https://a1.espncdn.com/combiner/i?img=%2Fphoto%2F2018%2F1111%2Fr462282_1296x729_16%2D9.jpg,2019-10-12T17:38:31Z,"The Washington Redskins are placing tight end Jordan Reed on injured reserve, the team announced Saturday.
Reed has not played in the regular season after suffering a concussion during Washington's third preseason game against the Atlanta Falcons on Aug. 22.… [+124 chars]",1,0.0,0.0,0.0,0.0
10,newsweek,Newsweek,Jeanine Marie Russaw,K-pop Group BTS Accused of Catering to 'Authoritarian Regime' After Historic Concert in Riyadh,"On Friday, the seven-member boy band became the first outside artists to play a solo stadium gig in the country—arriving per the request of Saudi Crown Prince Mohammad Bin Salman.",https://www.newsweek.com/bts-concert-saudi-arabia-backlash-1464812,https://d.newsweek.com/en/full/1535616/bts.jpg,2019-10-12T14:40:32Z,"The hugely-famous K-pop group BTS are facing backlash from fans following a now historic performance in Saudi Arabia.
On Friday, the seven-member boy band became the first non-Arab artists to play a stadium gig in the countryarriving per the request of Saudi… [+3051 chars]",0,5.0,1.0,2.0,0.0
42,reuters,Reuters,Reuters Editorial,"Zimbabwe court rules doctors strike illegal, should return to work","A Zimbabwean court has ordered doctors on a 40-day strike over pay to return to work within 48 hours, after a ruling that their boycott was illegal.",https://www.reuters.com/article/us-zimbabwe-health-idUSKBN1WR0E8,https://s4.reutersmedia.net/resources_v2/images/rcom-default.png,2019-10-12T13:07:00Z,"HARARE (Reuters) - A Zimbabwean court has ordered doctors on a 40-day strike over pay to return to work within 48 hours, after a ruling that their boycott was illegal. 
The Labour Court’s judgment late on Friday says that members of the Zimbabwe Hospital Doc… [+1282 chars]",0,0.0,0.0,5.0,0.0
4,bbc-news,BBC News,,Scottish Women's Cup semi-finals: 'It's our cup' - Hibs assistant Stewart McGuire,"The Scottish Women's Cup is ""our cup"" says Hibernian assistant head coach Stewart McGuire as they prepare for Sunday's semi-final with Motherwell.",https://www.bbc.co.uk/sport/football/50028131,https://ichef.bbci.co.uk/onesport/cps/624/cpsprodpb/13AC4/production/_109208508_hunter.jpg,2019-10-12T16:48:59Z,"Hibernian have won the Scottish Women's Cup three years in a row
The Scottish Women's Cup is ""our cup"" says Hibernian assistant head coach Stewart McGuire as they prepare for Sunday's semi-final with Motherwell.
Hibs have won the trophy three years in a row… [+2495 chars]",0,0.0,0.0,0.0,0.0
43,cnn,CNN,"Leah Asmelash, CNN",A Republican candidate for sheriff preemptively released a photo of himself in blackface,"Craig Stivender is running for sheriff in Colleton County, South Carolina. As part of his campaign ad, he released a photo of himself in blackface.",https://www.cnn.com/2019/10/12/us/blackface-craig-stivender-south-carolina-campaign-trnd/index.html,https://cdn.cnn.com/cnnnext/dam/assets/191010161108-stivender-blackface-split-super-tease.jpg,2019-10-12T04:59:19Z,,0,153.0,83.0,208.0,0.0
73,espn,ESPN,Marly RiveraESPN Writer ,"Yankees include Hicks, Sabathia on ALCS roster","Aaron Hicks, who last played on Aug. 3 because of an elbow injury, and CC Sabathia were both among the 25 players included on the Yankees' roster for the American League Championship Series.",http://espn.go.com/mlb/story/_/id/27828219/yankees-include-aaron-hicks-cc-sabathia-alcs-roster,https://a1.espncdn.com/combiner/i?img=%2Fphoto%2F2019%2F1012%2Fr611744_1296x729_16%2D9.jpg,2019-10-12T16:38:00Z,"HOUSTON -- Three weeks ago, outfielder Aaron Hicks was a candidate for Tommy John surgery. Now he's a part of the New York Yankees' American League Championship Series 25-man roster.
Hicks, who last played on Aug. 3 and was placed on the 60-day injured list … [+3076 chars]",1,0.0,0.0,0.0,0.0
22,abc-news,ABC News,The Associated Press,Indiana trooper dies in crash while headed to help colleague,"Get breaking national and world news, broadcast video coverage, and exclusive interviews. Find the top news online at ABC news.",https://abcnews.go.com/US/wireStory/indiana-trooper-dies-crash-headed-colleague-66231048,,2019-10-12T15:25:54Z,"An Indiana state trooper has been killed in a car crash while he was headed to help another trooper.
Indiana State Police said in a news release that 27-year-old Peter R. Stephan of Lafayette died late Friday after his car struck a utility pole in Tippecanoe… [+487 chars]",0,0.0,0.0,0.0,0.0
12,cbs-news,CBS News,CBS/AP,Powerful typhoon makes landfall in Japan as earthquake strikes,Typhoon Hagibis is forecast to be Japan's worst typhoon in six decades,https://www.cbsnews.com/news/typhoon-hagibis-japan-hit-by-powerful-typhoon-makes-landfall-as-earthquake-strikes-today-2019-10-12/,https://cbsnews1.cbsistatic.com/hub/i/r/2019/10/12/cb818b7f-d049-4c02-abc9-6efcbb41991c/thumbnail/1200x630/c8ac5c2a6e077979f8819b13921a26d8/japan2.jpg,2019-10-12T13:28:07Z,"A heavy downpour and strong winds pounded Tokyo and surrounding areas on Saturday as a powerful typhoon forecast to be Japan's worst in six decades made landfall southwest of the city. Shortly before the storm made landfall an earthquake shook the area.
The … [+3093 chars]",1,3680.0,444.0,1403.0,0.0
5,business-insider,Business Insider,Mark Matousek,I rented a Tesla Model 3 on the car-sharing app Turo with almost no human interaction — and it was clear why the app is great for millennials,"I used a peer-to-peer car-sharing app, Turo, for the first time when I rented a Tesla Model 3 sedan at the end of September. While I initially had concerns about pickup and dropoff logistics, I found the entire rental experience to be more seamless than I'd e…",https://www.businessinsider.com/renting-a-tesla-model-3-turo-tips-review-2019-10,https://image.businessinsider.com/5d92218f2e22af46832c6365?width=1200&format=jpeg,2019-10-12T15:37:00Z,"Mark Matousek/Business Insider
The car-sharing market has grown rapidly in recent years, from around 350,000 global users in 2006, to around 7 million in 2015. 
The rise of smartphones has only made it easier for people to rent out their cars when they're n… [+604 chars]",0,1.0,0.0,4.0,0.0
41,bbc-news,BBC News,,Southend United v AFC Wimbledon,Live coverage of Saturday's League One game between Southend United and AFC Wimbledon.,https://www.bbc.co.uk/sport/football/49942794,https://ichef.bbci.co.uk/onesport/cps/624/cpsprodpb/15C36/production/_90724198_football_getty.jpg,2019-10-12T12:46:02Z,,0,3.0,0.0,6.0,0.0
11,business-insider,Business Insider,Mark Matousek,One thing cruise-ship passengers do that's terrible for some workers - Business Insider,Some cruise-ship workers have seen their pay decrease since cruise lines moved from cash tips to automatic gratuity.,http://www.businessinsider.com/one-thing-cruise-ship-passengers-do-thats-terrible-for-some-workers-2018-12,https://image.businessinsider.com/5c212483bd773018410c0dc3?width=1200&format=jpeg,2019-10-12T16:21:00Z,"Cruise-ship passengers used to tip workers in cash, but in recent decades, most cruise lines have begun adding gratuity charges to passengers' bills. Doing so can be convenient for passengers, but the shift has been harmful for some workers, maritime lawyer M… [+1460 chars]",1,1984.0,1810.0,714.0,0.0
8,cnn,CNN,,Military leader of Syrian Kurds tells US 'you are leaving us to be slaughtered',,https://www.cnn.com/collections/intl-turkey-syria-offensive-1012/,,2019-10-12T16:18:10Z,,0,0.0,0.0,47.0,0.0
26,the-irish-times,The Irish Times,Sylvia Thompson,Dublin ‘must look beyond semi-detached housing’,"Time for capital to look at co-housing and co-living, event told",https://www.irishtimes.com/news/social-affairs/dublin-must-look-beyond-semi-detached-housing-1.4048881,https://www.irishtimes.com/image-creator/?id=1.4048880&origw=1440,2019-10-12T11:33:41Z,"It is time for people who live in Dublin to look beyond semi-detached homes as the ideal housing option, a leading Irish architect said.
Speaking in Dublin at the Open House Big Debate on What Kind of City Do You Want? Dominic Stevens, director at JFOC Archi… [+3300 chars]",0,113.0,52.0,12.0,0.0
53,the-irish-times,The Irish Times,Amanda Bell,Surfacing by Kathleen Jamie: Digging deep on several fronts,A fascination with archaeology runs through the Scottish poet’s collection of essays,https://www.irishtimes.com/culture/books/surfacing-by-kathleen-jamie-digging-deep-on-several-fronts-1.4032795,https://www.irishtimes.com/image-creator/?id=1.4032794&origw=1440,2019-10-12T05:00:00Z,"Book Title:Surfacing
ISBN-13:978-1908745811
Author:Kathleen Jamie
Publisher:Sort of Books
Guideline Price:£12.99
Some folks say time is a spiral, that what goes around comes around, that events remote to one another can wheel back into proximity. This co… [+4659 chars]",0,6.0,0.0,3.0,0.0
17,the-irish-times,The Irish Times,David Raleigh,Three teens stabbed at Limerick beauty spot where gangs of youths gather,14-year-old old boy one of three teenagers treated for stab wounds,https://www.irishtimes.com/news/crime-and-law/three-teens-stabbed-at-limerick-beauty-spot-where-gangs-of-youths-gather-1.4048913,https://www.irishtimes.com/image-creator/?id=1.4048912&origw=1440,2019-10-12T14:05:26Z,"Gardaí are investigating after three males teenagers received stab wounds in series of attacks overnight in Limerick. 
The attacks occurred in the vicinity of Corbally Baths, near the Mill Road.
When gardaí responded to the area they discovered an ambulance… [+2101 chars]",0,18.0,4.0,10.0,0.0
